Title,Year,Genres,Directors,Writers,Cast,Plot,Runtime,Country,Language,Awards,Rating,MovieCode
The Truman Show,1998,"Comedy, Drama",Peter Weir,Andrew Niccol,"Jim Carrey, Laura Linney, Noah Emmerich, Natascha McElhone, Holland Taylor, Brian Delate, Blair Slater, Peter Krause, Heidi Schanz, Ron Taylor","Since birth, a big fat lie defines the well-organised but humdrum life of the kind-hearted insurance salesman and ambitious explorer, Truman Burbank. Utterly unaware of the thousands of cleverly hidden cameras watching his every move, for nearly three decades, Truman's entire existence pivots around the will and the wild imagination of the ruthlessly manipulative television producer, Christof--the all-powerful TV-God of an extreme 24/7 reality show: The Truman Show. As a result, Truman's picturesque neighbourhood with the manicured lawns and the uncannily perfect residents is nothing but an elaborate state-of-the-art set, and the only truth he knows is what the worldwide television network and its deep financial interests dictate. Do lab rats know they are forever imprisoned?",['103'],United States,English,,8.2,120382
The Twilight Saga: Breaking Dawn - Part 1,2011,"Adventure, Drama, Fantasy, Romance, Thriller",Bill Condon,Nothing from IMDB,"Taylor Lautner, Gil Birmingham, Billy Burke, Sarah Clarke, Ty Olsson, Kristen Stewart, Ashley Greene, Jackson Rathbone, Peter Facinelli, Elizabeth Reaser","Bella and Edward celebrate their wedding, but, after their honeymoon on Isle Esme, things take a turn for the worse when Bella realizes she is pregnant. As the baby grows at an abnormally fast rate and causes many health problems to Bella, Edward and the wolf pack fear that she may give birth to an immortal child. But the Cullens will do everything they can to ensure that both Bella and the unborn child remain safe.",['117'],United States,"English, Portuguese",,4.9,1324999
The Ultimate Gift,2006,"Drama, Family, Romance",Michael O. Sajbel,Nothing from IMDB,"James Garner, Bill Cobbs, Lee Meriwether, George Lee, Brett Rice, D. David Morin, Abigail Breslin, Ali Hillis, Drew Fuller, Mircea Monroe","Jason thought his inheritance was going to be the gift of money and lots of it. Was he ever in for a big surprise. Based on the best-selling book ""The Ultimate Gift"" by Jim Stovall, the story sends trust fund baby Jason Stevens on an improbable journey of discovery, having to answer the ultimate question: ""What is the relationship between wealth and happiness?"" Jason had a very simple relationship with his impossibly wealthy Grandfather, Howard ""Red"" Stevens. He hated him. No heart-to-heart talks, no warm fuzzies, just cold hard cash. So of course he figured that when Red died, the whole ""reading of the will"" thing would be another simple cash transaction, that his Grandfather's money would allow him to continue living in the lifestyle to which he had become accustomed. But what Red left him was anything but simple. Red instead devised a plan for Jason to experience a crash course on life. Twelve tasks, which Red calls ""gifts,"" each challenging Jason in an improbable way, the accumulation of which would change him forever.",['118'],United States,"English, Spanish",,7.3,482629
The Vanishing of Flight 370,2019,"Documentary, History",LEMMiNO,LEMMiNO,LEMMiNO,,['25'],Nothing from IMDB,Nothing from IMDB,,9.3,15421940
The Vow,2012,"Drama, Romance",Michael Sucsy,Nothing from IMDB,"Rachel McAdams, Channing Tatum, Jessica Lange, Sam Neill, Jessica McNamee, Wendy Crewson, Tatiana Maslany, Lucas Bryant, Scott Speedman, Joey Klein","Leo and Paige are a couple who just got married. After an accident, Paige is left unconscious, and when she awakes she doesn't remember Leo. Her parents, whom she hasn't seen since she and Leo got together, come and visit her. She can't believe that she hasn't seen them for such a long time. Leo wants to bring her home with him but her parents want her to go with them. She goes with Leo but when she doesn't recognize anything, she goes to her parents. And she wonders why did she cut off contact with her family. She also runs into her ex and wonders why they broke up. Leo tries to win her back by courting her again.",['104'],"United States, Australia, France, Canada, Germany, Brazil, United Kingdom, China",English,,6.8,1606389
The Walk,2015,"Adventure, Biography, Drama, History",Robert Zemeckis,Nothing from IMDB,"Joseph Gordon-Levitt, Guillaume Baillargeon, Émilie Leclerc, Mark Trafford, Inka Malovic, Lucas Ramacière, Martin Lefebvre, Philippe Bertrand, Laurence Deschênes, Patricia Tulasne","Twelve people have walked on the moon, but only one man - Philippe Petit (Joseph Gordon-Levitt) - has ever, or will ever, walk in the immense void between the World Trade Center towers. Guided by his real-life mentor, Papa Rudy (Ben Kingsley), and aided by an unlikely band of international recruits, Petit and his gang overcome long odds, betrayals, dissension and countless close calls to conceive and execute their mad plan. Robert Zemeckis, the director of such marvels as Forrest Gump, Cast Away, Back to the Future, Polar Express and Flight, again uses cutting edge technology in the service of an emotional, character-driven story. With innovative photorealistic techniques and IMAX 3D wizardry, The Walk is true big-screen cinema, a chance for moviegoers to viscerally experience the feeling of reaching the clouds. The film, a PG-rated, all-audience entertainment for moviegoers 8 to 80, unlike anything audiences have seen before, is a love letter to Paris and New York City in the 1970s, but most of all, to the Towers of the World Trade Center.",['123'],United States,"English, French, Czech",,7.3,3488710
The Wishing Tree,2012,"Family, Romance",Terry Ingram,Michael J. Murray,"Jason Gedrick, Erica Cerra, Richard Harmon, Amitai Marmorstein, Emmalyn Estrada, Teryl Rothery, John Innes, Cole Grabinsky, Erica Carroll, Carrie Genzel",,['86'],United States,English,,6.3,2339739
The Wolverine,2013,"Action, Sci-Fi",James Mangold,"Mark Bomback, Scott Frank","Hugh Jackman, Tao Okamoto, Rila Fukushima, Hiroyuki Sanada, Svetlana Khodchenkova, Brian Tee, Hal Yamanouchi, Will Yun Lee, Ken Yamamura, Famke Janssen","In modern day Japan, Wolverine is out of his depth in an unknown world as he faces his ultimate nemesis in a life-or-death battle that will leave him forever changed. Vulnerable for the first time and pushed to his physical and emotional limits, he confronts not only lethal samurai steel but also his inner struggle against his own near-immortality, emerging more powerful than we have ever seen him before.",['126'],"United States, United Kingdom, Japan","English, Japanese",,6.7,1430132
The Woman in Black,2012,"Drama, Fantasy, Horror, Thriller",James Watkins,Nothing from IMDB,"Emma Shorey, Molly Harmon, Ellisa Walker-Reid, Sophie Stuckey, Daniel Radcliffe, Misha Handley, Jessica Raine, Roger Allam, Lucy May Barker, Indira Ainger","In London, solicitor Arthur Kipps still grieves over the death of his beloved wife Stella on the delivery of their son Joseph four years before. His employer gives him a last chance to keep his job, and he is assigned to travel to the remote village of Crythin Gifford to examine the documentation of the Eel Marsh House that belonged to the recently deceased Mrs. Drablow. Arthur befriends Daily on the train and the man offers a ride to him to the Gifford Arms inn. Arthur has a cold reception and the owner of the inn tells that he did not receive the request of reservation and there is no available room. The next morning, Arthur meets solicitor Jerome who advises him to return to London. However, Arthur goes to the isolated manor and soon he finds that Eel Marsh House is haunted by the vengeful ghost of a woman dressed in black. He also learns that the woman lost her son, drowned in the marsh, and she seeks revenge, taking the children of the terrified locals.",['95'],"United Kingdom, Canada, United States, Sweden",English,,6.4,1596365
The 12th Man,2017,"Drama, History, Thriller, War",Harald Zwart,Petter Skavlan,"Thomas Gullestad, Jonathan Rhys Meyers, Marie Blokhus, Mads Sjøgård Pettersen, Geir Vegar Hoel, Håkon T. Nielsen, Eirik Risholm Velle, Daniel Frikstad, Eric Dirnes, Alexander Zwart","True World War II story about Jan Baalsrud, one of the 12 saboteurs sent in 1943 from England to the Nazi-occupied Northern Norway. After their boat is sunk by the Germans, Jan goes on the run towards neutral Sweden. However, the brutal weather conditions turn out to possibly be an even greater foe than the Nazi patrols.",['135'],Norway,"Norwegian, German, English, Saami",,7.3,3300980
