Title,Year,Genres,Directors,Writers,Cast,Plot,Runtime,Country,Language,Awards,Rating,MovieCode
I Love You Phillip Morris,2009,"Biography, Comedy, Crime, Drama, Romance","Glenn Ficarra, John Requa",Nothing from IMDB,"Jim Carrey, Ewan McGregor, Leslie Mann, Rodrigo Santoro, Antoni Corone, Brennan Brown, Michael Mandell, Annie Golden, Marylouise Burke, David Jensen","Steven Russell is happily married to Debbie, and a member of the local police force when a car accident provokes a dramatic reassessment of his life. Steven becomes open about his homosexuality and decides to live life to the fullest - even if it means breaking the law. Steven's new, extravagant lifestyle involves cons and fraud and, eventually, a stay in the Texas State Penitentiary where he meets sensitive, soft-spoken Phillip Morris. His devotion to freeing Phillip from jail and building the perfect life together prompts Steven to attempt and often succeed at one impossible con after another.",['102'],"France, United States","English, Spanish",,6.6,1045772
I Origins,2014,"Drama, Mystery, Romance, Sci-Fi",Mike Cahill,Mike Cahill,"Michael Pitt, Steven Yeun, Astrid Bergès-Frisbey, Brit Marling, Dorien Makhloghi, Charles Woods Gray, John Schiumo, Farasha Baylock, Ako, Christopher Santamaria","""I Origins"" begins when graduate student Ian Gray is researching the evolution of human eyes with Karen and Kenny, in order to prove that eyes have evolved instead of ""appeared"" as creationists claim. His fascination with eyes takes him into areas that have profound personal and cultural consequences.",['106'],United States,"English, Hindi",,7.3,2884206
Hello Monster,2015,"Action, Crime, Mystery, Romance, Thriller",Nothing from IMDB,Kwon Ki-yeong,"Seo In-Guk, Jang Na-ra, Park Bo-gum, Choi Won-young, Kim Jae-young, Son Seung-Won, Lee Cheon-hee, Min Sung-wuk, Choi Deok-moon, Lim Ji-eun","When a serial killer strikes women who all have a similar appearance, the police department's Special Crime Investigation Team is stumped. While Cha Ji An (Jang Na Ra), an elite detective, and her fellow colleagues are assessing the latest crime scene, the mysterious Lee Hyun (Seo In Guk) shows up and instantly assesses the trademark attributes of the killer. Hyun is a genius criminal profiler with a degree in criminal psychology who received an anonymous email that brought him to the crime scene all the way from the United States. The serial killer seems to be sending a personal message to Hyun with the clues he leaves behind, and Hyun wonders if it could be related to an escaped criminal ""monster"" from his childhood who killed his father and was responsible for the disappearance of his younger brother. Ji An has known Hyun since childhood and is ecstatic to see her childhood crush again, but Hyun doesn't seem to remember her. With no leads to capture the serial killer, Ji An and her colleagues solicit Hyun's help. Can Hyun and Ji An solve the case and find answers to their pasts?",['70'],South Korea,Korean,,7.7,4803738
I Saw the Devil,2010,"Action, Crime, Thriller",Jee-woon Kim,Nothing from IMDB,"Lee Byung-hun, Choi Min-sik, Jeon Gook-hwan, Chun Ho-jin, San-ha Oh, Yoon-seo Kim, Choi Moo-seong, In-seo Kim, Kim Kap-su, Lee Jun-hyuk","On a dark road, taxi driver Kyung-chul (Min-sik Choi) comes across a scared female motorist stranded in a broken-down vehicle. He pulls over -- but not to help her. When the woman's head is discovered in a local river, her devastated fiancé, Kim Soo-hyeon (Byung-hun Lee), a trained secret agent, becomes obsessed with hunting down her killer. Once he finds Kyung-chul, things get twisted. After brutally beating the murderer, Kim lets him go free, and a demented game of cat and mouse begins.",['144'],South Korea,Korean,,7.8,1588170
I Smile Back,2015,"Drama, Mystery, Romance",Adam Salky,Nothing from IMDB,"Josh Charles, Skylar Gaertner, Shayne Coleman, Sarah Silverman, Nick Taylor, Mia Barron, Thomas Sadoski, Sean Reda, Cynthia Darlow, Kristin Griffith","Laney Brooks does bad things. Married with kids, she takes the drugs she wants, sleeps with the men she wants, disappears when she wants. Now, with the destruction of her family looming, and temptation everywhere, Laney makes one last desperate attempt at redemption.",['85'],United States,English,,6.2,3640682
Ice Age: Collision Course,2016,"Animation, Adventure, Comedy, Family, Sci-Fi","Michael Thurmeier, Galen T. Chu",Nothing from IMDB,"Stephanie Beatriz, Robert Cardone, Neil deGrasse Tyson, Adam Devine, Jesse Tyler Ferguson, Max Greenfield, Jessie J, Queen Latifah, Denis Leary, John Leguizamo","Scrat's epic pursuit of his elusive acorn catapults him outside of Earth, where he accidentally sets off a series of cosmic events that transform and threaten the planet. To save themselves from peril, Manny, Sid, Diego, and the rest of the herd leave their home and embark on a quest full of thrills and spills, highs and lows, laughter and adventure while traveling to exotic new lands and encountering a host of colorful new characters.",['94'],"United States, United Kingdom","English, Russian, Ukrainian",,5.7,3416828
Identity Thief,2013,"Comedy, Crime, Drama",Seth Gordon,Nothing from IMDB,"Jason Bateman, Melissa McCarthy, Jon Favreau, Amanda Peet, Tip 'T.I.' Harris, Genesis Rodriguez, Morris Chestnut, John Cho, Robert Patrick, Eric Stonestreet","Sandy Patterson (Jason Bateman) gets a nice call confirming his name and other identifying information. The next thing he knows, a spa in Florida is reminding him of his appointment and his credit cards are maxed out. With his identity stolen, Sandy leaves his wife, kids and job to literally bring the thief to justice in Colorado. Keeping tabs on the other Sandy (Melissa McCarthy) and run-ins with bounty hunters is harder than he was expecting, and ultimately the cross-country trip is going to find both Sandys learning life tips from one another.",['111'],United States,"English, Spanish",,5.7,2024432
Immortals,2011,"Action, Drama, Fantasy, Romance",Tarsem Singh,"Charley Parlapanides, Vlas Parlapanides","Henry Cavill, Mickey Rourke, Stephen Dorff, Freida Pinto, Luke Evans, John Hurt, Joseph Morgan, Anne Day-Jones, Greg Bryk, Alan Van Sprang","Eons after the Gods won their mythic struggle against the Titans, a new evil threatens the land. Mad with power, King Hyperion (Mickey Rourke) has declared war against humanity. Amassing a bloodthirsty army of soldiers disfigured by his own hand, Hyperion has scorched Greece in search of the legendary Epirus Bow, a weapon of unimaginable power forged in the heavens by Ares (Daniel Sharman). Only he who possesses this bow can unleash the Titans, who have been imprisoned deep within the walls of Mount Tartaros since the dawn of time and thirst for revenge. In the King's hands, the bow would rain destruction upon mankind and annihilate the Gods. But ancient law dictates the Gods must not intervene in man's conflict. They remain powerless to stop Hyperion, until a peasant named Theseus (Henry Cavill) comes forth as their only hope. Secretly chosen by Zeus (Luke Evans), Theseus must save his people from Hyperion and his hordes. Rallying a band of fellow outsiders, including visionary Priestess Phaedra (Freida Pinto) and cunning slave Stavros (Stephen Dorff), one hero will lead the uprising, or watch his homeland fall into ruin and his Gods vanish into legend.",['110'],"United States, Canada, United Kingdom","English, Greek",,6.0,1253864
In the Mood for Love 2001,2001,"Short, Comedy",Kar-Wai Wong,Kar-Wai Wong,"Maggie Cheung, Tony Leung Chiu-wai","A story of fast food and dessert, the third segment of Wong's planned film ""Three Stories About Food"", inspired by a book by Jean Anthelme Brillat-Savarin. The owner of a convenience store (played by Tony Leung) and his customer (played by Maggie Cheung), in an analysis of the sensation of tasting, illustrating the erotic properties of cakes, tarts, and cream puffs.",['32'],Nothing from IMDB,Nothing from IMDB,,7.7,20833922
