Title,Year,Genres,Directors,Writers,Cast,Plot,Runtime,Country,Language,Awards,Rating,MovieCode
Chamatkar,1992,"Comedy, Drama, Fantasy",Rajiv Mehra,Nothing from IMDB,"Naseeruddin Shah, Shah Rukh Khan, Urmila Matondkar, Malvika Tiwari, Shammi Kapoor, Deven Verma, Tinnu Anand, Anjana Mumtaz, Anjan Srivastav, Rakesh Bedi","Sunder Srivastava (Shah Rukh Khan) is a young graduate whose main ambition in life is to fulfil his father's dream of starting a school on his half-acre property in his village, though he has no funds to execute his plans. Sunder's childhood friend Prem, a seasoned conman who operates in Bombay, convinces the gullible Sunder to mortgage his land to the village Zamindar (landlord) and fly to Dubai. Prem promises Sunder a handsomely paying teacher's job in Dubai that would give Sunder enough money to start his school within two years. Sunder does as told and arrives in Bombay to meet Prem; not only is there no sign of his friend at the station, but Sunder also gets unwittingly involved with a petty thief who robs him of all his luggage and money. To make matters worse, when Sunder reaches Prem's lodge, he finds an apologetic letter from Prem informing him that he has used his Rs.10,000 to get himself to Dubai instead and will one day repay him. Now at the end of his tether, Sunder wanders into an old Christian cemetery. Sitting on an old grave, Sunder gives vent to his frustrations and strikes the tombstone in helplessness, but immediately apologizes to the deceased. This amuses the ghost of Amar Kumar-- alias Marco (Naseeruddin Shah)-- who was killed and thrown into the grave 20 years before, only to rise at Sunder's apology. Marco explains to a frightened Sunder that he was a notorious Crime Don, who at the behest of his romantic partner Savitri (Malvika Tiwari), had resolved to give up crime, but was shot by his protégé Kunta the day after the wedding. Marco seeks Sunder's help in getting even with his killers and promises Sunder a job and a place to stay in return. Marco manages to get Sunder a post in a school run by his father-in-law (Shammi Kapoor). Everyone grows fond of the new games teacher, including Marco's daughter (Urmila Matondkar). This last, a vivacious girl of an age with Sunder, courts the boy at least twice, accompanied by her largely invisible father. Kunta (Tinnu Anand) makes an attempt to capture the playing ground on the college campus. The college is starved of funds and proposes a cricket match to collect funds. Sunder and his team are helped by the invisible Marco, who cheats on their behalf and ensures victory. When Sunder tries to tell the others that he can see and talk to Marco, nobody believes him. In a final bid for victory, Kunta captures Sunder, Marco's daughter, and Marco's father-in-law, attempting to bury them alive. Marco rescues them and gives all the criminals led by Kunta a beating. He is about to kill Kunta when Sunder pleads with him not to do so. Marco forgives his enemy and lets him go. In time, Sunder marries Marco's daughter while Marco ascends to heaven. As he goes, Marco warns the children that although he came back to life for a second chance to do the right thing, they will not have the same chance; they therefore must make the best of what chances they have.",['171'],India,Hindi,,6.5,126234
Chandni,1989,"Drama, Musical, Romance",Yash Chopra,Nothing from IMDB,"Sridevi, Rishi Kapoor, Vinod Khanna, Waheeda Rehman, Anupam Kher, Sushma Seth, Achala Sachdev, Beena Banerjee, Manohar Singh, Renu Arya","In one cruel stroke of fate, Chandni (Sridevi) faces life alone, her heart and her dreams shattered as Rohit (Rishi Kapoor) disappears from her life. When she meets Lalit (Vinod Khanna) who is fighting the demons of tragic memories, they both find solace in this new friendship. Lalit's affection gives a new direction to Chandni's life, but Lalit is falling for her and Chandni resigns to destiny, till one day, Rohit knocks on her door. CHANDNI is a classic Yash Chopra love story, softly lyrical, throbbingly beautiful and filled with exquisite locales, lilting melodies and the sound of three hearts hopelessly in love.",['186'],India,Hindi,,6.7,97045
Chandni Bar,2001,"Crime, Drama",Madhur Bhandarkar,Nothing from IMDB,"Tabu, Atul Kulkarni, Rajpal Naurang Yadav, Shri Vallabh Vyas, Vinay Apte, Abhay Bhargava, Ananya Khare, Suhas Palshikar, Uma Shankar Pandey, Varun Vardhan","Mumtaz is a village girl whose family is killed in communal riots. She moves to Mumbai with her uncle, the only family member she has left. They are desperately poor and her uncle persuades her to become a bar girl at Chandni Bar. This is merely temporary, he promises, until he gets a job. Mumtaz is a shy girl who loathes the work, but she forces herself to dance and flirt. However, the uncle doesn't keep his promise; he lives on her earnings, drinking them away, and never gets a job. He adds one final, unforgivable crime to the list when he gets drunk and rapes her. By this time she has caught the eye of a gangster called Potiya Sawant. When she tells Potiya what her uncle did to her, Potiya decides to ""defend her honor."" Potiya shoots the uncle. Mumtaz, bereft of any male protection in the dangerous slums, marries Potiya. She is determined to make the best of things. She leaves the bar and stays home to raise her two children, whom she carefully protects from the world of prostitution and gangs. However, her world unravels again when Potiya is killed. She has to return to the bar to support her children. In the end, she cannot protect them from their sordid surroundings. Her son becomes a killer, her daughter becomes a bar dancer in her turn, and Mumtaz turns to prostitution in a tragic attempt to save her son.",['150'],India,Hindi,,7.6,267363
Charlie Kay Chakkar Mein,2015,Thriller,Manish Srivastav,Nothing from IMDB,"Naseeruddin Shah, Nishant Lal, Disha Arora, Amit Sial, Manasi Rachh, Auroshikha Dey, Sandeep Vasudevan, Vikas Anand, Subrat Dutta, Elena Roxana Maria Fernandes","Our life revolves around perception of truth, in our lives we act only on our ability to judge the truth. Truth though is a fickle thing, paradoxically because it only occurs in absolution; rest is only our interpretation that allows us to live in a certain subjective truth. Addl. Commissioner of Police, Sanket Pujari and the rookie officer, Sameera sit across the television screen to decipher a rare case of multiple homicides caught on camera and this case is going to test their fundamental perception of truth.",['102'],India,Hindi,,4.6,2190820
Chashme Baddoor,2013,"Comedy, Drama",David Dhawan,Nothing from IMDB,"Ali Zafar, Siddharth, Divyendu Sharma, Taapsee Pannu, Rishi Kapoor, Anupam Kher, Bharti Achrekar, Lillete Dubey, Ayaz Khan, Nikhil Pandey","Siddharth , Omi and Jai are close friends and room mates who are studying at Delhi University. Siddharth has completed M.A in Economics and is preparing for PhD. Siddharth is very studious and spends most of his time with books whereas Omi and Jai are busy in chasing girls, watching movies or dramas; only common thing among them is smoking. One day Omi and Jai see a girl who is new to their neighborhood and try to impress her by their tricks; they give up when both of them experience shameful events. After some days, Neha shows up as Chamko washing powder salesgirl to their flat, upon seeing whom Jai and Omi hide quickly. Siddharth sees Neha for the first time and a love story begins. But when his two friends find out, they decide to put an end to their relationship as a revenge to the embarrassment inflicted upon them by the girl. Initially they succeed in separating Siddharth and Neha but later on repent when they find that Siddharth lost his interest in work and study and also likely to end his life. Finally they decide to reunite both. The parallel plot runs between Omi, Jai, Siddharth and Lallan Miyan. Lallan Miyan is the local shopkeeper who sells Cigarettes to Omi and Jai on credit. But as students don't clear his debts, Lallan Miyan tries to follow-up with them to get their dues. A spate of kidnapping (especially of young girls) has started in Delhi. One fine day Omi and his friends along with Neha's grandmother plan to stage a fake kidnapping and get married. But unfortunately she is kidnapped by the real gang and the duo is left in a lurch. The later part of the story revolves how they clear the confusion that she has been in fact kidnapped by real thugs and how she is rescued.",['121'],India,Hindi,,5.4,2229848
Chashme Buddoor,1981,"Comedy, Family, Romance",Sai Paranjpye,Nothing from IMDB,"Farooq Shaikh, Deepti Naval, Saeed Jaffrey, Rakesh Bedi, Ravi Baswani, Leela Mishra, Vinod Doshi, Ranjan Grewal, Amitabh Bachchan, Rekha","Two womanizing slackers, Omi and Jai (Rakesh Bedi and Ravi Baswani respectively) attempt to woo the new girl in the neighbourhood, and fail - miserably. Their third room-mate, shy, and a bookworm - succeeds, much to their chargin. The two scheme up comical ideas to split the two lovebirds, so that their secrets and humiliation are not revealed.",['145'],India,Hindi,,7.9,82162
Chehre,2021,"Drama, Mystery, Thriller",Rumi Jaffery,Nothing from IMDB,"Amitabh Bachchan, Emraan Hashmi, Krystle D'Souza, Annu Kapoor, Rhea Chakraborty, Raghubir Yadav, Dhritiman Chatterjee, Siddhant Kapoor, Samir Soni, Alexx O'Nell","CHEHRE is the story of a man who faces a tough time when faced with retired law professionals. Sameer Mehra (Emraan Hashmi) is the chief of an ad agency called Paradoy. He goes to a hill station somewhere in the North for an ad shoot. But due to a work commitment in Delhi, he leaves from the hill town despite heavy snow. On the way, he takes a shortcut to Delhi but due to a tree fall, he gets stuck. On top of it, his car suddenly breaks down. He then meets Paramjeet Singh Bhullar (Annu Kapoor) who advises him to join him to a friend's place till it's safe to go. Paramjeet takes him to the house of Jagdish Acharya (Dhritiman Chatterjee) where Hariya Jatav (Raghubir Yadav) is already present. Soon, Lateef Zaidi (Amitabh Bachchan) also joins them. The quartet then informs Sameer that they meet every day and play a unique game. As part of this game, they conduct a mock trial since all of them are retired law professionals. While Jagdish Acharya was a retired judge in a nearby court, Paramjeet was defense counsel and Lateef was chief prosecutor. They invite Sameer to play this game. Sameer agrees. The quartet tells him that he'll be the accused in their court of law. Paramjeet would defend him while Lateef would try to prove that he's guilty. Jagdish, meanwhile, would be the judge. Lateef gives Sameer a chance to confess if he has ever done any crime and got away with it. Then they'll try him for that charge. Sameer, however, confidently tells that he has never committed any crime. Lateef then gets a chance to try him for any crime he desires. In the course of their conversation, Sameer blurts out that he used to detest his ex-boss, G S Oswal (Samir Soni) as he was a tyrant. Sameer also reveals that Oswal died recently and that he took over his position. At this, Lateef decides to try him in their court for the 'murder' of Oswal. Sameer is aghast and makes it clear that he hasn't killed him. But Lateef tells the court that he's willing to put his legal reputation at stake and that he'll never play this game ever again if he fails to prove that Sameer hasn't been a part of Oswal's 'murder'. Sameer is a bit apprehensive but then he realizes he need not worry as it's just a game. But his worries vanish instantly when he finds out that Hariya Jatav was not a lawyer or judge. He was actually a hangman and that he has kept the noose ready, should the accused is proven guilty in their court. What happens next forms the rest of the film.",['139'],India,Hindi,,6.2,10309902
Chennai Express,2013,"Action, Comedy, Drama, Romance",Rohit Shetty,Nothing from IMDB,"Deepika Padukone, Shah Rukh Khan, Nikitin Dheer, Sathyaraj, Mukesh Tiwari, Lekh Tandon, Kamini Kaushal, Puvisha Manoharan, Manu Malik, Rakesh Kukreti","Rahul embarks on a journey to a small town in Tamil Nadu to fulfill the last wish of his grandfather: to have his ashes immersed in the Holy water of Rameshwaram. En route, he meets a woman hailing from a unique family down South. As they find love through this journey in the exuberant lands of South India, an unanticipated drive awaits them.",['141'],India,"Hindi, Tamil, English, Marathi",,6.1,2112124
Chhailla Babu,1977,"Action, Crime, Romance, Thriller",Joy Mukherjee,Nothing from IMDB,"Rajesh Khanna, Zeenat Aman, Govardhan Asrani, Om Shivpuri, Padma Khanna, Achala Sachdev, Ranjeet Bedi, Paidi Jairaj, Ravindra Kapoor, Mac Mohan","Rita (Zeenat Aman) is saved from a fatal fall while skiing by a local guide called Chailla Babu (Rajesh Khanna) in Kashmir. Rita finds Chailla in multiple avatars in the course of her tour and they soon become fast friends. However, Rita is forced to return to Mumbai after she is informed that her uncle has been murdered and that Chailla is the prime suspect. Rita decides to kill Chailla and take her revenge but is left baffled when Chailla saves her life from an attacker. Who is Chailla and what is he after? Enjoy watching this crime thriller unfold.",['146'],India,Hindi,,6.6,257475
Chhalaang,2020,"Comedy, Drama, Sport",Hansal Mehta,Nothing from IMDB,"Rajkummar Rao, Nushrratt Bharuccha, Mohd. Zeeshan Ayyub, Saurabh Shukla, Satish Kaushik, Ila Arun, Jatin Sarna, Baljinder Kaur, Naman Jain, Garima Shevi","Chhalaang is a hilarious, yet inspirational journey of Montu, a PT Master from a semi govt. funded school for whom teaching PT is just a job. When circumstances put everything he cares for at stake, including Neelu who he loves, Montu is forced to do what he's never done- TEACH. Through his journey, the film humorously addresses the value of Sports Education in school curriculum.",['136'],India,Hindi,,6.7,8983164
Chhapaak,2020,"Biography, Drama",Meghna Gulzar,Nothing from IMDB,"Deepika Padukone, Vikrant Massey, Madhurjeet Sarghi, Payal Nair, Vaibhavi Upadhyaya, Geeta Agrawal Sharma, Vishal Dahiya, Ankit Bisht, Satish Sharma, Anand Tiwari",,['120'],India,Hindi,,5.4,9614460
Choked,2020,Drama,Anurag Kashyap,Nihit Bhave,"Saiyami Kher, Roshan Mathew, Amruta Subhash, Upendra Limaye, Tushar Dalvi, Rajshri Deshpande, Uday Nene, Parthveer Shukla, Aditya Kumar, Milind Pathak",Sarita Pillai works as a clerk in government based bank and lives with son Sameer and husband Sushant who switches jobs every six months.Sarita's flat faces drainage issues in kitchen basin but Sushant doesn't bother to fix it or call the plumber.Once late night Sarita sees water flushing underneath her basin wherein some zip lock plastic bags pop out which has bundle of 1000 rupee currency notes the very first thing she does is verify the notes from her bank weather it's real.Sarita is confirmed about the notes being real and does it as daily process of gathering bundles from drainage but hides from Sushant soon her lifestyle changes making people question even her character.But October 2016 Indian Prime Minister announces demonetization to ban 500 and 1000 currency notes.,['114'],India,Hindi,,5.7,11651780
Chopsticks,2019,"Comedy, Drama",Sachin Yardi,Nothing from IMDB,"Abhay Deol, Mithila Palkar, Vijay Raaz, Achint Kaur, Benafsha Soonawalla, Abhishek Bhalerao, Abhilash Joshi, Jay Shanker Pandey, Sanjeev Kapoor, Shubhankar Das",,['100'],India,Hindi,,6.5,10243678
Dhoti Lota Aur Chowpatty,1975,Comedy,Mohan Choti,Nothing from IMDB,"Ranjeet Bedi, Laxmi Chhaya, Mohan Choti, Bindu Desai, Jeevan Dhar, Dharmendra, Dulari, Helen, Nasir Hussain, Jagdeep","An assortment of characters living near Juhu, Chowpatty, meet, share comic, romantic, and fight scenes. This movie is remebered for the reverse casting as main heros such as Dharam and Sanjeev have wee bit roles, whereas the wee bit character roles usally played by Mohan Choti, and Farida Jalal, are the main characters. This movie is also remembered for it's songs: ""Dhoti lota aur chowpatty yeh apne pyar ke saathi, eense apna rishta nahta, bakhi sarhi duniya maati..""; ""Chal gai chal gai ishk ki goli chal gai...""; ""Soh bar ki tobah phir bhi dil ne kar diya pyar, pyar, pyar, jo hoga dekha jayega jab ho hi gaya pyar pyar..""; ""Thumak thumak chale chaal hath me kajal ki jori, gora badan, patli kamar...O gori tera roop bada mastana.."".",['139'],India,Hindi,,4.8,315487
Chudail Story,2016,"Horror, Thriller",Surya Lakkoju,Nothing from IMDB,"Preeti Soni, Amal Sherawat, Nidhi Nautiyal, Menaka Lalwani, Akash Rathore, Sorab Rajpurohit, Sunny Charles, Pankaj Berry, Pratyush Uday, Inam Ansari",,['100'],India,Hindi,,2.4,5914630
City Lights,1931,"Comedy, Drama, Romance",Charles Chaplin,Nothing from IMDB,"Virginia Cherrill, Florence Lee, Harry Myers, Al Ernest Garcia, Hank Mann, Charles Chaplin, Johnny Aber, Jack Alexander, T.S. Alexander, Victor Alexander",A tramp falls in love with a beautiful blind girl. Her family is in financial trouble. The tramp's on-and-off friendship with a wealthy man allows him to be the girl's benefactor and suitor.,['87'],United States,"None, English",,8.5,21749
Cocktail,2012,"Comedy, Drama, Romance",Homi Adajania,Nothing from IMDB,"Saif Ali Khan, Deepika Padukone, Diana Penty, Dimple Kapadia, Boman Irani, Yasmin Tippett, Lottie Dosanjh, Tina Desai, Louise Bangay, Manoj Pahwa","The story revolves around Gautam Khanna (Saif Ali Khan), Veronica D'Costa (Deepika Padukone) and Meera Gupta (Diana Penty). Gautam Khanna (Saif Ali Khan) always had a dream to go to London and have a job. His dream is fulfilled and he gets a job. But his mom, Nita (Dimple Kapadia) says that she has to finalize his marriage to a girl and so he has to wait. She finds her perfect 'bahu' in Meera Gupta (Diana Penty). But she does not tell Gautam about this and tells Meera's parents even to not tell Meera. She tells Gautam to take her friend's daughter Meera as she has an assignment in London for 3 days. On the flight, Meera and Gautam befriend each other. In London, Meera has some problems completing her assignment and therefore fails to give it on time. She loses her job but then Gautam consoles her. They go on a beach party and there they meet Veronica D'Costa (Deepika Padukone). After some days of living with each other, Gautam falls in love with Veronica. But the thing that Gautam doesn't know about her is that Veronica is already in love with Jeremy Viegas (Randeep Hooda). Now, Meera has started to fall in love with Gautam and Jeremy has started disliking Veronica because of her choosy behavior and started loving Meera.",['146'],"United Kingdom, India",Hindi,,6.3,2168910
Commando,2013,"Action, Adventure, Thriller",Dilip Ghosh,Ritesh Shah,"Vidyut Jammwal, Hsieh Chang Hai, Nelson Liao Sheng Hua, Ishita Vyas, Sukhwinder Chahal, Sunil Uppal, Chand Kishore, Grant Powell, Jaideep Ahlawat, Darshan Jariwala","Captain Karan Dogra's helicopter crashes on China border during a training. Karan is suspected to spy in China and it becomes difficult for him as well as senior Indian officer's to convince the Chinese government that he wasn't a spy.The Indian Government disowns Karan and he is tortured in China and has to face a trial during a court hearing, he manages to escape via the Himachal-Punjab border and comes across a young girl Simrit whose escaping from Amrit Kanwal (AK 47) who wants to marry Smmrit for political benefits and has control over the whole region.Karan decides to help Simrit a she feels that these are the enemies within the country.",['124'],India,Hindi,,6.3,2658126
Company,2002,"Action, Crime, Drama, Thriller",Ram Gopal Varma,Nothing from IMDB,"Ajay Devgn, Mohanlal, Manisha Koirala, Seema Biswas, Vivek Oberoi, Antara Mali, Akash Khurana, Madan Joshi, Bharat Dabholkar, Ganesh Yadav","Mallik is a henchman of Aslam Bhai, a Mumbai underworld kingpin. He inducts local hothead Chandu into the gang, and the two of them soon form a formidable faction within the gang, eventually displacing Aslam. As the empire grows, however, the two of them start drifting apart.",['142'],India,Hindi,,8.0,296574
Confession of Murder,2012,"Action, Crime, Thriller",Jung Byung-gil,Nothing from IMDB,"Jeong Jae-yeong, Park Shi-hoo, Jung Hae-kyun, Yeong-ae Kim, Choi Won-young, Kim Jong-goo, Jo Eun-ji, Yong Oh, Woong Park, Sung-Woo Bae","After the statute of limitation expires on the murders he has committed, Lee Du-seok publishes an autobiography describing all his murders in great detail. Detective Choi, who investigated Lee's murders 15 years ago starts the chase once again and Han Ji-soo, who lost her daughter to Lee, pledges vengeance. Meanwhile, another killer appears, casting doubt to whether Lee is the real serial killer. The key here is how well the story juggles the truth and how solid the description of the characters' tangled relationships is.",['119'],South Korea,Korean,,7.0,2468774
Countdown,2019,"Horror, Thriller",Justin Dec,Justin Dec,"Elizabeth Lail, Jordan Calloway, Talitha Eliana Bateman, Peter Facinelli, Dillon Lane, Tichina Arnold, Tom Segura, Lana McKissack, Anne Winters, Matt Letscher","At a teenage party, a group of friends download the app Countdown that predicts when the user will die. Courtney sees that she has just a couple of hours to live and does not accept a ride with her drunken boyfriend Evan. She walks home but is killed by a supernatural creature when the timer in her cellphone reaches zero. At the same time she dies, Evan crashes his car and he goes to a hospital where nurse Quinn Harris works. Evan discloses that he is afraid to go into surgery since the app Countdown predicts that he will die at the same time of the surgery. The doctors and nurses of the hospital decide to download the app and Quinn learns that she has only three days of life. When Evan mysterious dies in an accident at the hospital, Quinn buys a new cellphone and finds that the app is also installed. When she meets Matt Monroe in the store's parking lot, she learns that his death is predicted for a couple of hours before hers and they team up to look for a way to break the curse.",['90'],United States,"English, Latin",,5.4,10039344
Court Martial,2020,Drama,"Sourabh Shrivastava, Karwarkar Bhavika",Deepak Swadesh,"Saksham Dayma, Rajeev Khandelwal, Swapnil kiiran Kotriwar, Govind Pandey, Saroj Parida, Col Ravi Sharma, Bhagwan Tiwari",,['120'],India,Hindi,,7.0,11774804
Crook: It's Good to Be Bad,2010,"Action, Crime, Drama, Thriller",Mohit Suri,Nothing from IMDB,"Emraan Hashmi, Neha Sharma, Arjan Bajwa, Mashhoor Amrohi, Kavin Dave, Shella Alan, Francis Chouler, Jeffrey Tangreo Tsoutsos, Aman Hora, Jaideep Suri","When Sub-Inspector Joseph Pinto finds that his foster son, Jai Dixit, sired by a deceased, re-formed gangster, has taken to crime, he arranges for his re-location to Melbourne, and has his name changed to Suraj Bhardwaj. Jai does re-locate there, and gets hired as a taxi-driver. He gets attracted to Suhani, much to the of her brother, Samarth, who wants her to marry Gurdaspur-based Romi Latti, who is also in Melbourne on a university scholarship. With mounting racially-motivated attacks and profiling ('Curry Boy', 'Indian Curry') against Indian students, Samarth actively protests - but Jai refrains from doing so - even after Romi is badly beaten by Caucasian youth. The protest results in violence, and Samarth is arrested. On the day of his discharge, Jai is told by a stripper, Nicole, that plans are afoot to kill Samarth, and he decides to intervene. He does succeed and even accompanies Suhani to the Police Station to identify her brother's attackers. It is here that the police will find out about Jai's background, forcing him and Suhani to go on the run; be blamed for planting a bomb in a bar; while unknown person(s) kill several inter-racial couples.",['121'],India,"Hindi, English",,5.1,1753640
D-Day,2013,"Action, Thriller",Nikkhil Advani,Nothing from IMDB,"Rishi Kapoor, Irrfan Khan, Arjun Rampal, Asif Silavat, Shruti Haasan, Huma Qureshi, Nassar, K.K. Raina, Chandan Roy Sanyal, Imran Hasnee","9 years ago Wali Khan (Irrfan Khan) was sent into Karachi, Pakistan by the Chief of RAW Ashwini Rao (Nasser) to report the activities of The Most Wanted Man in India. 9 days ago Rudra Pratap Singh (Arjun Rampal) Indian Armed Forces, MARCOS unit, Zoya Rehman (Huma Qureshi) RAW Explosives expert, and Aslam, a petty thief from the streets of Mumbai recruited by RAW, infiltrated Pakistan to join Wali Khan and carry out the mission to bring back The Most Wanted Man in India. The man who was going to break all ISI protocol and security and attend his own son's wedding. The man who could on that day be abducted and brought back to India to face justice. 1 day ago everything went according to plan until it all failed. The team sent in to bring The Most Wanted Man in India, did the unthinkable - they carried out the most daring operation and almost got away with it. Almost because, something went horribly wrong.",['153'],India,Hindi,,7.2,2385104
Daas Dev,2018,"Drama, Thriller",Sudhir Mishra,Nothing from IMDB,"Yogesh Raj Mishra, Rahul Bhat, Richa Chadha, Mahesh Chandra Deva, Anil George, Aditi Rao Hydari, Sohaila Kapur, Anurag Kashyap, Ekavali Khanna, Surya Mohan Kulshreshtha",,['140'],India,Hindi,,5.1,4979110
