Title,Year,Genres,Directors,Writers,Cast,Plot,Runtime,Country,Language,Awards,Rating,MovieCode
21,2008,"Crime, Drama, Thriller",Robert Luketic,Nothing from IMDB,"Jim Sturgess, Kevin Spacey, Kate Bosworth, Aaron Yoo, Liza Lapira, Jacob Pitts, Laurence Fishburne, Jack McGee, Josh Gad, Sam Golzari","Ben Campbell is a young, highly intelligent student at M.I.T. in Boston who strives to succeed. Wanting a scholarship to transfer to Harvard School of Medicine with the desire to become a doctor, Ben learns that he cannot afford the $300,000 for the four to five years of schooling as he comes from a poor, working-class background. But one evening, Ben is introduced by his unorthodox math professor Micky Rosa into a small but secretive club of five students, Jill, Choi, Kianna, and Fisher, who are being trained by Professor Rosa in the skill of card counting at blackjack. Intrigued by the desire to make money, Ben joins his new friends on secret weekend trips to Las Vegas where, using their skills of code talk and hand signals, they have Ben make hundreds of thousands of dollars in winning blackjack at casino after casino. Ben only wants to make enough money for the tuition to Harvard and then back out. But as fellow card counter Jill Taylor predicts, Ben becomes corrupted by greed and his arrogance at winning which lets his feelings get in the way, and it also puts Professor Rosa, as well as the group, on the radar of a brutal casino security enforcer named Cole Williams, who holds a personal grudge of some kind against Rosa which threatens to undo everything the students have learned and earned.",['123'],United States,English,,6.8,478087
24 Hours to Live,2017,"Action, Sci-Fi, Thriller",Brian Smrz,"Ron Mita, Jim McClain, Zach Dean","Ethan Hawke, Qing Xu, Paul Anderson, Rutger Hauer, Tyrone Keogh, Nathalie Boltt, Liam Cunningham, Jeremy Yong, Susan Ling Young, Hakeem Kae-Kazim","Making a rare foray into rock 'em, sock 'em action territory, Hawke plays C.I.A. Agent Travis Conrad, who sacrifices everything for his employers, including his family and, ultimately, his own life. No sooner has he shuffled off this mortal coil, though, than he finds himself mysteriously resurrected for one last mission that's timed to last exactly twenty-four hours. Once the countdown clock embedded in his arm reaches zero, he'll once again nod off into an eternal slumber if he hasn't completed his task. Before that happens, expect him to wreak bloody havoc on his targets and his former C.I.A. minders.",['93'],"South Africa, China, United States","English, Chinese",,5.8,5442456
24 Hours to Live,2017,"Action, Sci-Fi, Thriller",Brian Smrz,"Ron Mita, Jim McClain, Zach Dean","Ethan Hawke, Qing Xu, Paul Anderson, Rutger Hauer, Tyrone Keogh, Nathalie Boltt, Liam Cunningham, Jeremy Yong, Susan Ling Young, Hakeem Kae-Kazim","Making a rare foray into rock 'em, sock 'em action territory, Hawke plays C.I.A. Agent Travis Conrad, who sacrifices everything for his employers, including his family and, ultimately, his own life. No sooner has he shuffled off this mortal coil, though, than he finds himself mysteriously resurrected for one last mission that's timed to last exactly twenty-four hours. Once the countdown clock embedded in his arm reaches zero, he'll once again nod off into an eternal slumber if he hasn't completed his task. Before that happens, expect him to wreak bloody havoc on his targets and his former C.I.A. minders.",['93'],"South Africa, China, United States","English, Chinese",,5.8,5442456
25th Hour,2002,Drama,Spike Lee,Nothing from IMDB,"Edward Norton, Philip Seymour Hoffman, Barry Pepper, Rosario Dawson, Anna Paquin, Brian Cox, Tony Siragusa, Levani, Tony Devon, Misha Kuznetsov","The 25th Hour depicts the last day of freedom for a young man before he begins serving a seven-year jail term for drug dealing. Prowling through the city until dawn with his two close male friends and his girlfriend, he is forced to re-examine his life and how he got himself into his predicament, which leads to a shocking, disturbing finale.",['135'],United States,English,,7.6,307901
3:10 to Yuma,2007,"Action, Crime, Drama, Western",James Mangold,Nothing from IMDB,"Russell Crowe, Christian Bale, Logan Lerman, Dallas Roberts, Ben Foster, Peter Fonda, Vinessa Shaw, Alan Tudyk, Luce Rains, Gretchen Mol","Rancher Dan Evans heads into Bisbee to clear up issues concerning the sale of his land when he witnesses the closing events of a stagecoach robbery led by famed outlaw Ben Wade. Shortly thereafter, Wade is captured by the law in Bisbee and Evans finds himself one of the escorts who will take Wade to the 3:10 to Yuma train in Contention for the reward of $200. Evans' effort to take Wade to the station is in part an effort to save his land but also part of an inner battle to determine whether he can be more than just a naive rancher in the eyes of his impetuous and gun slinging son William Evans. The transport to Contention is hazardous and filled with ambushes by Indians, pursuits by Wade's vengeful gang and Wade's own conniving and surreptitious demeanor that makes the ride all the more intense.",['122'],United States,"English, Chinese",,7.6,381849
41,2012,"Drama, Sci-Fi",Glenn Triggs,Glenn Triggs,"Chris Gibson, Dafna Kronental, David Macrae, Shane Lee, Keith Gordon, Nick Antoniades, Menik Gooneratne, Glen Hancox, Robert Plazek, Dillon Becker",,['80'],Australia,English,,6.2,2319739
47 Meters Down,2017,"Horror, Mystery, Thriller",Johannes Roberts,"Johannes Roberts, Ernest Riera","Mandy Moore, Claire Holt, Chris Johnson, Yani Gellman, Santiago Segura, Matthew Modine, Mayra Juarez, Axel Mansilla","Two sisters are exploring the deep blue sea until something goes wrong. As they submerge 47m they encounter a creature that only wants flesh and blood. As they fight their way back to the top, they shortly run out of oxygen. With only an hour left they're not only racing against time they are racing against life and death.",['89'],"United Kingdom, United States","Tamil, Telugu, English, Spanish",,5.6,2932536
47 Ronin,2013,"Action, Drama, Fantasy",Carl Rinsch,Nothing from IMDB,"Keanu Reeves, Hiroyuki Sanada, Kô Shibasaki, Tadanobu Asano, Min Tanaka, Jin Akanishi, Masayoshi Haneda, Hiroshi Sogabe, Takato Yonemoto, Hiroshi Yamada","While hunting in the forest, Lord Asano of Ako and his samurai find a young half-breed and take him with them to live in the castle. Several years later, Lord Asano holds a tournament to welcome the Shogun to Ako. The night after the tournament, Lord Asano is bewitched into hurting Lord Kira of Nagato, and is punished into committing seppuku by the Shogun. Realizing that it was a Lord Kira's evil plot, the samurais and the half-breed sets out for revenge against the Shogun's order.",['128'],"United States, United Kingdom, Japan, Hungary","English, Japanese",,6.2,1335975
47 Ronin,2013,"Action, Drama, Fantasy",Carl Rinsch,Nothing from IMDB,"Keanu Reeves, Hiroyuki Sanada, Kô Shibasaki, Tadanobu Asano, Min Tanaka, Jin Akanishi, Masayoshi Haneda, Hiroshi Sogabe, Takato Yonemoto, Hiroshi Yamada","While hunting in the forest, Lord Asano of Ako and his samurai find a young half-breed and take him with them to live in the castle. Several years later, Lord Asano holds a tournament to welcome the Shogun to Ako. The night after the tournament, Lord Asano is bewitched into hurting Lord Kira of Nagato, and is punished into committing seppuku by the Shogun. Realizing that it was a Lord Kira's evil plot, the samurais and the half-breed sets out for revenge against the Shogun's order.",['128'],"United States, United Kingdom, Japan, Hungary","English, Japanese",,6.2,1335975
5 to 7,2014,"Comedy, Drama, Romance",Victor Levin,Victor Levin,"Anton Yelchin, Bérénice Marlohe, David Shannon, Lambert Wilson, Amina Robinson, Milo Mungier Jacob, Brune de Drueille Senecterre, Alan Gilbert, Julian Bond, Daniel Boulud","In New York, an aspiring novelist has a cinq-a-sept affair with the beautiful wife of a French diplomat. Cultures, world views, personal ethics and dietary preferences clash as love deepens, with remarkable results. Romance, drama and comedy.",['95'],United States,"English, French",,7.1,2486678
