Title,Year,Genres,Directors,Writers,Cast,Plot,Runtime,Country,Language,Awards,Rating,MovieCode
Courage Under Fire,1996,"Action, Drama, Mystery, Thriller, War",Edward Zwick,Patrick Sheane Duncan,"Denzel Washington, Meg Ryan, Lou Diamond Phillips, Michael Moriarty, Matt Damon, Bronson Pinchot, Seth Gilliam, Regina Taylor, Zeljko Ivanek, Scott Glenn","The pilot of a rescue copter, Captain Karen Walden, died shortly before her helicopter crew was rescued after it crashed in Desert Storm. It first appears that she made a spectacular rescue of a downed helicopter crew, then held her own crew together to fight off the Iraqis after her copter crashed. Lt. Colonel Serling, who is struggling with his own demons from Desert Storm, is assigned to investigate her worthiness for the Medal of Honor. But some conflicting accounts, from her crew and soldiers in the area, cause him to question whether she deserves it.",['116'],United States,"English, Arabic",,6.6,115956
Deja Vu,2006,"Action, Crime, Sci-Fi, Thriller",Tony Scott,"Bill Marsilii, Terry Rossio","Denzel Washington, Paula Patton, Val Kilmer, Jim Caviezel, Adam Goldberg, Elden Henson, Erika Alexander, Bruce Greenwood, Rich Hutchman, Matt Craven","In the wake of a devastating terrorist attack on a slow New Orleans ferry, A.T.F. special agent Doug Carlin joins an experimental top-secret government program to find the bomber. Designed to bend the very fabric of time, this state-of-the-art technology enables the user to observe a detailed representation of what happened four days and six hours in the past, tracking the target's every move prior to the attack. However, the man responsible for the deadly explosion is bound to strike again. Can Carlin figure out who he is, when he is always precisely four days behind?",['126'],"United States, United Kingdom",English,,7.1,453467
Flight,2012,"Drama, Thriller",Robert Zemeckis,John Gatins,"Nadine Velazquez, Denzel Washington, Carter Cabassa, Adam C. Edwards, Tamara Tunie, Brian Geraghty, Kelly Reilly, Conor O'Neill, Charlie E. Schmidt, Will Sherrod","Whip Whitaker is a commuter airline pilot. While on a flight from Orlando to Atlanta something goes wrong and the plane starts to fly erratically. With little choice Whip crashes the plane and saves almost all on board. When he wakes up in the hospital, his friend from the airline union introduces him to a lawyer who tells him there's a chance he could face criminal charges because his blood test reveals that he was intoxicated with alcohol and cocaine. He denies being impaired, so while an investigation is underway, he is told to keep his act together. However, letting go of his addiction is not as easy as it seems...",['138'],"United States, United Arab Emirates",English,,7.3,1907668
Inside Man,2006,"Crime, Drama, Mystery, Thriller",Spike Lee,Russell Gewirtz,"Denzel Washington, Clive Owen, Jodie Foster, Christopher Plummer, Willem Dafoe, Chiwetel Ejiofor, Carlos Andrés Gómez, Kim Director, James Ransone, Bernie Rachelle","Composed and meticulous, the soft-spoken and ingenious bank robber, Dalton Russell, has orchestrated the perfect heist--shortly, the Manhattan bank at the corner of Wall Street and Broadway along with dozens of hostages will be his to command. Try as he might, the rough hostage negotiator, Keith Frazier, is always one step behind the criminal mastermind--and what is more disheartening--the institution's silver-haired founder, Arthur Case, recruits the intelligent problem-fixer, Madeline White, to retrieve something of paramount importance. However, the thieves seem to procrastinate intentionally, when they should be rushing into action. Will Arthur and Madeline get what they want this time?",['129'],United States,"English, Albanian, Spanish, Polish",,7.6,454848
Inside Man,2006,"Crime, Drama, Mystery, Thriller",Spike Lee,Russell Gewirtz,"Denzel Washington, Clive Owen, Jodie Foster, Christopher Plummer, Willem Dafoe, Chiwetel Ejiofor, Carlos Andrés Gómez, Kim Director, James Ransone, Bernie Rachelle","Composed and meticulous, the soft-spoken and ingenious bank robber, Dalton Russell, has orchestrated the perfect heist--shortly, the Manhattan bank at the corner of Wall Street and Broadway along with dozens of hostages will be his to command. Try as he might, the rough hostage negotiator, Keith Frazier, is always one step behind the criminal mastermind--and what is more disheartening--the institution's silver-haired founder, Arthur Case, recruits the intelligent problem-fixer, Madeline White, to retrieve something of paramount importance. However, the thieves seem to procrastinate intentionally, when they should be rushing into action. Will Arthur and Madeline get what they want this time?",['129'],United States,"English, Albanian, Spanish, Polish",,7.6,454848
Inside Man,2006,"Crime, Drama, Mystery, Thriller",Spike Lee,Russell Gewirtz,"Denzel Washington, Clive Owen, Jodie Foster, Christopher Plummer, Willem Dafoe, Chiwetel Ejiofor, Carlos Andrés Gómez, Kim Director, James Ransone, Bernie Rachelle","Composed and meticulous, the soft-spoken and ingenious bank robber, Dalton Russell, has orchestrated the perfect heist--shortly, the Manhattan bank at the corner of Wall Street and Broadway along with dozens of hostages will be his to command. Try as he might, the rough hostage negotiator, Keith Frazier, is always one step behind the criminal mastermind--and what is more disheartening--the institution's silver-haired founder, Arthur Case, recruits the intelligent problem-fixer, Madeline White, to retrieve something of paramount importance. However, the thieves seem to procrastinate intentionally, when they should be rushing into action. Will Arthur and Madeline get what they want this time?",['129'],United States,"English, Albanian, Spanish, Polish",,7.6,454848
Inside Man,2006,"Crime, Drama, Mystery, Thriller",Spike Lee,Russell Gewirtz,"Denzel Washington, Clive Owen, Jodie Foster, Christopher Plummer, Willem Dafoe, Chiwetel Ejiofor, Carlos Andrés Gómez, Kim Director, James Ransone, Bernie Rachelle","Composed and meticulous, the soft-spoken and ingenious bank robber, Dalton Russell, has orchestrated the perfect heist--shortly, the Manhattan bank at the corner of Wall Street and Broadway along with dozens of hostages will be his to command. Try as he might, the rough hostage negotiator, Keith Frazier, is always one step behind the criminal mastermind--and what is more disheartening--the institution's silver-haired founder, Arthur Case, recruits the intelligent problem-fixer, Madeline White, to retrieve something of paramount importance. However, the thieves seem to procrastinate intentionally, when they should be rushing into action. Will Arthur and Madeline get what they want this time?",['129'],United States,"English, Albanian, Spanish, Polish",,7.6,454848
John Q,2002,"Crime, Drama, Thriller",Nick Cassavetes,James Kearns,"Gabriela Oltean, Denzel Washington, Kimberly Elise, Ron Annabelle, Daniel E. Smith, David Thornton, Barry G. King, Laura Harring, Kevin Connolly, Larissa Laskin","John Quincy Archibald's son Michael collapses while playing baseball as a result of heart failure. John rushes Michael to a hospital emergency room where he is informed that Michael's only hope is a transplant. Unfortunately, John's insurance won't cover his son's transplant. Out of options, John Q. takes the emergency room staff and patients hostage until hospital doctors agree to do the transplant.",['116'],United States,"English, Spanish",,7.1,251160
