Title,Year,Genres,Directors,Writers,Cast,Plot,Runtime,Country,Language,Awards,Rating,MovieCode
Ghoomer,2023,"Drama, Sport",R. Balki,Nothing from IMDB,"Amitabh Bachchan, Saiyami Kher, Abhishek Bachchan, Shabana Azmi, Ivanka Das, Angad Bedi, Shivendra Singh Dungarpur, Akshay Joshi, Piyush Raina, Pari Sharma","Anina, a young woman batting prodigy, loses her right hand in an unfortunate accident on the eve of her international cricketing debut. An unsympathetic, failed, and frustrated cricketer enters her life, gives her a new dream, and transforms her fate with the most innovative training, making her play for the Indian cricket team again, but this time as a bowler. Ghoomer is the new style of bowling they invent to bamboozle the opposition.",['135'],India,Hindi,,7.7,20913276
Gran Turismo,2023,"Action, Adventure, Drama, Sport",Neill Blomkamp,Nothing from IMDB,"David Harbour, Orlando Bloom, Archie Madekwe, Takehiro Hira, Darren Barnet, Geri Horner, Djimon Hounsou, Josha Stradowski, Daniel Puig, Maeve Courtier-Lilley","Jann is an avid gamer from Cardiff who spends his days playing Gran Turismo, refusing to succeed in the real world. Meanwhile, in Tokyo, Danny, a marketing manager for the Nissan automobile corporation, is running an advertising campaign and, together with the management of Gran Turismo, hatches a plan to launch a competition inviting gamers to try their luck in real racing cars. Needing help organizing an event, Danny turns to Jack, a former racing driver and incorrigible cynic. When fate brings Jann together with Danny and Jack, the gamer becomes the driver of a Nissan racing car, plunging headlong into the fight for a place in the sun in the competitive world of real racing.",['134'],"United States, Japan",English,,7.2,4495098
Haddi,2023,"Crime, Drama",Akshat Ajay Sharma,Nothing from IMDB,"Nawazuddin Siddiqui, Anurag Kashyap, Mohd. Zeeshan Ayyub, Ivanka Das, Ila Arun, Vipin Sharma, Saurabh Sachdeva, Rajesh Kumar, Shriidhar Dubey, Saharsh Kumar Shukla",,['134'],India,Hindi,,5.7,22188452
Hands of Stone,2016,"Biography, Drama, Sport",Jonathan Jakubowicz,Jonathan Jakubowicz,"Edgar Ramírez, Robert De Niro, Usher, Rubén Blades, Ana de Armas, Pedro Perez, Óscar Jaenada, John Turturro, Ellen Barkin, Jurnee Smollett","Follows the life of Roberto Duran, who made his professional debut in 1968 as a 16-year-old and retired in 2002 at age 50. In June 1980, he defeated Sugar Ray Leonard to capture the WBC welterweight title but shocked the boxing world by returning to his corner in the November rematch, saying 'no mas' (no more).",['111'],"Panama, United States","English, Spanish",,6.6,1781827
Heart of Stone,2023,"Action, Crime, Thriller",Tom Harper,Nothing from IMDB,"Jing Lusi, Jamie Dornan, Paul Ready, Gal Gadot, Enzo Cilenti, Joe Reisig, Luca Fiamenghi, Alia Bhatt, Matthias Schweighöfer, Thomas Arnold","Rachel Stone is a charter agent cum technician who works along with a team of MI 6 field agents. The mission is to locate the ""heart"" an AI enabled computer which has the capability of hacking into any software and could cause considerable havoc should it fall into the wrong hands. Keya, a young woman is an Indian computer specialist who is attached to another syndicate. Circumstances bring Rachel and Keya together and they realize that they have a common mission. They then team up to prevent the ""heart"" from falling in the wrong hands.",['122'],United States,English,,5.7,13603966
Hum Dil De Chuke Sanam,1999,"Comedy, Drama, Musical, Romance",Sanjay Leela Bhansali,Nothing from IMDB,"Aishwarya Rai Bachchan, Salman Khan, Ajay Devgn, Zohra Sehgal, Vikram Gokhale, Smita Jaykar, Rekha Rao, Rajeev Verma, Kenneth Desai, Ghanshyam Nayak","When Sameer asks for Nandini's hand in marriage, her family refuses, having already chosen a husband for her. Sameer returns to Italy. When Vanraj, Nandini's husband, realizes that his new bride has been in love with someone else, he is prepared to sacrifice his love for her and take her to Italy to be reunited with her true love, Sameer.",['188'],"India, Hungary",Hindi,,7.4,150992
Inglourious Basterds,2009,"Adventure, Drama, War",Quentin Tarantino,Quentin Tarantino,"Brad Pitt, Mélanie Laurent, Christoph Waltz, Eli Roth, Michael Fassbender, Diane Kruger, Daniel Brühl, Til Schweiger, Gedeon Burkhard, Jacky Ido","In German-occupied France, young Jewish refugee Shosanna Dreyfus witnesses the slaughter of her family by Colonel Hans Landa. Narrowly escaping with her life, she plots her revenge several years later when German war hero Fredrick Zoller takes a rapid interest in her and arranges an illustrious movie premiere at the theater she now runs. With the promise of every major Nazi officer in attendance, the event catches the attention of the ""Basterds"", a group of Jewish-American guerrilla soldiers led by the ruthless Lt. Aldo Raine. As the relentless executioners advance and the conspiring young girl's plans are set in motion, their paths will cross for a fateful evening that will shake the very annals of history.",['153'],"Germany, United States","English, German, French, Italian",,8.4,361748
Jaadugar,1989,"Comedy, Fantasy",Prakash Mehra,Nothing from IMDB,"Amitabh Bachchan, Jaya Prada, Amrita Singh, Pran Sikand, Amrish Puri, Aditya Pancholi, Raza Murad, Vikas Anand, Harbans Darshan M. Arora, Bharat Bhushan","After learning a few magical tricks from his fellow inmate former businessman and ex-jail convict assume the identity of an ascetic named Mahaprabhu Jagatsagar Chintamani so that he can easily use these tricks to con the villagers of Dharampur with a motive of acquiring their wealth for himself. His U.S. returned son, Shankar Narayan refuses to accept this way of living only to consult an expert magician named Goga to put an end to his father's misdeeds. Goga who later changes his name to Gogeshwar manages to outwit Mahaprabhu and take control of his ashram. Feeling satisfy after his deeds has been reached; Shankar then asks Goga to leave but a stubborn will-power Goga refuses to do so as he plans to explain his stubbornness to Shankar at a later date.",['173'],India,Hindi,,4.2,97609
Jaan,1996,"Action, Drama, Romance",Raj Kanwar,Nothing from IMDB,"Ajay Devgn, Twinkle Khanna, Amrish Puri, Rakhee Gulzar, Vivek Mushran, Suresh Oberoi, Shakti Kapoor, Bindu Desai, Saeed Jaffrey, Aruna Irani","Police Commissioner Suryadev Singh is a doting grandfather to his only granddaughter, Kajal. However, unbeknownst to Suryadev, Kajal's life is under threat from his embittered cousin, Vishamber. Vishamber's father had bequeathed his entire estate to his nephew Suryadev instead of Vishamber. Now Vishamber wants to kill Kajal, thus becoming the sole heir to the inheritance. Some goons attempt to kidnap Kajal but a bystander, Karan, fights them off and rescues her. Impressed, Suryadev appoints him as Kajal's bodyguard and they both leave for the town of Sundernagar, which is their ancestral home. However, Suryadev does not know that the kidnapping as well as Karan's rescue of Kajal were staged in order to win Suryadev's trust and that Karan is in fact an assassin hired by Vishamber to kill Kajal.",['170'],India,Hindi,,4.2,151090
Jaane Jaan,2023,"Crime, Drama, Mystery, Thriller",Sujoy Ghosh,Nothing from IMDB,"Kareena Kapoor, Jaideep Ahlawat, Vijay Varma, Saurabh Sachdeva, Naisha Khanna, Karma Takapa, Lin Laishram, Denjam Lepcha, Ujjwal Chopra, Shyam Gopal",,['139'],India,Hindi,,7.0,15748830
Jailer,2023,"Action, Comedy, Crime, Thriller",Nelson Dilipkumar,Nelson Dilipkumar,"Rajinikanth, Mohanlal, Shivarajkumar, Jackie Shroff, Ramya Krishnan, Vinayakan, Tamannaah Bhatia, Sunil, Vasanth Ravi, Yogi Babu","Muthuvel Pandian is a retired jailer living happily with his wife, son, daughter-in-law and grandson. His son who is an Assistant Commissioner of police goes missing while investigating the case of missing temple idols and is presumed dead. The story is about how Muthuvel Pandian goes toe to toe against Varma, the mastermind behind large-scale smuggling of temple idols and treasures, and avenges his son.",['168'],India,"Tamil, Malayalam, Hindi, Telugu, Kannada",,7.1,11663228
Jawan,2023,"Action, Thriller",Atlee,Nothing from IMDB,"Shah Rukh Khan, Nayanthara, Vijay Sethupathi, Deepika Padukone, Sanjay Dutt, Priyamani, Sanya Malhotra, Girija Oak, Lehar Khan, Sanjeeta Bhattacharya","Driven by a desire to rectify societal wrongs, Vikram embarks on a mission to obliterate Kalee and presents the government with a set of demands, setting the stage for an electrifying and high-stakes showdown. The film delivers a strong social message about issues like the corrupt political system, challenges faced by farmers, and flaws in the healthcare system. It emphasizes the power of the index finger during elections as a means for citizens to actively participate in shaping the destiny of their country.",['169'],India,Hindi,,7.0,15354916
Jigsaw,2017,"Horror, Mystery, Thriller","Michael Spierig, Peter Spierig","Josh Stolberg, Pete Goldfinger","Matt Passmore, Tobin Bell, Callum Keith Rennie, Hannah Emily Anderson, Clé Bennett, Laura Vandervoort, Paul Braunstein, Mandela Van Peebles, Brittany Allen, Josiah Black","It has been over a decade since Jigsaw died. However, after a new series of murders occurs, police find themselves chasing after the original Jigsaw Killer - John Kramer. Could John Kramer still be alive or is another killer out there with a different motive?",['92'],"United States, Canada",English,,5.7,3348730
Khufiya,2023,"Action, Biography, Crime, Mystery, Thriller",Vishal Bhardwaj,Nothing from IMDB,"Tabu, Ali Fazal, Wamiqa Gabbi, Azmeri Haque Badhon, Navnindra Behl, Ashish Vidyarthi, Atul Kulkarni, Alexx O'Nell, Shataf Figar, Lalit Parimoo",,['157'],India,Hindi,,6.1,15433600
King of Kotha,2023,"Action, Crime, Drama, Thriller",Abhilash Joshiy,Abhilash N. Chandran,"Dulquer Salmaan, Aishwarya Lekshmi, Nyla Usha, Saran Shakthi, Gokul Suresh, Anikha Surendran, Ritika Singh, Soubin Shahir, Chemban Vinod Jose, Shabeer Kallarakkal",,['174'],India,"Hindi, Telugu, Tamil, Kannada, Malayalam",,6.1,15134398
Krishna Cottage,2004,"Horror, Mystery, Romance",Santram Varma,Abhigyan Jha,"Sohail Khan, Isha Koppikar, Anita Hassanandani Reddy, Rati Agnihotri, Hiten Tejwani, Divya Palat, Vrajesh Hirjee, Raj Zutshi, Shaukat Baig, Bobby Bedi","During the year 1990 Professor-Author Siddharth Das releases his first book 'Kahi Unkahi Baatein' which contain a total of 10 short stories albeit with the last story 'Krishna Cottage' without any ending. A total of fifty thousand copies are printed and distributed to five different cities in India. Three trucks carrying these copies meet with mysterious accidents, two toppling off cliffs, and one catching fire; and one ship sinks losing it's entire consignment. One copy of this book is found and kept under lock and key in the store-room of J.C. College. Then in 2002 collegians Akshay, Kabir, Nupur, Pulit, Shanti, and Manav, induct new-comer, Disha, to their group, and also invite her to the engagement ceremony of Shanti and Manav. The group will soon find out that her induction will set loose a chain of events that will throw their lives in jeopardy as she may be a ferocious shape-changing entity that is out to claim her lover, Amar Khanna, from a past life, and also prevent anyone from reading the last chapter of Professor Das' book.",['124'],India,Hindi,,5.2,408976
Kushi,2023,"Comedy, Drama, Romance",Shiva Nirvana,Nothing from IMDB,"Samantha Ruth Prabhu, Vijay Deverakonda, Jayaram, Saranya Ponvannan, Vennela Kishore, Lakshmi, Murli Sharma, Rohini, Mohammad Ali, Sachin Khedekar",,['163'],India,"Tamil, Kannada, Malayalam, Telugu, English, Kashmiri, Hindi, Urdu",,5.4,15380630
Love Actually,2003,"Comedy, Drama, Romance",Richard Curtis,Richard Curtis,"Bill Nighy, Gregor Fisher, Rory MacGregor, Colin Firth, Sienna Guillory, Liam Neeson, Emma Thompson, Lulu Popplewell, Kris Marshall, Heike Makatsch","Against the backdrop of aged has-been rock star Billy Mack's Christmas themed comeback cover of ""Love Is All Around"", which he knows is crap and makes no bones about it, much to his manager Joe's chagrin as he promotes the record, several interrelated stories about romantic love and the obstacles to happiness through love for Londoners are presented in the five weeks preceding Christmas. Daniel's wife has just died, leaving him to take care of his adolescent stepson Sam by himself. Daniel is uncertain how to deal with Sam and his problems without his wife present, especially in light of a potential budding romance within their household. Juliet and Peter have just gotten married. They believe that Peter's best friend and best man Mark hates Juliet, but won't say so to his or her face. Others looking at the situation from the outside believe Mark is jealous of Juliet, as he is in love with Peter. Jamie, a writer, is taking a writing retreat by himself in rural France following catching his latest girlfriend in an indiscretion. Jamie ends up spending much time in France with Aurelia, the Portuguese woman hired as the housekeeper. The question becomes not only if they can communicate their day-to-day needs with each other as she speaks no English, he speaks no Portuguese, and neither speaks French very well, but communicate what seems to be their increasing mutual attraction to each other. Sarah has been in love with her co-worker Karl for the two years they have worked together, this attraction about which everyone in their workplace knows. Sarah has to decide if she can be forward enough to express this love directly to Karl, especially in light of what has been her personal priority of dealing with a family issue. Harry and Karen have been in a stable long term marriage. His new assistant Mia drops hints to him that she would like them to be romantically involved. Harry has to decide whether to fall to the temptation, especially considering being married to a perceptive wife. Single and relatively young David is the newly elected Prime Minister. At 10 Downing Street, he is attracted to one of the new household servants, Natalie, but isn't sure what to do about it seeing as to their respective positions, the probable public scrutiny, and an incident involving the visiting U.S. President. Socially unaware Colin Frissell believes that the lack of romantic love in his life is all the fault of standoffish British women. As such, he decides to take decisive albeit somewhat unusual geographic action. And John and Judy are movie body doubles. They can communicate with each other straightforwardly while they are simulating sex filming a movie, but they may not be able to translate the feelings behind that simulation in real-life to each other.",['135'],"United Kingdom, France, United States","English, Portuguese, French",,7.6,314331
They/Them,2022,"Horror, Mystery, Thriller",John Logan,John Logan,"Kevin Bacon, Theo Germaine, Anna Chlumsky, Carrie Preston, Quei Tann, Austin Crute, Anna Lore, Monique Kim, Cooper Koch, Darwin del Fabro","Whistler, a gay conversion camp, has been in operation by the same family going back generations. Currently the camp is operated by Owen Whistler (Kevin Bacon) and his wife, Dr. Cora Whistler (Carrie Preston). The Whistlers have a small staff of four: activities director Amy, her gay-conversion-camp-alumni-turned-athletics-director boyfriend Zane, groundskeeper Balthazar, and Molly--the camp counselor who uncovers the horrors of Whistler Camp at the bequest of camper Jordan. A fifth employee emerges as a decoy within the campers. Suddenly, employees are picked off in a murder streak by an unknown assailant.",['104'],United States,English,,3.9,14502344
Mahaanta: The Film,1997,"Action, Crime, Drama, Romance",Afzal Khan,Nothing from IMDB,"Jeetendra, Poonam Dhillon, Sanjay Dutt, Madhuri Dixit, Mohsin Khan, Sumalatha, Amrish Puri, Paresh Rawal, Saeed Jaffrey, Satyendra Kapoor","Young Vijay studies in Good Shepherd High School, lives a wealthy lifestyle in a small scenic town along with his uncle, who is the Inspector General of Police in Bombay, and has a close friend in Raj Malhotra. When both mature, Vijay gets married, while Raj marries Shanti. On his uncle's insistence, Vijay departs to live in Bombay, where he eventually becomes the Police Commissioner. Subsequently Raj, Shanti, and Raj's brother, Sanjay, also re-locate to Bombay, where they are united with Vijay. Then Sanjay falls in love with Jenny and both want to get married much to the chagrin of Mahesh, who wants to marry her at any and all costs. Mahesh is the only son of wealthy and influential Kedar, who manages to convince Edward that it will be Jenny's and Sanjay's best interest if Jenny weds Mahesh. The marriage is arranged, but on that very day, Sanjay steps in, humiliates Kedar, and marries Jenny. That night Sanjay is arrested by none other than Vijay himself and placed in a cell. The next morning he is released and returns home to find that his brother and Bhabhi are both dead. Sanjay swears to avenge their death as well as find out why Vijay betrayed Raj, and arrested him on his wedding night.",,India,Hindi,,4.0,251194
Majnu Chacha,2023,Drama,Nothing from IMDB,Nothing from IMDB,"Bharti Jha, Hiral Radadiya, Arsh Dhir, Niranjan Nalawade, Soni Jha, Monty Rai",,,India,Hindi,,,29427398
Meg 2: The Trench,2023,"Action, Adventure, Horror, Sci-Fi, Thriller",Ben Wheatley,Nothing from IMDB,"Jason Statham, Jing Wu, Shuya Sophia Cai, Cliff Curtis, Page Kennedy, Sergio Peris-Mencheta, Skyler Samuels, Melissanthi Mahut, Whoopie Van Raam, Kiran Sonia Sawar","Get ready for the ultimate adrenaline rush this summer in ""Meg 2: The Trench,"" a literally larger-than-life thrill ride that supersizes the 2018 blockbuster and takes the action to higher heights and even greater depths with multiple massive Megs and so much more. Dive into uncharted waters with Jason Statham and global action icon Wu Jing as they lead a daring research team on an exploratory dive into the deepest depths of the ocean. Their voyage spirals into chaos when a malevolent mining operation threatens their mission and forces them into a high-stakes battle for survival. Pitted against colossal Megs and relentless environmental plunderers, our heroes must outrun, outsmart, and outswim their merciless predators in a pulse-pounding race against time. Immerse yourself in the most electrifying cinematic experience of the year with ""Meg 2: The Trench"" - where the depths of the ocean are matched only by the heights of sheer, unstoppable excitement.",['116'],"United States, China",English,,5.0,9224104
The Admiral,2015,"Action, Biography, Drama, History, War",Roel Reiné,Nothing from IMDB,"Frank Lammers, Sanne Langelaar, Barry Atsma, Lieke van Lexmond, Egbert Jan Weeber, Rutger Hauer, Charles Dance, Derek de Lint, Tygo Gernandt, Filip Peeters","When the young republic of The Netherlands is attacked by the great Kingdom of England, France, and Germany, and the country is on the brink of civil war, only one man can lead the country's strongest weapon, the Dutch fleet: Michiel de Ruyter.",['151'],Netherlands,"Dutch, English, French",,7.0,2544766
Mission: Impossible - Dead Reckoning Part One,2023,"Action, Adventure, Thriller",Christopher McQuarrie,Nothing from IMDB,"Tom Cruise, Hayley Atwell, Ving Rhames, Simon Pegg, Rebecca Ferguson, Vanessa Kirby, Esai Morales, Pom Klementieff, Henry Czerny, Shea Whigham","Ethan Hunt and the IMF team must track down a terrifying new weapon that threatens all of humanity if it falls into the wrong hands. With control of the future and the fate of the world at stake, a deadly race around the globe begins. Confronted by a mysterious, all-powerful enemy, Ethan is forced to consider that nothing can matter more than the mission -- not even the lives of those he cares about most.",['163'],United States,"English, French, Italian, Russian",,7.7,9603212
Paap,2003,"Action, Crime, Drama, Romance, Thriller",Pooja Bhatt,Nothing from IMDB,"John Abraham, Udita Goswami, Mohan Agashe, Gulshan Grover, Sandeep Mehta, Denzil Smith, Anahita Oberoi, Madan Bhiku, Ahsan Baksh, Bikramjeet Kanwarpal","Kaya lives in a Buddhist village of Monks with her father who wants Kaya to devote her self to god and not live a normal like other females.The village head monk Lamha asks Kaya to travel to Delhi to bring a back a child named Llahmo who is believed to be re birth of their God.While in hotel Llahmo witness 's murder of a top cop where Kaya and Llahmo are asked by Inspector Shiven not to leave the city until they come to conclusion and shelters them safely in his sisters house.Llahmo identifies the killer whose none other then a top encounter cop ACP Raj Mehra,Shiven then decides to inform his senior DCP Mahtur but Maahtur and Mehra are partners in crime and plan to kill Shiven.A badly wounded Shiven picks up Kaya and Llahmo safely reaches them to their village but Shiven being in bad health cant return back an is nursed by Kaya where she starts having feelings for him.Kaya's father notices change in her behavior and reminds her about her devotion to got and feels that Shiven is come to make their holy lives impure.",['120'],India,"Hindi, English",,5.2,399942
Poikkal Kuthirai,2022,"Action, Drama",Santhosh P. Jayakumar,Santhosh P. Jayakumar,"Prabhu Deva, Vetri Kiran, Chandrasekar Koneru, Prema Priya, Prakash Raj, Samuthirakani, Varalaxmi Sarathkumar, Shaam, Tsr, Raiza Wilson",,['91'],India,Tamil,,6.1,15056872
Public Enemies,2009,"Action, Biography, Crime, Drama, History",Michael Mann,Nothing from IMDB,"Christian Bale, Christian Stolte, Jason Clarke, Johnny Depp, Stephen Graham, David Wenham, John Judd, Stephen Dorff, Michael Vieau, John Kishline","The difficult 1930s is a time of robbers who knock over banks and other rich targets with alarming frequency. Of them, none is more notorious than John Dillinger, whose gang plies its trade with cunning efficiency against big businesses while leaving ordinary citizens alone. As Dillinger becomes a folk hero, FBI head J. Edger Hoover is determined to stop his ilk by assigning ace agent Melvin Purvis to hunt down Dillinger. As Purvis struggles with the manhunt's realities, Dillinger himself faces an ominous future with the loss of friends, dwindling options, and a changing world of organized crime with no room for him.",['140'],"United States, Japan",English,,7.0,1152836
Pushpa: The Rise - Part 1,2021,"Action, Crime, Drama, Thriller",Sukumar,Nothing from IMDB,"Allu Arjun, Fahadh Faasil, Rashmika Mandanna, Jagadeesh Prathap Bandari, Sunil, Rao Ramesh, Dhananjaya, Anasuya Bharadwaj, Ajay, Ajay Ghosh","Pushpa a labor works for small sum but dreams of living a life of king. But he is always let down by his step brothers for being an illegitimate child of their father. He gets chance to work in dense forest of red sanders where red sanders are smuggled to other countries. The labors are always under the scanner of DSP Govindappa but Pushpa dares to go against everyone creating hurdles for DSP. Pushpa manages to save a smuggling consignment worth crores under the eye of DSP and becomes known to Reddy Brothers. (Konda Reddy, Jakka Reddy and Jolly Reddy) known to do smuggling of red sanders. Pushpa manages to smuggle red sanders often with his tricks by bluffing DSP and his team and becomes close side of Konda Reddy. Pushpa changes his lifestyle and decides to marry Srivelli but his step brothers disclose his mother's relationship with their father thus calling of the marriage. Pushpa who now decides not to stop in reaching heights and finds that Mangalam Sinu, a syndicate member is giving Reddy's gang much lesser share than they deserve and asks Konda Reddy to hike profit. Konda Reddy asks Pushpa to take thing sin his hands as his involvement will lead to war between the two gangs.A fearless Pushpa decides to take control of things leading to disagreements between two gangs.",['179'],India,"Hindi, Tamil, Malayalam, Kannada, Telugu",,7.6,9389998
Ram Tere Kitne Nam,1985,Drama,P. Madhavan,Nothing from IMDB,"Sanjeev Kumar, Rekha, Prem Chopra, Lalita Pawar, Narendranath Malhotra, Sudhir, Yunus Parvez, T.P. Jain, Jagdish Raj, Raj Tilak","Peturam is an overweight, albeit sensitive young man, who is head over heels in love with beautiful Radha, the sister of Tej Singh, and would like to marry her. When he proposes to marry her, Tej makes fun of him, asks him to gather together at least 10 lakh rupees before he can even be considered as a prospective groom. Crestfallen, Peturam re-locates to Bombay city, where he starts to work driving a taxi, and buying lottery tickets, all quite in vain, as he finds himself quite far away from his target of 10 lakh rupees. Then one day he meets with a Bollywood film-maker, who decides to give him a chance in movies. The movie turns out to be a success, making Peturam, who is now known as Ram Kumar, a millionaire overnight. Pleased with his success and ensuring that he has more than enough to satisfy Tej Singh, Ram triumphantly returns to his home-town in his chauffeur-driven Mercedes Benz - only to find out that Radha has already been married to a man named Aloknath Gupta, and is soon to bear his child. Watch how a devastated Ram Kumar attempts to put the remainder of his life together - in a career that he never wanted in the first place.",['157'],India,Hindi,,5.8,358068
