Title,Year,Genres,Directors,Writers,Cast,Plot,Runtime,Country,Language,Awards,Rating,MovieCode
Daata,1989,"Action, Drama",Sultan Ahmed,Nothing from IMDB,"Mithun Chakraborty, Padmini Kolhapure, Shammi Kapoor, Saeed Jaffrey, Amrish Puri, Prem Chopra, Ranjeet Bedi, Raj Tilak, Om Shivpuri, Suresh Oberoi","Dinanath is a school-teacher in a small town in India, and lives with his wife, Kamla; daughter, Shanti; and son Kundan. He has published a book called ""Daata"" in which he has made reference to all major religions of the world, and is honored for this contribution by none other than the President of India through Education Minister, Raja Suraj Singh. He arranges the marriage of Shanti to the son of Gopaldas, when Gopaldas demands dowry he is unable to afford this, and states that he has given sufficient gold and jewelery to Shanti. The gold turns out to be fake, as a result the marriage is canceled, Shanti kills herself, Dinanath dies of a heart attack. His name tarnished, no one comes forward to help Kundan or his mother. Kundan decides to avenge his father's death by killing Gopaldas' son, as a result he becomes a bandit, joins a band of other bandits and is on the look-out to kill Gopaldas. The question remains is this what Dinanath had foreseen for his son - a life of a bandit, and death at the hands of the police?",,India,Hindi,,4.7,405852
Dabangg,2010,"Action, Comedy, Crime",Abhinav Kashyap,Nothing from IMDB,"Salman Khan, Sonakshi Sinha, Sonu Sood, Arbaaz Khan, Vinod Khanna, Dimple Kapadia, Om Puri, Anupam Kher, Mahie Gill, Tinnu Anand","Set in Uttar Pradesh, Chulbul Pandey is a young boy who lives with his mother Naini, stepfather Prajapati, and younger half-brother Makkhi. Chulbul is constantly angry that his step-father is always partial towards his own biological son. 21 years later, Chulbul is a rowdy, mischievous, and sometimes crooked cop, who refers to himself as ""Robin Hood."" He does everything in his own indomitable way; whether it's dealing with corrupt politician and thug Chedi Singh, fighting a family feud, or romancing stunning Rajo.",['126'],India,Hindi,,6.2,1620719
Dabangg 2,2012,"Action, Comedy, Crime",Arbaaz Khan,Dilip Shukla,"Salman Khan, Sonakshi Sinha, Prakash Raj, Vinod Khanna, Arbaaz Khan, Deepak Dobriyal, Nikitin Dheer, Mahie Gill, Kareena Kapoor, Sandeepa Dhar","Chulbul Pandey is transferred and promoted to Kanpur. He is happily married with Rajjo. Kanpur witness a lot of criminal activities daily and kidnapping, rape and murders are done in broad daylight. The main antagonist/villain is Baccha Bhaiyaa, politician and a strong contender for the upcoming elections and Chulbul Pandey sabotages his political image by revealing his immoral activities to the public, media and police force. Chulbul Pandey takes Baccha Bhaiya head on & remains 'Dabang' as always",['120'],India,Hindi,,4.8,2112131
Dabangg 3,2019,"Action, Comedy, Crime, Drama",Prabhu Deva,Nothing from IMDB,"Salman Khan, Sudeep, Sonakshi Sinha, Saiee Manjrekar, Arbaaz Khan, Pramod Khanna, Dimple Kapadia, Mahesh Manjrekar, Nawab Shah, Medha Manjrekar","Following the events of Fearless 2 (2012), Chulbul Pandey has now become the SP of Tundla, Uttar Pradesh and is living a comfortable life with his family. When he busts a human trafficking racket, he realizes he has locked horns with the kingpin Bali Singh who seems to be having a connection to his past. A flashback unfolds, showcasing the origin of Chulbul Pandey as a fearless cop and the reason behind his transformation.",['160'],India,"Hindi, Kannada, Tamil, Telugu",,3.0,7059844
Damayanti,2020,"Mystery, Thriller",Nothing from IMDB,"Rohini Ghosh, Manoj Sen, Ruchita Chatterji","Chandrayee Ghosh, Amrita Chattopadhyay, Tuhina Das, Judhajit Sarkar, Shoumo Banerjee, Indrasish Roy, Rohit Basfore, Jit Das, Arpan Ghoshal, Gautam Purkayastha",,,India,Bangla,,5.7,13214716
Dangal,2016,"Action, Biography, Drama, Sport",Nitesh Tiwari,Nothing from IMDB,"Aamir Khan, Fatima Sana Shaikh, Sanya Malhotra, Sakshi Tanwar, Aparshakti Khurana, Zaira Wasim, Suhani Bhatnagar, Ritvik Sahore, Girish Kulkarni, Ravi Aneja","Biopic of Mahavir Singh Phogat, who taught wrestling to his daughters Babita Kumari and Geeta Phogat. Geeta Phogat was India's first female wrestler to win at the 2010 Commonwealth Games, where she won the gold medal (55 kg) while her sister Babita Kumari won the silver (51 kg).",['161'],"India, United States","Hindi, English",,8.3,5074352
Danger Close,2019,"Action, Drama, War",Kriv Stenders,"Stuart Beattie, James Nicholas, Karel Segers, Paul Sullivan, Jack Brislee","Travis Fimmel, Toby Blome, Alexander England, Aaron Glenane, Uli Latukefu, Richard Te Are, Luke Bracey, Sean McCarthy, Mojean Aria, Ryan Hance","South Vietnam, late afternoon on August 18, 1966 - for three and a half hours, in the pouring rain, amid the mud and shattered trees of a rubber plantation called Long Tan, Major Harry Smith and his dispersed company of 108 young and mostly inexperienced Australian and New Zealand soldiers are fighting for their lives, holding off an overwhelming enemy force of 2,500 battle hardened Main Force Viet Cong and North Vietnamese Army soldiers. With their ammunition running out, their casualties mounting and the enemy massing for a final assault each man begins to search for his own answer - and the strength to triumph over an uncertain future with honor, decency and courage. The Battle of Long Tan is one of the most savage and decisive engagements in ANZAC history, earning both the United States and South Vietnamese Presidential Unit Citations for gallantry along with many individual awards. But not before 18 Australians and more than 245 Vietnamese are killed.",['118'],Australia,"English, Vietnamese",,6.8,441881
Dark Waters,2019,"Biography, Drama, History, Mystery",Todd Haynes,Nothing from IMDB,"Mark Ruffalo, Anne Hathaway, Tim Robbins, Bill Pullman, Bill Camp, Victor Garber, Mare Winningham, William Jackson Harper, Louisa Krause, Kevin Crowley","Cincinnati, Ohio 1998: Up-and-coming corporate attorney Robert Bilott, a new partner at a prestigious law firm, is visited by one of his grandmother's neighbors from West Virginia. Angry farmer Wilbur O. Tennant asks him to sue chemical multinational DuPont. His cows, according to the accusation, are being poisoned by a nearby landfill. Such a mandate is actually out of the question for Bilott, because he normally represents corporations. When he drives to remote Parkersburg to see for himself, his mind changes abruptly. The lawyer sees shocking evidence of the poisoning of the cattle with his own eyes: black teeth, huge tumors and terrible deformities. With the backing of his law firm boss Tom Terp, he files a lawsuit and gains access to confidential company files. While DuPont routinely plays for time, Bilott uncovers a scandal that is also endangering the health of many people. Much to his wife's chagrin, the idealistic lawyer gets stuck in the case, putting his career and health at risk. And yet he doesn't give up.",['126'],United States,"English, Korean",,7.6,9071322
Darlings,2022,"Comedy, Drama, Thriller",Jasmeet K Reen,Nothing from IMDB,"Alia Bhatt, Shefali Shah, Vijay Varma, Roshan Mathew, Rajesh Sharma, Vijay Maurya, Santosh Juvekar, Kiran Karmarkar, Puja Sarup, Inayah Chowdhry",Badrunissa (Badru) and Hamza are very much in love and decide to get married after Hamza gets a government job as Ticket Collector in Indian Railways but Badru's mother Shamshunissa isn't happy with her choice. Three years later things are not good between Badru and Hamza as he has turned alcoholic and frequently beats Badru and wants her to live according to him. Also opposing the redevelopment plan of his building. Shamshunissa is very much aware of her daughter's daily abuse and wants her to return home but Badru lives with a hope that someday Hamza will change. Zulfi a common friend of Badru and Shamshunissa complaints to police about Hamza being a wife beater but in police station with his sweet talks Hamza convinces Badru to take the complaint back. On their way home Hamza attacks Shamshunissa and Badru is left to make a choice between her mother and husband following which she chooses Hamza forcing the mother and daughter to break ties with each other. A few days later Badru finds about her pregnancy and unites with Shamshunissa around the same time Hamza finds from Inspector Jadhav that Zulfi had complained against him and Badru is very much aware of it. Hamza suspects an affair between them and pushes Badru downstairs leading to her miscarriage but Badru does not stop here she decides to held Hamza captive in their house and torture him the same way he did to her.,['133'],India,Hindi,,6.6,14152140
Darna Mana Hai,2003,Horror,Prawaal Raman,Nothing from IMDB,"Saif Ali Khan, Boman Irani, Nana Patekar, Vivek Oberoi, Shilpa Shetty Kundra, Rajpal Naurang Yadav, Sanjay Kapoor, Sohail Khan, Antara Mali, Aftab Shivdasani","Seven friends are traveling through a forest when their car breaks down in the dark and they decide to tell horror stories to pass the time. But after each story one friend gets scared and goes back to the car. 1) Karan and Anjali get stuck in the forest when their car suddenly stops while Anjali sees Karan going into creep but next moment he is standing besides her claiming to be normal. 2) Anil Manchandani , a smoker, checks into a hotel whose owner is weird and hates smoking. 3) Pramila, a little girl who is not a good student, has several complaints from her teacher; suddenly the teacher gets scared of her when her behavior changes. 4) Homemaker Gayatri finds an apple-seller suspicious; the next morning she finds that things around her house have turned into apples--including her husband. 5) John is waiting outside a graveyard for a lift; when Amar lets him in his car, he reveals that he died few days back. 6) Purab, considered a loser by everyone, suddenly gets the power to STOP things around him.",['121'],India,Hindi,,6.3,349333
Darr,1993,"Action, Drama, Romance, Thriller",Yash Chopra,Nothing from IMDB,"Juhi Chawla, Sunny Deol, Shah Rukh Khan, Anupam Kher, Tanvi Azmi, Raj Hans, Annu Kapoor, Neena Softa, Piloo J. Wadia, Vikas Anand","DARR is Rahul's (Shah Rukh Khan) story whose love and obsession for Kiran (Juhi Chawla) frees him from all fears of life and death. It is Sunil's (Sunny Deol) story, whose enduring love and passion for Kiran gives him the courage to face the fear of death. It is Kiran's story caught between one man's love and another man's obsession. She fears one and fears for the other.",['178'],India,Hindi,,7.6,109555
Dassehra,2018,"Action, Thriller","Manish Vatssalya, Saurabh Choudhary",Nothing from IMDB,"Neil Nitin Mukesh, Tina Desai, Manish Vatssalya, Govind Namdeo, Ashwini Kalsekar, Murli Sharma, Shubhangi Gokhale, Scarlett Mellish Wilson, Pankaj Jha, Nisa Deys","It's a story of an honest police officer who is trapped under adverse circumstances. It's is a political thriller driven by crime and politics. The film revolves around the background of a politically volatile state, which shows a politician mafia network, a place of serious crimes, cunning politicians, miserable criminals.",['131'],India,Hindi,,3.7,2759338
"Wetten, dass..?",1981,"Comedy, Game-Show, Music",Nothing from IMDB,"Frank Elstner, Frank Elstner, Frank Elstner","Thomas Gottschalk, Frank Elstner, Mirjam Weichselbraun, Michelle Hunziker, Jessica Schwarz, Olli Dittrich, Peter Maffay, Markus Lanz, Udo Jürgens, Herbert Grönemeyer","Each show has several celebrities invited who have to bet on different contestant(s) achieving his/her/their goal of performing a stunt. If the celebrities fail to anticipate whether their stunt will succeed or not, they have to meet their stake. Usually one stunt takes place outside the studio. At the end of the show, the best stunt is being voted for by the audience. There is also an audience bet, a stunt which the audience does choose from a preselection, which is not prepared and must be organized by the host city within the time the show is running. If the stunt succeeds, the show's host has to meet his stake.",['165'],"Germany, Austria, Switzerland",German,,6.0,81961
Dasvi,2022,"Comedy, Drama",Tushar Jalota,Nothing from IMDB,"Abhishek Bachchan, Nimrat Kaur, Yami Gautam, Manu Rishi Chadha, Chittaranjan Tripathy, Danish Husain, Arun Kushwah, Shivankit Singh Parihar, Rohit Tiwari, Dhanveer Singh","A corrupt Chief Minister Gangaram Chaudhari who always plays with the law is put behind bars in a scam.He appoints his wife Bimla Devi as they Chief Minister until he gets bail.While Bimla Devi is quick to understand the tricks of politics and established herself as powerful politician,While Gangaram Chaudhary whose between small time crooks in the jail gets a fan following but his life becomes hell when Superintendent Jyoti Jaiswal takes over.Jyoti starts to treat Chaudhari like other prisoners when she embraces him about his qualification Chaudhari decides to complete his tenth grade.Thou Jyoti finds it as a scam but is permitted by law while Chaudhari struggles with his studies until he is influenced by history of freedom fighters.On the other end Bimla Devi makes a strong position in her party and is in no mood to loose the chair to her husband.",['125'],India,Hindi,,7.4,14107554
