Title,Year,Genres,Directors,Writers,Cast,Plot,Runtime,Country,Language,Awards,Rating,MovieCode
Fast & Furious Presents: Hobbs & Shaw,2019,"Action, Adventure, Thriller",David Leitch,Nothing from IMDB,"Dwayne Johnson, Jason Statham, Idris Elba, Vanessa Kirby, Helen Mirren, Eiza González, Eddie Marsan, Eliana Sua, Cliff Curtis, Lori Pelenise Tuisano",,['137'],"United States, Japan","English, Samoan, Russian",,6.5,6806448
Hollywood Sex Wars,2011,Comedy,Paul Sapiano,Paul Sapiano,"Mario Diaz, Eli Jane, Jenae Altschwager, Dominique Purdy, Jacqui Holland, Suzy Kaye, Christine Nguyen, Richard Blair, Carmen Palumbo, Nicholas Mongiardo-Cooper","Max (Dominique Purdy), Aaron (Richard Blair) and Glen (Nicholas Cooper) have a track record littered with strike-outs and misfit hook-ups. The boys embark on a mission to up their hot babe batting average. They meet Hollywood Casanova Johnny Eyelash (Mario Diaz) who teaches these boys the game of scoring A-list arm candy. But there is one problem, the girls are organized, cunning and have an agenda of their own. Its not long before the girls, led by Big Wendy (Jenae Alt) and Little Wendy (Eli Jane) pick up on Johnny's tactics and Hollywood becomes one big booby trap.",['106'],United States,English,,3.2,1764366
Home Sweet Hell,2015,"Comedy, Crime, Thriller",Anthony Burns,"Carlo Allen, Ted Elrick, Tom Lavagnino","Katherine Heigl, Patrick Wilson, Madison Wolfe, Aiden Flowers, Jim Belushi, Jordana Brewster, Heath Freeman, A.J. Buckley, Kevin McKidd, Artie Baxter","Don Champagne seems to have it all: a successful business, a perfect house, perfect kids and a perfect wife. Unfortunately, when his wife, Mona (Katherine Heigl), learns of Don's affair with a pretty new salesgirl (Jordana Brewster), this suburban slice of heaven spirals out of control. Don soon realizes that Mona will stop at nothing, including murder, to maintain their storybook life where ""perception is everything"".",['98'],United States,"English, French",,5.5,2802136
Homefront,2013,"Action, Crime, Thriller",Gary Fleder,Nothing from IMDB,"Jason Statham, James Franco, Izabela Vidovic, Kate Bosworth, Marcus Hester, Clancy Brown, Winona Ryder, Omar Benson Miller, Rachelle Lefevre, Frank Grillo","Phil Broker is a former DEA agent who has gone through a crisis after his actions against a biker gang went horribly wrong ,and it cost the life of his boss's son. He is recently widowed and is left with a 9 year old daughter, Maddy. He decides to quit the turbulent and demanding life of the DEA for Maddy's sake and retires to a small town. His daughter fights off a boy who is bullying her at school, and this sets in motion a round of events that end in his direct confrontation with the local Meth drug lord. His past with the biker gang also enters the arena, making matters more complex. But he has a mission in his mind to protect his daughter, and he is ready to pay any cost that it demands.",['100'],United States,English,,6.5,2312718
Honest Thief,2020,"Action, Thriller",Mark Williams,Nothing from IMDB,"Liam Neeson, Kate Walsh, Jai Courtney, Jeffrey Donovan, Anthony Ramos, Robert Patrick, Tazzie, Jasmine Cephas Jones, Devon Diep, Herlín Areniello","They call him the In-and-Out-Bandit because meticulous thief Tom Carter (Liam Neeson) has stolen $9 million from small-town banks while managing to keep his identity a secret. But when he falls in love with bubbly Annie (Kate Walsh), Tom decides to make a fresh start by coming clean about his criminal past, only to be double-crossed by two ruthless FBI agents.",['99'],United States,"English, Spanish, German",,6.0,1838556
Honey 2,2011,"Comedy, Drama, Music",Bille Woodruff,Nothing from IMDB,"Gee Alexander, Gerry Bednob, Aaron Benjamin, Ariana Berlin, Luke Broadlick, Kimberly Brooks, Kelly Connolly, Justin Deanda, Seychelle Gabriel, Laurieann Gibson",,['110'],United States,English,,5.2,1657283
Honey,2003,"Drama, Music, Romance",Bille Woodruff,"Alonzo Brown, Kim Watson","Jessica Alba, Mekhi Phifer, Romeo Miller, Joy Bryant, David Moscow, Lonette McKee, Zachary Isaiah Williams, Christian Monzon, Al Shearer, Jull Weber","Honey Daniels is a 22-year-old, sexy, tough-minded, part-black, part-Latina hip-hop dancer in New York's East Harlem who dreams of making it big as a music video choreographer. She teaches hip-hop dancing at a local youth center and encourages the local kids to attend to keep them off the streets and out of trouble. When luck shines on Honey in the form of a famous music video director, named Michael, who casts her in one music video, she's encouraged to make the transition from dancer to choreographer. But Honey's sudden success comes with a price when Michael refuses to take ""no"" for an answer to his sexual advances and then tries to sabotage her career by blackballing her out of the business.",['94'],United States,English,,5.3,322589
Honey,2003,"Drama, Music, Romance",Bille Woodruff,"Alonzo Brown, Kim Watson","Jessica Alba, Mekhi Phifer, Romeo Miller, Joy Bryant, David Moscow, Lonette McKee, Zachary Isaiah Williams, Christian Monzon, Al Shearer, Jull Weber","Honey Daniels is a 22-year-old, sexy, tough-minded, part-black, part-Latina hip-hop dancer in New York's East Harlem who dreams of making it big as a music video choreographer. She teaches hip-hop dancing at a local youth center and encourages the local kids to attend to keep them off the streets and out of trouble. When luck shines on Honey in the form of a famous music video director, named Michael, who casts her in one music video, she's encouraged to make the transition from dancer to choreographer. But Honey's sudden success comes with a price when Michael refuses to take ""no"" for an answer to his sexual advances and then tries to sabotage her career by blackballing her out of the business.",['94'],United States,English,,5.3,322589
Honey,2003,"Drama, Music, Romance",Bille Woodruff,"Alonzo Brown, Kim Watson","Jessica Alba, Mekhi Phifer, Romeo Miller, Joy Bryant, David Moscow, Lonette McKee, Zachary Isaiah Williams, Christian Monzon, Al Shearer, Jull Weber","Honey Daniels is a 22-year-old, sexy, tough-minded, part-black, part-Latina hip-hop dancer in New York's East Harlem who dreams of making it big as a music video choreographer. She teaches hip-hop dancing at a local youth center and encourages the local kids to attend to keep them off the streets and out of trouble. When luck shines on Honey in the form of a famous music video director, named Michael, who casts her in one music video, she's encouraged to make the transition from dancer to choreographer. But Honey's sudden success comes with a price when Michael refuses to take ""no"" for an answer to his sexual advances and then tries to sabotage her career by blackballing her out of the business.",['94'],United States,English,,5.3,322589
Honey,2003,"Drama, Music, Romance",Bille Woodruff,"Alonzo Brown, Kim Watson","Jessica Alba, Mekhi Phifer, Romeo Miller, Joy Bryant, David Moscow, Lonette McKee, Zachary Isaiah Williams, Christian Monzon, Al Shearer, Jull Weber","Honey Daniels is a 22-year-old, sexy, tough-minded, part-black, part-Latina hip-hop dancer in New York's East Harlem who dreams of making it big as a music video choreographer. She teaches hip-hop dancing at a local youth center and encourages the local kids to attend to keep them off the streets and out of trouble. When luck shines on Honey in the form of a famous music video director, named Michael, who casts her in one music video, she's encouraged to make the transition from dancer to choreographer. But Honey's sudden success comes with a price when Michael refuses to take ""no"" for an answer to his sexual advances and then tries to sabotage her career by blackballing her out of the business.",['94'],United States,English,,5.3,322589
Horrible Bosses,2011,"Comedy, Crime",Seth Gordon,Nothing from IMDB,"Jason Bateman, Steve Wiebe, Kevin Spacey, Charlie Day, Lindsay Sloane, Michael Albala, Jennifer Aniston, Jason Sudeikis, Jennifer Hasty, Reginald Ballard","Nick hates his boss, mostly because he's expected to work from before sunrise to after sunset and his boss, Mr. Harken, calls him out for being a minute late and blackmails him so he can't quit. Dale hates his boss, Dr. Julia Harris, because she makes unwelcome sexual advances when he's about to get married. But Dale is on that pesky list of child-offenders so he can't quit. Kurt actually likes his job and his boss--well, up until his boss dies and the boss's coked-out, psychopathic son takes over. But who would be crazy enough to quit their jobs in such poor economic times? Instead, Nick, Dale, and Kurt drunkenly and hypothetically discuss how to kill their bosses, and before they know it, they've hired a murder consultant to help them pull off the three deeds.",['98'],United States,English,,6.9,1499658
Horrible Bosses,2011,"Comedy, Crime",Seth Gordon,Nothing from IMDB,"Jason Bateman, Steve Wiebe, Kevin Spacey, Charlie Day, Lindsay Sloane, Michael Albala, Jennifer Aniston, Jason Sudeikis, Jennifer Hasty, Reginald Ballard","Nick hates his boss, mostly because he's expected to work from before sunrise to after sunset and his boss, Mr. Harken, calls him out for being a minute late and blackmails him so he can't quit. Dale hates his boss, Dr. Julia Harris, because she makes unwelcome sexual advances when he's about to get married. But Dale is on that pesky list of child-offenders so he can't quit. Kurt actually likes his job and his boss--well, up until his boss dies and the boss's coked-out, psychopathic son takes over. But who would be crazy enough to quit their jobs in such poor economic times? Instead, Nick, Dale, and Kurt drunkenly and hypothetically discuss how to kill their bosses, and before they know it, they've hired a murder consultant to help them pull off the three deeds.",['98'],United States,English,,6.9,1499658
Horrible Bosses,2011,"Comedy, Crime",Seth Gordon,Nothing from IMDB,"Jason Bateman, Steve Wiebe, Kevin Spacey, Charlie Day, Lindsay Sloane, Michael Albala, Jennifer Aniston, Jason Sudeikis, Jennifer Hasty, Reginald Ballard","Nick hates his boss, mostly because he's expected to work from before sunrise to after sunset and his boss, Mr. Harken, calls him out for being a minute late and blackmails him so he can't quit. Dale hates his boss, Dr. Julia Harris, because she makes unwelcome sexual advances when he's about to get married. But Dale is on that pesky list of child-offenders so he can't quit. Kurt actually likes his job and his boss--well, up until his boss dies and the boss's coked-out, psychopathic son takes over. But who would be crazy enough to quit their jobs in such poor economic times? Instead, Nick, Dale, and Kurt drunkenly and hypothetically discuss how to kill their bosses, and before they know it, they've hired a murder consultant to help them pull off the three deeds.",['98'],United States,English,,6.9,1499658
Horrible Bosses 2,2014,"Comedy, Crime",Sean Anders,Nothing from IMDB,"Jason Bateman, Jason Sudeikis, Charlie Day, Jennifer Aniston, Kevin Spacey, Jamie Foxx, Chris Pine, Christoph Waltz, Jonathan Banks, Lindsay Sloane","Fed up with answering to higher-ups, Nick, Dale and Kurt decide to become their own bosses by launching their own business. But a slick investor soon pulls the rug out from under them. Outplayed and desperate, and with no legal recourse, the three would-be entrepreneurs hatch a misguided plan to kidnap the investor's adult son and ransom him to regain control of their company.",['108'],United States,"English, Spanish",,6.3,2170439
Hostiles,2017,"Drama, Western",Scott Cooper,Nothing from IMDB,"Scott Shepherd, Rosamund Pike, Ava Cooper, Stella Cooper, David Midthunder, Gray Wolf Herrera, Christian Bale, Rory Cochrane, Jonathan Majors, John Benjamin Hickey","In 1892 after nearly two decades of fighting the Cheyenne, the Apache, and the Comanche natives, the United States Cavalry Captain and war hero Joseph Blocker is ordered to escort the ailing Cheyenne chief, Yellow Hawk--his most despised enemy--to his ancestral home in Montana's Valley of the Bears. Nauseated with a baleful anger, Joseph's unwelcome final assignment is further complicated when widowed settler Rosalie Quaid is taken in by his band of soldiers. Aggressive packs of marauding Comanches are still on the warpath and thirsty for blood, so can the seasoned Captain do his duty one last time?",['134'],United States,"English, Cheyenne, French",,7.2,5478478
Hot Fuzz,2007,"Action, Comedy, Mystery, Thriller",Edgar Wright,"Edgar Wright, Simon Pegg","Simon Pegg, Martin Freeman, Bill Nighy, Robert Popper, Joe Cornish, Chris Waitt, Eric Mason, Billie Whitelaw, Nick Frost, Peter Wight","Top London cop PC Nicholas Angel is good. Too good. To stop the rest of his team looking bad, he is reassigned to the quiet town of Sandford. He is paired with Danny Butterman, who endlessly questions him on the action lifestyle. Everything seems quiet for Angel until two actors are found decapitated. It is called an accident, but Angel won't accept that, especially when more and more people turn up dead. Angel and Danny clash with everyone while they try to uncover the truth behind the mystery of the apparent ""accidents"".",['121'],"United Kingdom, France, United States",English,,7.8,425112
Hot Rod,2007,"Comedy, Sport",Akiva Schaffer,Pam Brady,"Andy Samberg, Jorma Taccone, Bill Hader, Danny McBride, Isla Fisher, Sissy Spacek, Ian McShane, Will Arnett, Chris Parnell, Chester Tam","Rod Kimble is a naïf, a slacker living in a small US town with his mom, his younger brother, and his stepfather whose respect he craves. He also misses his dead dad, whom he thinks was Evel Knievel's back-up. Rod, a man-child, believes that he is a stunt man. When his stepfather needs an operation, with help from his brother and his slacker pals, Rod hatches a plan to set a school-bus-jumping record on his moped. First, his crew and he have to raise money to rent the buses and build the ramp. Trouble is, Rod's inept at his chosen career. Looming failure is complicated by the return of Denise, Rod's next-door neighbor and secret heartthrob, who is home from college. Is public humiliation at hand?",['88'],United States,English,,6.7,787475
Hours,2013,"Drama, Thriller",Eric Heisserer,Eric Heisserer,"Paul Walker, Genesis Rodriguez, Nancy Nave, Shane Jacobsen, Natalia Safran, TJ Hassan, Lena Clark, Kesha Bullard Lewis, Yohance Myles, Judd Lormand","In New Orleans just before Hurricane Katrina hits, a pregnant woman gives birth prematurely. She dies and her baby is in critical condition. The baby has to be kept in a neonatal incubator. When the hurricane strikes, all the power goes out and everyone in the hospital leaves. But the baby's father stays because the baby can't be moved so he has to take care of his baby by making sure the ventilator stays on. And because there's no power, the only power source is generator that he has to crank every few minutes. So he has to stay awake while waiting for someone to come for them.",['97'],United States,English,,6.4,2094018
House at the End of the Street,2012,"Drama, Horror, Thriller",Mark Tonderai,Nothing from IMDB,"Jennifer Lawrence, Max Thieriot, Elisabeth Shue, Gil Bellows, Eva Link, Nolan Gerard Funk, Allie MacDonald, Jordan Hayes, Krista Bridges, James Thomas","Newly divorced Sarah and her daughter Elissa find the house of their dreams in a small, upscale, rural town. But when startling and unexplainable events begin to happen, Sarah and Elissa learn the town is in the shadows of a chilling secret.",['101'],"United States, Canada",English,,5.5,1582507
House of Wax,2005,"Horror, Thriller",Jaume Collet-Serra,Nothing from IMDB,"Elisha Cuthbert, Chad Michael Murray, Brian Van Holt, Paris Hilton, Jared Padalecki, Jon Abrahams, Robert Ri'chard, Dragicia Debert, Thomas Adamson, Murray Smith","Six friends are on their way to a football game. They decide to camp out for the night and continue driving the next day. The next day the friends find that they're having car troubles, so two of the friends accept a stranger's ride into a small town named Ambrose. The main attraction in Ambrose is the House of Wax. Except something is not right in this town, the wax figures are so realistic and the whole town is deserted - except for two murderous twin brothers. The six friends must fight to survive and escape from being the next exhibits in the House of Wax.",['113'],"Australia, United States",English,,5.5,397065
How to Make Love to a Woman,2010,Comedy,Scott Culver,Dennis Kao,"Josh Meyers, Krysten Ritter, Eugene Byrd, Ian Somerhalder, Lindsay Richards, Catherine Reitman, Nora Kirkpatrick, Ken Jeong, James Kyson, Ike Barinholtz","In Los Angeles, Andy Conners works in Fearless Records selecting new talents. Andy is in love and engaged to Lauren Baker for one year but he is unable to satisfy Lauren in bed. Further, he has never told Lauren that he loves her. Andy tells his problem to his best friend Layne Wilson, and they research how to satisfy Lauren with an orgasm. Meanwhile Lauren is promoted in her company but she needs to be transferred to Chicago. When her colleague Daniel Meltzer comes to Los Angeles to convince Lauren to move to Chicago, they discover that they had been friends in childhood. Andy misunderstands the relationship between Daniel and Lauren and believes that she is cheating on him. Will Andy lose Lauren to Daniel?",['91'],United States,English,,4.1,1241017
How to Train Your Dragon 2,2014,"Animation, Action, Adventure, Comedy, Family, Fantasy",Dean DeBlois,Nothing from IMDB,"Jay Baruchel, Cate Blanchett, Gerard Butler, Craig Ferguson, America Ferrera, Jonah Hill, Christopher Mintz-Plasse, T.J. Miller, Kristen Wiig, Djimon Hounsou","It's been five years since Hiccup and Toothless successfully united dragons and vikings on the island of Berk. While Astrid, Snotlout and the rest of the gang are challenging each other to dragon races (the island's new favorite contact sport), the now inseparable pair journey through the skies, charting unmapped territories and exploring new worlds. When one of their adventures leads to the discovery of a secret ice cave that is home to hundreds of new wild dragons and the mysterious Dragon Rider, the two friends find themselves at the center of a battle to protect the peace. Now, Hiccup and Toothless must unite to stand up for what they believe while recognizing that only together do they have the power to change the future of both men and dragons.",['102'],"United States, India",English,,7.8,1646971
How to Train Your Dragon 2,2014,"Animation, Action, Adventure, Comedy, Family, Fantasy",Dean DeBlois,Nothing from IMDB,"Jay Baruchel, Cate Blanchett, Gerard Butler, Craig Ferguson, America Ferrera, Jonah Hill, Christopher Mintz-Plasse, T.J. Miller, Kristen Wiig, Djimon Hounsou","It's been five years since Hiccup and Toothless successfully united dragons and vikings on the island of Berk. While Astrid, Snotlout and the rest of the gang are challenging each other to dragon races (the island's new favorite contact sport), the now inseparable pair journey through the skies, charting unmapped territories and exploring new worlds. When one of their adventures leads to the discovery of a secret ice cave that is home to hundreds of new wild dragons and the mysterious Dragon Rider, the two friends find themselves at the center of a battle to protect the peace. Now, Hiccup and Toothless must unite to stand up for what they believe while recognizing that only together do they have the power to change the future of both men and dragons.",['102'],"United States, India",English,,7.8,1646971
Hush,2016,"Horror, Thriller",Mike Flanagan,"Mike Flanagan, Kate Siegel","John Gallagher Jr., Kate Siegel, Michael Trucco, Samantha Sloyan, Emma Graves","Maddie Young, a deaf-mute horror author, has decided to live alone in an isolated cottage in the woods, far from the commotion of the city. A terrifying mask-wearing attacker breaks into her haven, turning her calm existence into a nightmare. Maddie is unaware of how vulnerable she is due to her inability to hear or talk, which makes her the ideal victim for this persistent intruder. In a terrible struggle for her life as the tension mounts, Maddie is left to use her cunning and scant supplies to elude her unrelenting assailant. Her tenacity and creativity are put to the test on a heart-pounding basis at every turn.",['82'],United States,"English, American Sign Language",,6.6,5022702
A View to a Kill,1985,"Action, Adventure, Thriller",John Glen,Nothing from IMDB,"Roger Moore, Christopher Walken, Tanya Roberts, Grace Jones, Patrick Macnee, Patrick Bauchau, David Yip, Fiona Fullerton, Manning Redwood, Alison Doody","James Bond has one more mission. Bond returns from his travels in the U.S.S.R. with a computer chip. This chip is capable of withstanding a nuclear electromagnetic pulse that would otherwise destroy a normal chip. The chip was created by Zorin Industries, and Bond heads off to investigate its owner, Max Zorin. Zorin may only seem like an innocent man, but is really planning to set off an earthquake in San Andreas, which will wipe out all of Silicon Valley. As well as Zorin, Bond must also tackle May Day an equally menacing companion of Zorin, while dragging Stacy Sutton along for the ride.",['131'],"United Kingdom, United States","English, French",,6.3,90264
Die Another Day,2002,"Action, Adventure, Thriller",Lee Tamahori,Nothing from IMDB,"Pierce Brosnan, Halle Berry, Toby Stephens, Rosamund Pike, Rick Yune, Judi Dench, John Cleese, Michael Madsen, Will Yun Lee, Kenneth Tsang","Pierce Brosnan gives one last mission as James Bond 007. Starting off in North Korea, Bond is betrayed and captured. Fourteen months later, Bond is set free, but traded for Zao (Rick Yune) who was captured by MI6. When back in his world, Bond sets off to track down Zao. Bond gets caught up in yet another scheme which sends him to millionaire Gustav Graves (Toby Stephens). Another MI6 Agent known as Miranda Frost (Rosamund Pike) is also posing as a friend of Graves. Bond is invited to a presentation held by Graves about a satellite found in space which can project a huge laser beam. Bond must stop this madman with a fellow American Agent, known as Jinx Johnson (Halle Berry). While Bond tries to stop Graves and Zao, will he finally reveal who betrayed him?",['133'],"United Kingdom, United States, Spain","English, Korean, Cantonese, Spanish, German, Icelandic, Italian, Arabic",,6.1,246460
I Am Not a Serial Killer,2016,"Crime, Drama, Horror, Mystery, Thriller",Billy O'Brien,Nothing from IMDB,"Max Records, Christopher Lloyd, Laura Fraser, Christina Baldwin, Karl Geary, Dee Noah, Lucy Lawton, Anna Sundberg, Raymond Brandstrom, Michael Paul Levin",,['104'],"Ireland, United States, United Kingdom",English,,6.2,4303340
"I, Daniel Blake",2016,Drama,Ken Loach,Paul Laverty,"Dave Johns, Hayley Squires, Briana Shann, Dylan McKiernan, Kate Rutter, Sharon Percy, Kema Sikazwe, Magpie Richens, Amanda Payne, Chris McGlade","A 59 year old carpenter recovering from a heart attack befriends a single mother and her two kids as they navigate their way through the impersonal, Kafkaesque benefits system. With equal amounts of humor, warmth and despair, the journey is heartfelt and emotional until the end.",['100'],"United Kingdom, France, Belgium",English,,7.8,5168192
"I, Frankenstein",2014,"Action, Fantasy, Sci-Fi",Stuart Beattie,Nothing from IMDB,"Aaron Eckhart, Yvonne Strahovski, Miranda Otto, Bill Nighy, Jai Courtney, Socratis Otto, Aden Young, Caitlin Stasey, Mahesh Jadu, Steve Mouzakis","Dr Victor Frankenstein freezes to death and his creature buries him at his family's cemetery. He is attacked by demons but he kills one of them and Gargoyles save him and take him to a Cathedral where the Gargoyles Order gathers. The Queen of the Gargoyles, Leonore, keeps Dr. Frankenstein's journal together with the treasures of the Order, names the creature Adam, and explains to him that there is an ancient war between the Gargoyles that are angels and demons under the command of Prince Naberius. She also invites Adam to join the Gargoyles in the war against demons, but Adam prefers to isolate in a remote place. 200 years later, Adam returns and finds a modern society. Soon he learns that Naberius has the intention of creating an army of soulless corpses to be possessed by demons. The scientist Terra is researching a process to create life and Naberius is seeking Dr Frankenstein's journal to help Terra and raise his army.",['92'],"United States, Australia",English,,5.1,1418377
"I Love You, Beth Cooper",2009,"Adventure, Comedy, Family, Romance",Chris Columbus,Nothing from IMDB,"Hayden Panettiere, Paul Rust, Jack Carpenter, Lauren London, Lauren Storm, Shawn Roberts, Jared Keeso, Brendan Penny, Marie Avgeropoulos, Josh Emerson","When Dennis Cooverman gives the commencement speech at his graduation, his friend tells him to let it all out. So he proclaims his love for head cheerleader Beth Cooper and says things about everyone in the graduating class as well as some other people. Later Beth confronts him and he invites her to his graduation party; to his surprise she and two of her friends actually do show up. But so do some of the people he offended with his speech, wanting to tear him apart; one of them is Beth's boyfriend, who has just dumped him.",['102'],"United States, Canada, United Kingdom",English,,5.3,1032815
