Title,Year,Genres,Directors,Writers,Cast,Plot,Runtime,Country,Language,Awards,Rating,MovieCode
Hum Aapke Hain Koun...!,1994,"Comedy, Drama, Musical, Romance",Sooraj R. Barjatya,Nothing from IMDB,"Madhuri Dixit, Salman Khan, Mohnish Behl, Renuka Shahane, Alok Nath, Anupam Kher, Reema Lagoo, Bindu Desai, Ajit Vachani, Satish Shah","Prem, a top student, is learning the ropes of business under his elder brother Rajesh and his uncle Kailashnath, a big industrialist. In another town, Nisha is studying computer science and is the darling of her elder sister, Pooja, and her parents, Professor Choudhry and Kamladevi. Fate brings the two families together and this results in the the betrothal of Rajesh and Pooja. At the wedding, Prem meets Nisha and falls in love with this carefree woman. With Pooja as the woman of the house, joy knows no bounds in Prem's family. Months pass by and Pooja becomes pregnant. Nisha is invited to come and stay with her sister and attend the traditional function before the child's birth. Nisha's arrival is like a dream come true for Prem. Nisha stays there until the birth of the child, taking over the household chores, and becoming very much a part of the family. In soft whispers, Prem and Nisha commit their love for each other and secretly dream of spending a lifetime together. Then fate strikes a cruel blow when Pooja dies after a sudden fall down a flight of stairs. Because of this tragedy, life in the house comes to a standstill. Rajesh worries about the future of his motherless child, and it causes his health to deteriorate. Nisha's father suggests that Nisha should get married to Rajesh and become the mother of Pooja's child. Prem and Nisha decide to sacrifice their love for the sake of the family. Fate intervenes once again when Rajesh comes to know the truth behind Prem and Nisha's sacrifice. Putting his child into Nisha's arms, Rajesh unites and blesses the two lovers, whose hearts long to belong together.",['206'],India,Hindi,,7.5,110076
Hum Tum Pe Marte Hain,1999,"Action, Comedy, Drama, Romance",Nabh Kumar 'Raju',Nabh Kumar 'Raju',"Govinda, Urmila Matondkar, Dimple Kapadia, Paresh Rawal, Nirmal Pandey, Himani Shivpuri, Johny Lever, Gulshan Grover, Swastika, Master Harsha","Devyani is a woman's activist, and a social worker, living in Bombay for several years. She has a younger sister, Radhika, who is of marriage age. Devyani would prefer Radhika be independent, financially and otherwise, rather than be dependent on a male. When Rahul Kumar comes to live in the neighborhood, he is instantly attracted to Radhika, but has to prove himself to her sister first.",['165'],India,Hindi,,5.0,226786
Hungama,2003,"Comedy, Drama, Romance",Priyadarshan,Nothing from IMDB,"Akshaye Khanna, Aftab Shivdasani, Rimi Sen, Paresh Rawal, Shoma Anand, Shakti Kapoor, Rajpal Naurang Yadav, Tiku Talsania, Upasana Singh, Sanjay Narvekar","The story of a bunch of misfits whose misconception about each others backgrounds end up in a series of chaotic, yet comic outcomes. Aftab and Rimi play two strangers who have to pretend that are a married couple in order to get a place to live. Paresh Rawal plays a rich, yet ground to earth businessman whose business is named after his wife Anjali. Akshaye Khanna plays a young man starting a new business in electronic ware. Things get complicated when Rimi Sen goes to Paresh Rawal's house in search of a job & meets Akshaye Khanna who falls in love with her thinking she is Paresh Rawal's daughter. Paresh Rawal's wife thinks that he is having an affair with Rimi Sen & while Paresh Rawal thinks his wife is having an affair with Akshaye Khanna due to Rimi Sen and her having the same name. Then comes in Shakti Kapoor whose daughter falls in love with a guy pretending to be Paresh Rawal's son and soon everything gets out of control.",['153'],India,Hindi,,7.6,371735
Hungama 2,2021,"Comedy, Drama, Romance",Priyadarshan,Nothing from IMDB,"Paresh Rawal, Meezaan Jafri, Shilpa Shetty Kundra, Pranitha, Rajpal Naurang Yadav, Johny Lever, Ashutosh Rana, Tiku Talsania, Manoj Joshi, Raman Trikha","Retired Colonel Gobind Kapoor is trying to settle his elder son in his business. His grandchildren have made his life miserable, regularly being suspended from school for their mischief. His younger song Aakash is doing well until a woman named Vaani shows up, kid in tow, claiming to be his wife. Aakash and Vaani were involved during college days but haven't seen each other in a long time, and now he denies all her allegations. Anjali, a close Kapoor family friend, lives with her suspicious husband Radheshyam Tiwari; when Anjali tries to help Aakash prove his innocence, Radheshyam Tiwari suspects Anjali and Aakash of having an affair and Anjali being pregnant by Aakash.",['156'],India,Hindi,,3.2,8983220
Hurdang,2022,"Drama, Romance","Nikhil Nagesh Bhat, Vishal Chaturvedi",Nothing from IMDB,"Sunny Kaushal, Nushrratt Bharuccha, Vijay Varma, Viraj Kapoor, Shivam Mishra, Anupam Mishra, Mahesh Chandra Deva, Nitanshi Goel, Shubhashish Jha, Rakhi Kishore",,['122'],India,Hindi,,5.3,10919304
Dhoom 2,2006,"Action, Crime, Thriller",Sanjay Gadhvi,Nothing from IMDB,"Hrithik Roshan, Abhishek Bachchan, Aishwarya Rai Bachchan, Uday Chopra, Bipasha Basu, Rimi Sen, Trishla Baid, Nikio, Railey, Harry","DHOOM:2 reinvents the action comedy genre and propels it into the 21st century. Ali (Uday Chopra) is now ACP Jai Dixit's (Abhishek Bachchan) right hand man. Enter Mr.A (Hrithik Roshan), a high tech international thief whose next target is Mumbai. Once in Mumbai, Mr.A finds his match in Sunehri (Aishwarya Rai), a clever thief. She makes him an offer he finds hard to refuse. And so the game begins.",['152'],"India, South Africa, Brazil","Hindi, Urdu, English, Portuguese",,6.5,441048
Golden Slumber,2018,"Action, Crime, Drama, Thriller",Dong-seok No,Nothing from IMDB,"Gang Dong-won, Kim Eui-sung, Kim Seong-gyoon, Kim Dae-myung, Han Hyo-joo, Yoon Kyesang, So Hee-jung, Ryu Hye-rin, Jun Kim, Eun-yeong Park","Gun-woo (GANG Dong-won) is an honest and hardworking courier who even won a Model Citizen Award for saving a singer from a robbery incident. Out of the blue, his old friend Moo-yeol comes to visit him at work. With just a short moment to enjoy the pleasant surprise, Gun-woo witnesses a bombing incident that kills a presidential candidate right before his eyes. Moo-yeol tells Gun-woo that he is responsible for the bombing and that everyone will come after him as it is the agency's plan to make him the prime suspect. Gun-woo manages to flee from the scene but all evidences, including security camera footages, witness testimonies and fingerprints point toward him as the suspect. He meets former secret agent Mr. Min (KIM Eui-sung), who is an old friend of Moo-yeol and he helps out clear his name. Gun-woo must fight with all his strength to stay alive. However, as he tries to run away, everyone around him is put into dangerous situations, including old friends Dong-kyu (KIM Dae-myeung), Geum-chul (KIM Sung-kyun) and Sun-young (HAN Hyo-joo).",['108'],South Korea,Korean,,5.9,6485776
I Am Kalam,2010,"Comedy, Drama, Family",Nila Madhab Panda,Nothing from IMDB,"Gulshan Grover, Harsh Mayar, Pitobash, Hussan Saad, Beatrice Ordeix, Namrata Dixit, Sanjay Chauhan, Garima Bharadwaj, Keshav Sharma, Meena Mir",The film celebrates the survival of the human spirit against overwhelming odds and highlights the need for underprivileged children's education. Its a film based on former indian president A.P.J. Abdul Kalam and is aimed at inspiring the poor to educate their children.,['88'],India,Hindi,,7.9,1805263
I Am Number Four,2011,"Action, Adventure, Sci-Fi, Thriller",D.J. Caruso,Nothing from IMDB,"Alex Pettyfer, Timothy Olyphant, Teresa Palmer, Dianna Agron, Callan McAuliffe, Kevin Durand, Jake Abel, Jeff Hochendoner, Patrick Sebes, Greg Townley","Extraordinary teen John Smith (Pettyfer) is a fugitive on the run from ruthless enemies sent to destroy him. Changing his identity, moving from town to town with his guardian Henri (Olyphant), John is always the new kid with no ties to his past. In the small Ohio town he now calls home, John encounters unexpected, life-changing events - his first love (Agron), powerful new abilities and a connection to the others who share his incredible destiny.",['111'],"United States, India","English, French",,6.1,1464540
Identity Card,2014,"Comedy, Drama, Sci-Fi, Thriller",Rahhat Shah Kazmi,Nothing from IMDB,"Tia Bajpai, Furqan Merchant, Raghubir Yadav, Saurabh Shukla, Brijendra Kala, Vipin Sharma, Prashantt Guptha, Manini Mishra, Happy Sharma, Shoib Nikash Shah","The story of a journalist from Delhi who happens to go to Kashmir and gets caught by STF forces, how her one day in a specially police cell changes her life. Identity card talks about the history of Kashmir, ideological differences of people... myths about religion, about identity of a common person in a warlike situation... situation of a police person serving his duty, a common man, parents whose children are missing... and at the end, a ray of hope towards the changing scenario of Jammu and Kashmir... a suggestive thought, a solution; rehabilitation of those who have chosen a wrong track. Black humor with a touch of satire at some places and elements of thrill.",['92'],India,Hindi,,6.0,2220828
Life of a Rockstar: Kid Rock,2022,"Documentary, Short",Nothing from IMDB,Nothing from IMDB,"Tucker Carlson, Kid Rock",,,Nothing from IMDB,Nothing from IMDB,,8.5,20871288
Permission,1987,"Drama, Musical, Romance",Gulzar,Nothing from IMDB,"Rekha, Naseeruddin Shah, Anuradha Patel, Rammohan Sharma, Sulabha Deshpande, Dina Pathak, Rita Rani Kaul, Ashok Mehta, Rajesh Bombaywala, Ashfaque Ahmed","Mahendra is in love with Maya and would like to marry her. But Maya is a woman of the 20th century, who does not believe in marriage, but would like to continue having a relationship. Mahendra's family pressures him into getting married, and he finally gives in and marries another woman by the name of Sudha. But Mahendra is unable to get Maya out of his mind, and his marriage with Sudha fails, and ends up with a formal separation. Years later, Mahendra and Sudha meet at a railway station, and both do remember each other, and share their experiences after their separation. There is one shocking experience that sudha does not share, but which Mahendra will find out soon.",['137'],India,Hindi,,8.4,91256
India's Most Wanted,2019,"Action, Adventure, Thriller",Raj Kumar Gupta,Raj Kumar Gupta,"Arjun Kapoor, Sudev Nair, Preet Bhullar, Rajesh Sharma, Alexander Prasanth, Santilal Mukherjee, Sonia Albizuri, Sanjay M Bhatia, Jiban Bhattarai, Nikhil Dave",India's Most Wanted is a Bollywood action thriller film directed by Raj Kumar Gupta and starring Arjun Kapoor. The film is about tracking a terrorist in a secret mission and arresting him without firing bullets. It pays tribute to unsung heroes of our society.,['123'],India,Hindi,,4.7,8484942
Indu Sarkar,2017,"Drama, Thriller",Madhur Bhandarkar,Nothing from IMDB,"Kirti Kulhari, Tota Roy Chowdhury, Neil Nitin Mukesh, Ankur Vikal, Sheeba Chaddha, Parvin Dabas, Abhinav Sharma, Anupam Kher, Manav Vij, Rashmi Jha",,['139'],India,Hindi,,6.0,6620324
Inkaar,2013,"Drama, Romance, Thriller","Sudhir Mishra, Jay Dev Banerjee",Sudhir Mishra,"Arjun Rampal, Chitrangda Singh, Vipin Sharma, Mithun Rodwittiya, Jan Bostock, Gobind Singh Dhanoa, Gaurav Dwivedi, Deepesh Sumitra Jagdish, Rohan Thomas Joseph, Asheesh Kapur",,['125'],India,Hindi,,6.1,2094854
Jaag Utha Insan,1984,"Drama, Family",K. Viswanath,Nothing from IMDB,"Mithun Chakraborty, Sridevi, Rakesh Roshan, Deven Verma, Sujit Kumar, Beena Banerjee, Sudhir Dalvi, Kanan Kaushal, Kanwarjeet Paintal, Yunus Parvez","Mahant Chaturvedi did not approve of his daughter marrying outside of their caste to Gopi, and as such breaks off all relations with them. Years later, Gopi attempts to make amends by bringing his grown-up daughter, Sandhya, an accomplished dancer, to her grandfather. After witnessing her dance, Mahant approves of her, blesses her, and wants her to marry his ward, Brahmananda Chaturvedi, alias Nandu, who he has adopted years ago. The problem is that Sandhya is in love with a lower-caste youth by the Hari. Nevertheless, she does marry Nandu, only to find out that he prefers to go elsewhere at night, leaving her alone with her thoughts and of her love for Hari.",['135'],India,Hindi,,5.1,87492
Insaniyat,1994,"Action, Crime, Drama, Romance",Tony Juneja,Nothing from IMDB,"Tom Alter, Sadashiv Amrapurkar, Mahesh Anand, Amitabh Bachchan, Rakesh Bedi, Prem Chopra, Sunny Deol, Gorilla, Shafi Inamdar, Aruna Irani","SSP Amar Nath Singh is an honest and diligent police officer. His investigations have proved that Brijbhan is involved in criminal activities, as well as terrorism, and has the full co-operation of some employees in the police department, as well as the Indian army. He has also to bring two gang-leaders, Karim Lala, and Hariharan, to stop their gang rivalry. To this extent he is successful in convincing both to stop criminal activities, and join forces with him to bring Brijbhan to justice. Hariharan and Karim Lala openly agree to do this, while they prepare a hidden agenda which will only benefit them.",['180'],India,Hindi,,3.0,110140
Irada,2017,"Drama, Mystery, Thriller","Aparnaa Singh, Jatinkumar Jagdishbhai Patel, Rahul Kamboj",Nothing from IMDB,"Naseeruddin Shah, Arshad Warsi, Divya Dutta, Sharad Kelkar, Sagarika Ghatge, Rajesh Sharma, Rumana Molla, Nikhil Pandey, Prashantt Guptha, Diwakar Kumar",A mysterious bomb blast in a business tycoon's factory prompts the state CM to hire an NIA officer. He meets an ex-army man seeking revenge for his dead daughter and a journalist demanding justice for her slain boyfriend. Nothing is what it seems.,['109'],India,Hindi,,6.3,6467738
Ishkq in Paris,2013,"Comedy, Romance",Prem Soni,Nothing from IMDB,"Preity G Zinta, Isabelle Adjani, Gaurav Chanana, Shekhar Kapur, Salman Khan, Olivier Lafont, Akanksha Nehra, Chunky Pandey, Anoop Puri, Maya Zinta","Akash (Rhehan Malliek) and Ishkq (Preity Zinta), two complete strangers, after having met on a train from Rome to Paris, end up spending the evening together in the romantic city.However, owing to a no baggage pact set by Ishkq, the two part ways the next morning without a proper goodbye. Ishkq, being the strong-headed independent girl, moves on, while Akash ends up falling for the girl he spent the evening with. They cross paths once again in Paris but will there be Ishkq In Paris?",['95'],India,"English, Hindi, French",,3.8,1986040
Ishqedarriyaan,2015,Romance,V.K. Prakash,Nothing from IMDB,"Mimoh Chakraborty, Kavin Dave, Mohit Dutta, Evelyn Sharma","Ishqedarriyaan is a story about love, sacrifice, family values and relationships. Rishteydarriyaan means relationships and Ishqedarriyaan signifies the relationship when you fall in love! The movie stars Mahaakshay Chakraborty, Evelyn Sharma and Mohit Dutta. Evelyn Sharma is the lead actress, who will play the character of Luvleen, a teacher by profession who wants to collect donations for her grandfather's school. Mahaakshay Chakraborty plays Aagam Diwan, a millionaire who loves his profession more than anything else. Mohit Dutta will play Arjun, a passionate singer.",['132'],India,Hindi,,4.8,4610308
Ishqeria,2018,"Comedy, Romance",Prerna Wadhawan,Nothing from IMDB,"Manish Anand, Raj Babbar, Richa Chadha, Juby Devasia, Lata Gandi, Gurbani, Bikramjeet Kanerwal, Mustaq Khan, Ehsaas Madan, Neil Nitin Mukesh","When Kuhoo, a small town girl from an all girls school joins a hip co-ed university, a true behenji, who thinks herself as the queen of fashion, sees Raghav for the first time, she knows she's going to marry him and have his kids!. The problem? He doesn't seem to even see her!. Her gang of girlfriends plot to make Raghav fall madly in love with Kuhoo. What ensues is hilarious attempts at wooing, getting a behenji to turn mod and a love story that will make you relive your college days.",['118'],India,Hindi,,4.0,2802062
iSmart Shankar,2019,"Action, Crime, Sci-Fi, Thriller","Puri Jagannadh, A.R. Sreedhar",Nothing from IMDB,"Ram Pothineni, Satyadev Kancharana, Nabha Natesh, Nidhhi Agerwal, Puneet Issar, Ashish Vidyarthi, Sayaji Shinde, Madhusudhan Rao, Deepak Shetty, Joy Badlani","Ismart Shankar is a crazy contract killer who murders a high profile politician, Kasi Viswanath. Cops start chasing him and Shankar escapes with his girlfriend Chandni. On the other hand, Arun is a cop who is handling the same case. Just when he is about to nab the actual culprit behind the murder, he gets killed. In a crazy turn of events, the cops transfer Arun's memory to Shankar with the help of Arun's girlfriend Sarah to get the case details.",['140'],India,Telugu,,5.4,9558468
Issaq,2013,"Drama, Romance",Manish Tiwary,Nothing from IMDB,"Prateik Patil Babbar, Amyra Dastur, Ravi Kishan, Prashant Narayanan, Rajeshwari Sachdev, Neena Gupta, Makrand Deshpande, Vineet Kumar Singh, Amit Sial, Prashantt Guptha",,['148'],India,Hindi,,4.4,2215163
Itni Si Baat,1981,"Comedy, Family",Madhu M.,Nothing from IMDB,"Sanjeev Kumar, Moushumi Chatterjee, Arun Govil, Tamanna, Madan Puri, Asit Kumar Sen, Roopesh Kumar, Om Prakash, Dinesh Hingoo, Pardesi","One day while travelling on the BEST bus in Bombay, Raja produces a 100 rupee note to buy a 50 paisa bus ticket, and is made fun of by the bus conductor, and asked to leave the bus. Asha, who is travelling on the same bus, pays for his fare, and he tells her that he will re-pay this loan after he gets some change. He does not get the change, and instead loses the 100 rupee note, but makes his way into Asha's heart. Both fall in love, and get married. They live in harmony for several years, and become proud parents of two children. With their growing family, Raja's income is just not enough to make ends, and Asha decides to get a job. Raja decides to stay at home and look after the household chores, and the kids. What happens is that there is chaos at work for Asha, and at home for Raja, with alround hilarious results.",['138'],India,Hindi,,7.1,371747
Ittefaq,2017,"Crime, Mystery, Thriller",Abhay Chopra,Nothing from IMDB,"Sidharth Malhotra, Sonakshi Sinha, Akshaye Khanna, Mandira Bedi, Himanshu Kohli, Ajay Jadhav, Pavail Gulati, Sameer Sharma, Kimberley Louisa McBeath, Vinay Sharma","A police officer, is investigating a double murder case that has only two witnesses, who are also the prime suspects. The suspects - Vikram, an acclaimed writer, and Maya, a young homemaker, have different narratives about the events of that fateful night.",['105'],India,Hindi,,7.2,6692354
Jaadugar,2022,"Comedy, Drama, Fantasy, Romance, Sport",Sameer Saxena,Biswapati Sarkar,"Jitendra Kumar, Arushi Sharma, Jaaved Jaaferi, Raksha Panwar, Raj Qushal, Sandeep Shikhar, Ajay Mehra, Imran Rashid, Shubham Bagari, Rukshar Dhillon",,['167'],India,Hindi,,6.8,13793230
Jaanam Samjha Karo,1999,"Drama, Romance",Andaleeb Sultanpuri,Nothing from IMDB,"Salman Khan, Urmila Matondkar, Jaspal Bhatti, Shammi Kapoor, Bindu Desai, Navneet Nishan, Kannu Gill, Sadashiv Amrapurkar, Monica Bedi, Laxmikant Berde","Talented singer and dancer, Chandni's life is dominated by three aunts, and a soft-spoken maternal grandmother. She meets with a womanizer named Rahul, and falls in love with him. Rahul treats her just like any of his other girlfriends, and decides to have an affair with her. Rahul unexpectedly meets with his dadaji, who wants him to get married to Chandni. In order to fool him, Rahul asks Chandni to pretend to be his wife, which she does. After Dadaji leaves, will Rahul and Chandni go their separate ways, and will Rahul return to the waiting arms of his many girlfriends?",['153'],India,Hindi,,4.8,226847
Jaane Bhi Do Yaaro,1983,"Comedy, Crime, Drama",Kundan Shah,Nothing from IMDB,"Naseeruddin Shah, Ravi Baswani, Bhakti Barve, Satish Shah, Om Puri, Pankaj Kapur, Satish Kaushik, Neena Gupta, Deepak Qazir, Rajesh Puri","Vinod (Naseeruddin Shah) and Sudhir (Ravi Baswani) are two professional photographers trying to start a photo studio. The first real assignment that they get, from the activist magazine Khabardar (literally meaning beware), draws them into the shady world of Bombay real estate. They discover that one of the biggest builders in Bombay, Tarneja, is trying to bribe Municipal Commissioner D'Mello (Satish Shah) into giving him a bridge contract. Meanwhile D'Mello is negotiating with Tarneja's arch rival Ahuja (Om Puri). The contract is finally awarded to a third person. By chance Vinod and Sudhir find out that Tarneja has murdered D'Mello...",['132'],India,Hindi,,8.3,85743
Jaanisaar,2015,"Drama, Romance",Muzaffar Ali,Nothing from IMDB,"Imran Abbas, Pernia Qureshi, Muzaffar Ali, Dalip Tahil, Carl Wharton, Abid Yunus Khan, Ali Abbas, Natalie Arikan, Luv Bhargav, Benjamin T Huxley",,['124'],India,Hindi,,5.2,3826186
Jaan-E-Mann: Lets Fall in Love Again,2006,"Comedy, Drama, Musical, Romance",Shirish Kunder,Nothing from IMDB,"Salman Khan, Akshay Kumar, Preity G Zinta, Anupam Kher, Aman Verma, Jawed Sheikh, Soni Razdan, Nawab Shah, Steven Baker, Matt Brandstein",Suhaan receives divorce notice from his wife Piya as he as failed to pay the alimony.Agasthya enters their doorstep searching for Piya he was in love with her during college days but couldn't express it. Suhaan tries to get Agasthya and Piya closer that he doesn't have to pay her alimony and monitors their every move.He rents a apartment opposite her house and uses telescopes and binoculars to monitor her.Suhaan notices that Piya has a baby girl.Piya was pregnant when she left him as she didn't want her and baby to ruin his film career.Suhaan realizes his mistake but its to late as Piya and Agasthya are set to get engaged.,['165'],India,"Hindi, English",,6.1,456481
Jab Harry Met Sejal,2017,"Comedy, Drama, Romance",Imtiaz Ali,Imtiaz Ali,"Shah Rukh Khan, Anushka Sharma, Björn Freiberg, Bruce Huther, Attila G. Kerekes, Christina Murphy, Daxesh Patel, Rana Ranbir, Chandan Roy Sanyal, Evelyn Sharma","The story revolves around Harry and Sejal's journey across Europe. A search for Sejal's engagement ring makes Harry understand love and relationships better. Sejal experiences new found freedom, security and solace in Harry's company and in between all of this - there is love, life, lies, thrill, fantasy and the search for the voice within.",['143'],India,Hindi,,5.1,5997666
Pyaar Diwana Hota Hai,2002,"Comedy, Drama, Romance",Nothing from IMDB,Nothing from IMDB,"Rani Mukerji, Govinda, Om Puri, Laxmikant Berde, Kishore Bhanushali, Farida Jalal, Apurva Agnihotri, Deepak Tijori, Johny Lever, Rambha","Naive, easily influenced and illiterate Sunder re-locates from a village to the city. His attempts to woo girls are mocked, and he is ignored and made fun of by his room-mates. One day he befriends an NRI, Payal Khurana, who thinks he is disabled and dumb. She feels sorry for him and decides to assist him get his voice back - albeit in vain. Sunder is thrilled at the attention he is getting, and decides to continue to pull wool over her eyes to be near her. The question remains how long will he continue to fool her?",['148'],India,Hindi,,3.9,274019
Jab Tak Hai Jaan,2012,"Drama, Romance",Yash Chopra,Nothing from IMDB,"Shah Rukh Khan, Katrina Kaif, Anushka Sharma, Anupam Kher, Rishi Kapoor, Lucy Phelps, Sharib Hashmi, Julia St John, Andrew Bicknell, Susan Fordham","Samar (Shah Rukh Khan) meets Meera (Katrina Kaif) in London and they fall in love. Samar however meets with a serious accident and Meera vows to God to leave Samar, if he saved him. Samar angered with God, becomes a bomb disposal chief in the Indian Army. Here he meets Akira (Anushka Sharma). Is she able to unravel the mysteries, does Samar win the battle, or does God surrender to his love.",['198'],India,Hindi,,6.7,2176013
Jail,2007,Reality-TV,Nothing from IMDB,Nothing from IMDB,"Nicole Sittre, Jeff Morse, Evan Lockwood, Robert Stokes, Kent Rhoads, Isabel Leija, Rich Johnson, Willis Carey, John Storey, Elizabeth Wyatt Earp",,,United States,English,,6.8,1128727
Gangaajal,2003,"Action, Crime, Drama",Prakash Jha,Prakash Jha,"Ajay Devgn, Gracy Singh, Mohan Joshi, Yashpal Sharma, Akhilendra Mishra, Mukesh Tiwari, Ayub Khan, Chetan Pandit, Anup Soni, Mohan Agashe","An SP Amit Kumar who is given charge of Tezpur police station in Bihar. The area is full of corruption, inefficiency, bribery, nepotism, favoritism and crime with help from the local police. Gradually Amit realizes that the local politician Sadhu Yadav is the one who benefits the most out of it. Amit arrests Sunder Yadav, Sadhu's son. While Sunder is released soon, some police officers, get frustrated with the system, and pour acid into the eyes of two of Yadav's men, blinding them. A hue and cry is raised by the media, crime almost comes to a standstill, and the police are regarded with respect. SP Amit Kumar must now put an end to this kind of situation.",['157'],India,Hindi,,7.8,373856
Jalsa,2022,"Drama, Thriller",Suresh Triveni,Nothing from IMDB,"Vidya Balan, Shefali Shah, Rohini Hattangadi, Vidhatri Bandi, Manav Kaul, Iqbal Khan, Surya Kasibhatla, Shrikant Yadav, Ghanshyam Lalsa, Gurpal Singh","A hit and run of an 18 year old girl becomes the hub of a wheel that sets into motion many a spoke - a journalist , a raging mother, a cop and a system all caught in an ethical dilemma. Questions raised only to realise that truth is rarely pure and never simple.",['126'],India,Hindi,,6.6,15361028
