Title,Year,Genres,Directors,Writers,Cast,Plot,Runtime,Country,Language,Awards,Rating,MovieCode
Ghazab Tamasha,1992,"Comedy, Romance",Ranjeet Bedi,Nothing from IMDB,"Rahul Roy, Anu Agarwal, Tanuja Samarth, Sneha, Deepak Tijori, Aruna Irani, Sulabha Arya, Prem Bedi, Ranjeet Bedi, Chacha Chaudhary","A rustic love story of two simple yet street smart souls pitied against the urban background. Ganja, a rag picker, harassed by leachers takes to the begging business and jumps from the frying pan into the fire. Sitara, the popular, handsome man of Arjun Singh's family accidentally bumps into Ganja and decides to help her. He reprimands her for her wild lifestyle and gets her a settled job as a maid in Ram Singh's family. From here begins the role of these two servants as the saviors of their adopted families only to have their romantic dreams end in violence. Gajab Tamaasa - a revolution in musical romance with exotic settings.",['144'],India,Hindi,,6.0,395557
Ghulami,1985,"Action, Drama",J.P. Dutta,O.P. Dutta,"Dharmendra, Mithun Chakraborty, Naseeruddin Shah, Reena Roy, Smita Patil, Anita Raj, Kulbhushan Kharbanda, Raza Murad, Om Shivpuri, Avtar Gill",,['199'],India,Hindi,,7.4,89201
Go Goa Gone,2013,"Action, Adventure, Comedy, Horror, Sci-Fi","Krishna D.K., Raj Nidimoru",Nothing from IMDB,"Saif Ali Khan, Kunal Kemmu, Vir Das, Anand Tiwari, Puja Gupta, Ross Bucharn, Minal Thakur, Suparn Varma, Larrisa Bonesi, Krishna D.K.","Two friends, Luv (Vir Das) and Hardik (Kunal Khemu) are going through bad times. Luv has learned that his girlfriend has been cheating on him and Hardik is this close to being fired from his job. They both badly need a break and when their roommate Bunny (Anand Tiwari) informs them that he is going to Goa for a presentation, they jump at the chance for a vacation. Once in Goa, Luv meets a girl, Luna (Pooja Gupta) who invites him to a rave party organized by Russian mafia on a remote island. At the party, an experimental drug is introduced. Then, come morning, things go totally wrong for the three hapless guys and the girl. As it turns out, the untested drug has a deadly side effect...",['108'],India,"Hindi, Russian, English",,6.6,2436516
Godfather,2022,"Action, Crime, Drama, Thriller",Mohan Raja,Nothing from IMDB,"Chiranjeevi, Salman Khan, Nayanthara, Satyadev Kancharana, Parth Siddhpura, Rehan Katrawale, Rajiv Kumar Aneja, Mark Bennington, Kundan Alexzed, Sarvadaman Banerjee",PNR a respected political leader passes away while heading the chair of Cheif Minister now the question remains who will take his throne.Narayana Verma one of the prominent leaders of his party considers himself to be the suitable candidate but people of the city are in favor of Brahma whose known as Godfather to everyone and has made a place in everyone's heart in a short time.PNR's daughter Satyapriya whose away from politics is also a considered as suitable candidate and being a step brother she is against Bramha.Her husband Dev takes this as an advantage and eye's the chair of Cheif Minsiter so that he could conduct a drug racket in the region and also tries to convince Brahma for the same.But Brahma is against this and spoils his plans for the same following which Dev frames him in a sexual molestation case of a women from his orphanage which lands Brahma in jail.While Brahma is serving his term in jail Dev plans to activate his drug racket but his plans are spoiled by Brahma's trusted aide Masoom Bhai.,['157'],India,"Tamil, Kannada, Malayalam, Telugu, Hindi",,5.2,13130308
Gold,2018,"Drama, History, Sport",Reema Kagti,Nothing from IMDB,"Krishan Tandon, Hubertus Geller, Siddharth Kher, Sheldon Redden, Vineet Kumar Singh, Praveen Jaiswal, Kunal Kapoor, Pavraj Lochab, Varun Singh Rajput, Nareshh Mallik",Tapan Das manager of Gold winning Indian hockey team during British rule dreams of bringing Gold medal to the country post Independence.India is nearing Independence and Tapan finds news of 1948 Olympics. Tapan prepares his own team for the upcoming Olympics.But during the partition team also gets divided along with the country.,['151'],India,Hindi,,7.3,6173990
Goliyon Ki Raasleela Ram Leela,2013,"Drama, Musical, Romance",Sanjay Leela Bhansali,Nothing from IMDB,"Ranveer Singh, Deepika Padukone, Supriya Pathak, Sharad Kelkar, Homi Wadia, Abhimanyu Singh, Richa Chadha, Gulshan Devaiah, Jameel Khan, Barkha Bisht",,['150'],India,"Rajasthani, Hindi",,6.4,2215477
Golmaal Fun Unlimited,2006,"Action, Comedy, Drama",Rohit Shetty,Neeraj Vora,"Ajay Devgn, Arshad Warsi, Sharman Joshi, Tusshar Kapoor, Rimi Sen, Paresh Rawal, Sushmita Mukherjee, Vrajesh Hirjee, Mukesh Tiwari, Sanjay Mishra","Gopal, Lucky, Madhav and Laxman - four guys bound together by their child-like notoriety, aimlessness and petty business of conning people for fun and money. Laxman is an intelligent student who is not allowed to pass by his mischievous band of friends Gopal, Madhav and mute Lucky. This is because all four friends use his hostel room to conduct their activities. He is peer-pressured into running a series of scams in order to earn himself and his friends some money. Once thrown out of college bag-n-baggage, the naughty foursome finds refuge in the bungalow of a blind couple as their grandson. A cat mouse game unfolds as Laxman's body and Gopal's voice makes for Sameer (The grandson from US). Each time the blinded Dadaji comes amidst them, hilarious situations arise Enter Nirali with a bath towel and the group now have time, place and 'resources' to fall in love. Their individual efforts at winning the lady's heart, fail, resulting in rib tickling comic scenes. Apart from their amorous interests, there is a quest for hidden treasure in the old couple's house. For, there is also a gangster in this story by the name of Babli who has his own story to tell.",['150'],India,Hindi,,7.5,495034
Golmaal 3,2010,"Action, Comedy, Drama",Rohit Shetty,Nothing from IMDB,"Mithun Chakraborty, Ajay Devgn, Kareena Kapoor, Tusshar Kapoor, Arshad Warsi, Shreyas Talpade, Kunal Kemmu, Ratna Pathak Shah, Johny Lever, Sanjay Mishra","After selling fake examination papers to students, Madhav, Laxman and Lucky re-locate to Goa, and not only get into verbal & physical confrontations with Gopal and Laxman, but also ruin their jet-ski and fire-works businesses. Feeling threatened, they inform their bus-driver father, Pritam, who goes to confront Gopal and Laxman, and finds out that their mother, Geeta P. Chopra, is his long-lost love. Gopal's girlfriend, Daboo, overhears their conversation, and gets them dramatically married - just in time as Pritam is heavily in debt and is about to be evicted by goons led by Raghav. Chaos and violent confrontations will become the order when he takes his children to live with Geeta, and the newly married couple may conclude that divorce may be the only solution to end their respective children's disputes.",['155'],India,Hindi,,5.6,1562859
Golmaal Again,2017,"Action, Comedy, Fantasy, Horror",Rohit Shetty,Nothing from IMDB,"Ajay Devgn, Arshad Warsi, Tabu, Shreyas Talpade, Tusshar Kapoor, Kunal Kemmu, Parineeti Chopra, Neil Nitin Mukesh, Prakash Raj, Johny Lever","Gopal,Laxman1,Madhav,Lucky and Laxman 2 live in orphanage of Jamnadas.One day they come across an abandoned baby outside the orphanage and name her Kushi.Gopal and Mahadav don't get well with each other and often have fights.Gopal leaves the orphanage with Laxman 1 and Madhav also leaves with Lucky and Laxman 2.Years later they have grown up an earn good by doing con jobs and send a share to Jamnadas's orphanage.One day they come to know that Jamnadas is no more and they go to attend his prayer meeting.Anna their childhood friend who can communicate with spirits meets them at a prayer meeting.While the 5 boys leave the orphanage after the prayer meeting a strange figure follows them.Anna is sure the boys will come back in orphanage as the strange figure wants their help.",['140'],India,Hindi,,5.0,1806913
Golmaal Fun Unlimited,2006,"Action, Comedy, Drama",Rohit Shetty,Neeraj Vora,"Ajay Devgn, Arshad Warsi, Sharman Joshi, Tusshar Kapoor, Rimi Sen, Paresh Rawal, Sushmita Mukherjee, Vrajesh Hirjee, Mukesh Tiwari, Sanjay Mishra","Gopal, Lucky, Madhav and Laxman - four guys bound together by their child-like notoriety, aimlessness and petty business of conning people for fun and money. Laxman is an intelligent student who is not allowed to pass by his mischievous band of friends Gopal, Madhav and mute Lucky. This is because all four friends use his hostel room to conduct their activities. He is peer-pressured into running a series of scams in order to earn himself and his friends some money. Once thrown out of college bag-n-baggage, the naughty foursome finds refuge in the bungalow of a blind couple as their grandson. A cat mouse game unfolds as Laxman's body and Gopal's voice makes for Sameer (The grandson from US). Each time the blinded Dadaji comes amidst them, hilarious situations arise Enter Nirali with a bath towel and the group now have time, place and 'resources' to fall in love. Their individual efforts at winning the lady's heart, fail, resulting in rib tickling comic scenes. Apart from their amorous interests, there is a quest for hidden treasure in the old couple's house. For, there is also a gangster in this story by the name of Babli who has his own story to tell.",['150'],India,Hindi,,7.5,495034
Golmaal Returns,2008,"Comedy, Crime, Mystery",Rohit Shetty,Nothing from IMDB,"Ajay Devgn, Kareena Kapoor, Arshad Warsi, Tusshar Kapoor, Shreyas Talpade, Amrita Arora, Celina Jaitly, Anjana Sukhani, Murli Sharma, Ashwini Kalsekar","Obsessed with day-time TV soaps, Ekta Santoshi starts suspecting her husband, Gopal, of having an affair with an unknown woman. Not satisfied with his explanations, she decides to investigate, setting off a chain of hilarious events. These involve her dumb brother/hair-stylist, Lucky; her sister-in-law, Esha, who loves ACP Madhav Singh Ghai; two individuals both named Anthony Gonsalves; amongst many others that result in a hapless Gopal's arrest for the homicide of his co-worker, Subodh Mehra.",['135'],India,Hindi,,5.2,1092005
The Long Goodbye,1973,"Comedy, Crime, Drama, Mystery, Thriller",Robert Altman,Nothing from IMDB,"Elliott Gould, Nina van Pallandt, Sterling Hayden, Mark Rydell, Henry Gibson, David Arkin, Jim Bouton, Warren Berlinger, Jo Ann Brody, Stephen Coit","In the middle of the night, private eye Philip Marlowe drives his friend Terry Lennox to the Mexican border. When Marlowe returns home police are waiting for him and learns that Terry's wife Sylvia has been killed. He's arrested as an accessory but released after a few days and is told the case is closed since Terry Lennox has seemingly committed suicide in Mexico. Marlowe is visited by mobster Marty Augustine who wants to know what happened to the $350,000 Lennox was supposed to deliver for him. Meanwhile, Marlowe is hired by Eileen Wade to find her husband Roger who has a habit of disappearing when he wants to dry out but she can't find him in any any of his usual haunts. He finds him at Dr. Veringer's clinic and brings him. It soon becomes obvious to Marlowe that Terry's death, the Wades and Augustine are all somehow interconnected. Figuring out just what those connections are however will be anything but easy.",['112'],United States,"English, Spanish",,7.5,70334
Gopi,1970,"Action, Comedy, Drama, Family",A. Bhimsingh,Nothing from IMDB,"Dilip Kumar, Saira Banu, Pran Sikand, Johnny Walker, Sudesh Kumar, Mukri, Ramayan Tiwari, Shyamlal, Om Prakash, Nirupa Roy","Gopi (Dilip Kumar) stays in the village with his elder brother, Girdhari (Om Prakash) and their younger sister Nandini (Farida Jalal). Girdhari goes to the landlord Lala (Pran) to take money, which he had saved for Nandini's wedding but gets thrown out of the house. Gopi forcibly gets the money but is accused by the landlord of stealing. Sent out of the house by Girdhari, Gopi leaves for the city and vows to come back only after making enough money for Nandini's wedding.",['143'],India,Hindi,,6.8,141135
Grand Masti,2013,"Comedy, Drama, Thriller",Indra Kumar,Nothing from IMDB,"Vivek Oberoi, Riteish Deshmukh, Aftab Shivdasani, Karishma Tanna, Manjari Fadnnis, Sonalee Kulkarni, Pradeep Singh Rawat, Kainaat Arora, Bruna Abdullah, Maryam Zakaria","Amar ,Meet and Prem are in final year of their college who give knowledge to Junior students about sex education they find that the college new principal Robert Pereira is manic and punishes students badly for flirting with girls one of his victims is Hardick.Six years later all three are married and pretend to be happy but don't have a good sex life as their wives are busy handling families they get an invitation of college reunion and decide to go for it.Upon reaching the college the trio see that there is still fear of Robert Pereira as he is out of town they decide to flirt with Rose Mary Marlo and plan to spend night with them but find that Rose is wife of Robert,Mary his daughter and Marlo sister.The trio decide to run for their life but Hardick catches them and asks to kill Robert as his revenge and blackmails with their individual video of spending night with Rose Mary Marlo.",['137'],India,Hindi,,4.5,2476154
Great Grand Masti,2016,"Comedy, Drama, Fantasy, Horror",Indra Kumar,Nothing from IMDB,"Urvashi Rautela, Riteish Deshmukh, Vivek Oberoi, Aftab Shivdasani, Puja Banerjee, Mishti Chakravarty, Shraddha Das, Usha Nadkarni, Kangna Sharma, Ketan Karande",,['134'],India,Hindi,,3.7,4675030
Guddu Rangeela,2015,"Comedy, Drama",Subhash Kapoor,Subhash Kapoor,"Arshad Warsi, Amit Sadh, Ronit Roy, Aditi Rao Hydari, Shriswara, Dibyendu Bhattacharya, Amit Sial, Brijendra Kala, Rajiv Gupta, Devender Chaudhry","Based in the dusty plains of North India, Guddu Rangeela is a story about two cousins trying to make ends meet in the crime infested surroundings. Orchestra singers by day and informants by night, acquiring measly pay offs from the information provided to local gangsters about the richest families in town, has fetched them an easy and safe way to subsist without getting their hands dirty in the bargain. Although cousins by blood, both are very much unlike each other. The love hate rapport of the two comes to be seen through the many dangerously funny circumstances that they are met with and their impromptu methods of saving their skin each time. Having suffered a tragic past at the hands of the gang lord turned politician Billo; the antagonist of the tale; both are discreetly entangled in a 10 year old legal battle against him through Gupta, an honest advocate fighting on their behalf. While the unorthodox and impulsive Guddu aspires to grow out of their hand to mouth way of life by executing the loot themselves, the comparatively self-righteous and mature Rangeela despises the idea of getting onto the dark side of the city's law. Like money, women too are Guddu's poison, who is time and again seen flirting and effortlessly pulling off one night stands. Rangeela on the contrary hasn't moved on from the tragedy that consumed his only love Babli years back. Rangeela's prime motto has always been to overthrow his nemesis Billo, thus undoing the injustice and cruelty that transpired years back. Lucky enough, one such opportunity comes knocking, which he immediately snags and in the process finds himself confronting the vicious and tyrannical Billo. What follows is a chaotic tale of redemption and payback. An ambition, a plan, a kidnapping and a to and fro tale of victory and defeat leading up to a dramatic climax.",['124'],India,Hindi,,5.3,4684028
Guest iin London,2017,Comedy,Ashwani Dhir,Manoj Rajan Tripathi,"Kartik Aaryan, Kriti Kharbanda, Paresh Rawal, Tanvi Azmi, Sanjay Mishra, Naveen Kaushik, Jane Ajia, Ayesha Ali, Zoe Alice-Woodruff, Diane Alitchard",,['132'],India,Hindi,,5.4,6173826
The Guilty,2021,"Crime, Drama, Thriller",Antoine Fuqua,Nothing from IMDB,"Jake Gyllenhaal, Riley Keough, Peter Sarsgaard, Christina Vidal, Eli Goree, Ethan Hawke, Da'Vine Joy Randolph, Christiana Montoya, David Castañeda, Adrian Martinez","The film takes place over the course of a single morning in a 911 dispatch call center. Call operator Joe Baylor (Gyllenhaal) tries to save a caller in grave danger-but he soon discovers that nothing is as it seems, and facing the truth is the only way out.",['90'],United States,"English, Spanish",,6.3,9421570
Gulaal,2009,"Crime, Drama, Thriller",Anurag Kashyap,Nothing from IMDB,"Kay Kay Menon, Raj Singh Chaudhary, Raja Chaudhary, Jesse Randhawa, Deepak Dobriyal, Ayesha Mohan, Mahie Gill, Piyush Mishra, Abhimanyu Singh, Aditya Srivastav","Bikaner-based 28-year-old Dilip Kumar Singh is enrolled in a Rajpur-based Law college, and rents a room with an unstable male, Rananjay Singh. His attempts to re-locate to a hostel, pits him against a group of men, led by Jadhwal, who not only assault, but also molest him, and then lock him in a dark room with a naked and abused female, Anuja. He recuperates in a hospital and joins hands with Rananjay and Dukey Bana to avenge this humiliation, as well as befriends Anuja, who is a Lecturer in the college. He also decides to support Rananjay, who is legitimate son of a former Raja, to run for college elections - and it is this decision that will shatter and change his life forever.",['140'],India,Hindi,,8.0,1261047
Gully Boy,2019,"Drama, Music, Romance",Zoya Akhtar,Nothing from IMDB,"Ranveer Singh, Alia Bhatt, Siddhant Chaturvedi, Vijay Raaz, Amruta Subhash, Jyoti Subhash, Vijay Varma, Kalki Koechlin, Iqlaq Khan, Sheeba Chaddha","""Gully Boy"" is a film about a 22-year-old boy ""Murad"" from a ghetto in Mumbai, India. The son of a driver, his parents worked hard to get him educated so that he could have a white collar job. Meanwhile, Murad realizes his calling to be a rapper. Authentic Hip Hop in India is a recent phenomenon and like anywhere else in the world, is rising from the streets. Art is a distant dream for the colonized poor of India and this story is about Murad's journey from realizing his love for rap and chasing his dream to inadvertently transcending his class. The film showcases street rap from the crevices of Mumbai's by lanes. The poetry is conscious of the city's socio-economic fabric and highlights the challenges faced by the disenfranchised youth in the minority population.",['154'],India,"Hindi, English",,7.9,2395469
Gumrah,1993,"Action, Crime, Drama, Thriller",Mahesh Bhatt,Nothing from IMDB,"Sanjay Dutt, Sridevi, Anupam Kher, Rahul Roy, Soni Razdan, Reema Lagoo, Kunika Sadanand, Tom Alter, Bob Christo, Anang Desai","Roshni Chadha is the only child of Sharda Chhadha, and has no knowledge of the whereabouts of her absconding dad, Prakash Chhadha. Roshni is introduced to Rahul Malhotra and both are attracted to each other. Rahul finds out that she can sing, assists her in becoming a professional singer, and she becomes famous nationwide. She has a fan named Jaggannath alias Jaggu, a street-wise small-time black-marketeer, but she chooses to ignore him. On a trip to Mauritius with Rahul, Roshni is apprehended by the police and arrested on the charge of possession of drugs. She is imprisoned, and Rahul is nowhere to be found. Then a lawyer and Jaggu come to her assistance, but are unable to do much, as Roshni is found guilty, and in keeping with the laws of that country, her sentence is - death!",['149'],India,Hindi,,6.1,107060
Gunday,2014,"Action, Drama, Musical, Romance",Ali Abbas Zafar,Nothing from IMDB,"Ranveer Singh, Arjun Kapoor, Priyanka Chopra Jonas, Irrfan Khan, Karan Aanand, Victor Banerjee, Prasanjit Chatterjee, Diwakar Dhyani, Darshan Gurjar, Uttam Halder","The war of 1971 gave birth to Bangladesh and two young orphans - Bikram (Ranveer Singh) and Bala (Arjun Kapoor). They became Calcutta's most loved and most powerful GUNDAY. Nandita (Priyanka Chopra), the beautiful cabaret dancer, walked in and they fell head over heels in love with her. And then entered ACP Satyajeet Sarkar (Irrfan Khan), a law for every outlaw and a counter force for Bikram and Bala.",['152'],India,"Hindi, Bangla",,2.7,2574698
Gunda,1998,"Action, Comedy, Crime, Drama, Musical",Kanti Shah,Bashir Babar,"Mithun Chakraborty, Mukesh Rishi, Mohan Joshi, Shakti Kapoor, Verna Raj, Harish Patel, Ishrat Ali, Rami Reddy, Deepak Shirke, Rana Jung Bahadur","The gangster Bulla (Mukesh Rishi) becomes the crime lord of Mumbai after killing his rival Lamboo Aata (Ishrat Ali). However, when his right hand man Kala Shetty (Rami Reddy) is arrested by police due to the intervention of a coolie and a good samaritan Shankar (Mithun Chakraborty), Bulla swears revenge. He manages to trap Shankar's sister Geeta (Sapna) into a sham marriage with Gulshan (Gulshan Rana) who is a scamster working for the pimp Lucky Chikna (Razak Khan). Bulla's younger brother Chutiya (Shakti Kapoor), who has long been impotent, becomes sex-crazed under the influence of London-imported pills provided by his loving elder brother and proceeds to brutally rape Geeta and ends up killing her. When Shankar's policeman father is also killed by the corrupt Inspector Kale (Rana Jung Bahadur), Shankar swears that he will kill Bulla, Chutiya, their ally Potey (Mohan Joshi) and the rest of their entourage within ten days.",['129'],India,Hindi,,7.3,497915
Gupt: The Hidden Truth,1997,"Action, Crime, Mystery, Romance, Thriller",Rajiv Rai,Nothing from IMDB,"Bobby Deol, Manisha Koirala, Kajol, Prem Chopra, Raza Murad, Paresh Rawal, Sadashiv Amrapurkar, Sharat Saxena, Dalip Tahil, Kulbhushan Kharbanda","Jaisingh lives in India with his son, Sahil, who dislikes his father. Things only get worse between father and son, when Jaisingh wants him to get married to Sheetal, a woman he has chosen to be his daughter-in-law. But Sahil wants to marry another girl by the name of Isha, and no amount of pressure can get him to change his mind. Finally, an argument ensues between the two, with Jaisingh getting killed. The Police are summoned, they arrest Sahil, try him in the Indian courts, convict him, but instead of giving him the death sentence, they put him in jail for life. A defiant Sahil, who still maintains his innocence, finds a way to escape, with the authorities hot on his tail, and leading this chase is a senior policeman by the name of Udham Singh, who has never been known to fail in his job of apprehending runaways and other criminals.",['173'],India,Hindi,,7.3,119239
Gurgaon,2017,"Crime, Thriller",Shanker Raman,Nothing from IMDB,"Akshay Oberoi, Pankaj Tripathi, Aamir Bashir, Ragini Khanna, Shalini Vatsa, Yogi Singha, Srinivas Sunderrajan, Anastasiya Ador, Sanjiv Ahuja, Anil","Story of a family is intertwined with the city of Gurgaon. There is a rebel, in the house of ambition with a gory past and greedy present. As he gets in big trouble, so do people around him. What will be the outcome of the chaos? What future has in store for this family?",['107'],India,Hindi,,6.4,4699202
Guru,1989,Crime,Umesh Mehra,Nothing from IMDB,"Mithun Chakraborty, Sridevi, Shakti Kapoor, Roopesh Kumar, Amrit Pal, Yunus Parvez, Bob Christo, Arun Bakshi, Sameer Kakkar, Seema Deo","Guru's ambition is to become an upright Police officer, but unluckily he is not getting selected. His sole strength is his lady love Uma. As Guru's ambition fails, he turns to alcohol and criminality. He finally joins a smuggling gang run by gangster Vicky to take revenge on the Police force which thwarted his ambition. But he is shocked to see that Uma is also working for the same gang. One day, Vicky receives a confidential message about an undercover police officer in his gang.",['174'],India,Hindi,,5.6,97466
Guru,2007,Drama,Mani Ratnam,Nothing from IMDB,"Mithun Chakraborty, Abhishek Bachchan, Aishwarya Rai Bachchan, Madhavan, Vidya Balan, Roshan Seth, Anaushka Dantra, Mallika Sherawat, Sunil Agarwal, Murad Ali","A school-teacher in India sires a son named Gurukant, but is disappointed as the child fails to live up to his high expectations. When Gurukant grows up, he is unable to secure decent employment in India, so finds a way to go to Turkey, where he finds employment. When he returns back to India, he wants to start his own business, but is unable to do so, as he does not have enough money. So he does some research, gets to meet Sujata, the daughter of a wealthy man named Jignesh, and marries her. After the marriage, Gurukant finds out that Sujata has a dark past, but he ignores this - for his one motive is to be to rise in the eyes of his father - and get rich.",['162'],India,Hindi,,7.7,499375
Gurudev,1993,"Action, Drama, Romance",Vinod Mehra,Nothing from IMDB,"Rishi Kapoor, Sridevi, Anil Kapoor, Kader Khan, Kiran Kumar, Danny Denzongpa, Pran Sikand, Govardhan Asrani, Shammi, Satyendra Kapoor","Inspector Dev Kumar and Gaurav alias Guru are childhood friends. The problem is that while Dev Kumar is with the police, his dad, Parshu Ram, works with the underworld, and is the right-hand man of Kakhan, a criminal don, who is also Guru's dad. When Inspector Khan is assigned the case of apprehending Kakhan, his first suspect is none other than Dev himself, and Dev must prove to Khan that he is earnest, and will not hesitate to arrest Kakhan. It remains to be seen if Dev will really apprehend his friend's dad, or just play around without really getting anywhere.",['147'],India,Hindi,,4.5,187109
