Title,Year,Genres,Directors,Writers,Cast,Plot,Runtime,Country,Language,Awards,Rating,MovieCode
Rocky,1981,"Action, Romance","Sunil Dutt, Raj Khosla",Nothing from IMDB,"Sanjay Dutt, Reena Roy, Tina Ambani, Ranjeet Bedi, Aruna Irani, Shakti Kapoor, Amjad Khan, Rakhee Gulzar, Shashikala Jawalkar, Iftekhar","Shankar a union leader looses his life in accident at work site while he was fighting with his boss Ratanlal for rights of workers,Ratanlal decides to agree on Shankar's demands after his death with due respect.But JD and Ram Avtar aren't happy with his decision and kill him unlike Shankar.Shankar's friend Robert Dsouza decides to support his family but JD starts to eye Shankar's widow Parvati and tries to molest her,while trying to save his mother Shankar's son Rakesh hurts himself and goes in trauma.Rakesh whenever sees his mother gets the same vision and looses his control so Robert and his wife Katy decide to adopt him and name him Rocky Dsouza.Years later Rocky has grown up to be a handsome guy and falls in love with Renu daughter of Ratanlal while on trip to Srinagar but Renu mistakes him to be RD son of JD until the truth is out.Rocky and Renu fall in love and RD tries to creates hurdles where Rocky also finds that JD was responsible for spoiling their life and killing his father.",['151'],India,Hindi,,6.5,215132
Rocky Aur Rani Kii Prem Kahaani,2023,"Comedy, Drama, Family, Romance",Karan Johar,Nothing from IMDB,"Ranveer Singh, Alia Bhatt, Dharmendra, Shabana Azmi, Jaya Bachchan, Tota Roy Chowdhury, Churni Ganguly, Aamir Bashir, Kshitee Jog, Anjali Anand","Dhanlaxmi Randhawa is an arrogant business women who always considered her husband Kanwal a loser and never let her son Tijori get closer to him.Kanwal met with an accident and became bound to wheelchair for lifetime,years later he has some moments in his body and takes the name Jamini.The doctors ask the family to trace Jamini as it could help him recover his grandson Rocky whose very much closer to him traces Jamini Chatterjee and finds that her granddaughter is a popular anchor Rani Chatterjee.Rocky meets Rani and speaks about Kanwal to her and asks to confirm if her grandmother knew him,Rani does not take him seriously but Jamini revels the truth.Jamini and her family come to meet Kanwal after seeing her he is finally able to get up from his wheelchair and kiss Jamini which does not go well with Dhanlaxmi and her son Tijori.Rocky and Rani try to arrange meetings for their grandparents without the knowledge of their parents and become close to each other.When Rocky proposes Rani she rejects it saying it wasn't a serious relationship but while covering a news assignment in Shimla she realizes her love for Rocky.Rani returns back and revels her love for Rocky but Rani still hasn't planned for marriage as both their families have different mindset and culture.In order understand each others family they decide to live in either house and make a place in family.But Dhanlaxmi has already made her mind that she will never allow their marriage to take place.",['168'],India,"Hindi, English",,6.6,14993250
Gala de presentación de la programación 2004/2005: Contamos todos,2004,Music,Nothing from IMDB,Nothing from IMDB,"David Bisbal, Carlinhos Brown, Luz Casal, El Gran Wyoming, Juanes, Rosa Maria Sardà",,,Spain,Spanish,,,2064785
Schindler's List,1993,"Biography, Drama, History",Steven Spielberg,Nothing from IMDB,"Liam Neeson, Ben Kingsley, Ralph Fiennes, Caroline Goodall, Jonathan Sagall, Embeth Davidtz, Malgorzata Gebel, Shmuel Levy, Mark Ivanir, Béatrice Macola","Oskar Schindler is a vain and greedy German businessman who becomes an unlikely humanitarian amid the barbaric German Nazi reign when he feels compelled to turn his factory into a refuge for Jews. Based on the true story of Oskar Schindler who managed to save about 1100 Jews from being gassed at the Auschwitz concentration camp, it is a testament to the good in all of us.",['195'],United States,"English, Hebrew, German, Polish, Latin",,9.0,108052
Split,2016,"Horror, Thriller",M. Night Shyamalan,M. Night Shyamalan,"James McAvoy, Anya Taylor-Joy, Betty Buckley, Haley Lu Richardson, Jessica Sula, Izzie Coffey, Brad William Henke, Sebastian Arcelus, Neal Huff, Ukee Washington","Though Kevin (James McAvoy) has evidenced 23 personalities to his trusted psychiatrist, Dr. Fletcher (Betty Buckley), there remains one still submerged who is set to materialize and dominate all of the others. Compelled to abduct three teenage girls led by the willful, observant Casey, Kevin reaches a war for survival among all of those contained within him -- as well as everyone around him -- as the walls between his compartments shatter.",['117'],"United States, Japan",English,,7.3,4972582
In Your Name,2003,"Action, Drama, Romance",Satish Kaushik,Nothing from IMDB,"Salman Khan, Bhoomika Chawla, Sachin Khedekar, Savita Prabhune, Ravi Kishan, Anang Desai, Sarfaraz Khan, Darshan Kumaar, Gopal Datt, Saurabh Dubey","A woman comes from a Decent family. Her name is Nirjala. Her family want her to get married to a Normal Young Man. She agrees to do so. But before the wedding, she meets with Radhe.This man has a very hot temper and gets into fights all the time. But both fall in love with each other. Nirjala's family refuse to permit her to get married to him. They force her to get married to the man of their choice. In the meantime, Radhe gets into fight, and someone hits him very hard on his head. Radhe loses his senses and falls down. When he wakes him, he finds himself a mental patient. The hospital finds him very violent and they chain. He is unable to remember his past. Then Nirjala re-enters his life. Will this cure Radhe or make him even worse?",['132'],India,Hindi,,7.2,374271
The Room,2019,"Drama, Fantasy, Horror, Mystery, Thriller",Christian Volckman,Nothing from IMDB,"Olga Kurylenko, Kevin Janssens, Joshua Wilson, John Flanders, Francis Chapman, Vince Drews, Marianne Bourg, Oscar Lesage, Carole Weyers, Michaël Kahya","Loving young couple Kate and Matt move into a secluded mansion and discover a strange secret room whose interior holds the power to make everything they want a reality. Millions of dollars, the original of Van Gogh and the most luxurious outfits--whatever they want instantly materializes. One day, she decides to ask the room to grant them the child they haven't been able to have. But their initial happiness from this blessing will have unforeseen consequences. As they say: careful what you wish for.",['100'],"France, Belgium, Luxembourg",English,,6.0,8485364
The Client,1994,"Crime, Drama, Mystery, Thriller",Joel Schumacher,Nothing from IMDB,"Susan Sarandon, Tommy Lee Jones, Mary-Louise Parker, Anthony LaPaglia, J.T. Walsh, Anthony Edwards, Brad Renfro, Will Patton, Bradley Whitford, Anthony Heald","Mark Sway is an 11-year-old boy who lives with his mother and brother in a trailer. One day, he and his brother are hanging out when a car pulls over beside them. The driver then sticks a hose in his exhaust and puts the other end into the car. Mark pulls it out. But the man sees him and grabs him and takes inside the car. The man talks to Mark then later shoots himself. The shock sends Mark's brother into a catatonic state. .And one of his clients is a member of a mob family who is suspected of killing a Senator who was trying to take down his family. But because the Senator's body is missing, they can't prosecute him. Roy Foltrigg (Tommy Lee Jones) thinks the lawyer told Mark where the body is which is why he wants to speak to him. Mark goes to meet Roy and when he threatens him, Mark steps out then Reggie comes in with a recording of his conversation with Mark telling him that made several violations. In the meantime, the mobster is told by the head of the family to take care of Mark. So, he threatens Mark. Mark doesn't know what to do and learns that Reggie has some secrets of her own and is uncertain if he can trust her.",['119'],United States,English,,6.7,109446
The Equalizer 3,2023,"Action, Crime, Thriller",Antoine Fuqua,Nothing from IMDB,"Denzel Washington, Dakota Fanning, Eugenio Mastrandrea, David Denman, Gaia Scodellaro, Remo Girone, Andrea Scarduzio, Andrea Dodero, Daniele Perrone, Zakaria Hamza","Since giving up his life as a government assassin, Robert McCall (Denzel Washington) has struggled to reconcile the horrific things he's done in the past and finds a strange solace in serving justice on behalf of the oppressed. Finding himself surprisingly at home in Southern Italy, he discovers his new friends are under the control of local crime bosses. As events turn deadly, McCall knows what he has to do: become his friends' protector by taking on the mafia.",['109'],"United States, Italy","English, Italian",,6.8,17024450
The Fabelmans,2022,Drama,Steven Spielberg,"Steven Spielberg, Tony Kushner","Michelle Williams, Paul Dano, Seth Rogen, Gabriel LaBelle, Mateo Zoryan, Keeley Karsten, Alina Brace, Julia Butters, Birdie Borria, Judd Hirsch","Loosely based on Spielberg's childhood growing up in post-World War II era Arizona, from age seven to eighteen, a young man named Sammy Fabelman discovers a shattering family secret, and explores how the power of movies help us see the truth about each other and ourselves.",['151'],"United States, India",English,,7.5,14208870
