Title,Year,Genres,Directors,Writers,Cast,Plot,Runtime,Country,Language,Awards,Rating,MovieCode
Haan Maine Bhi Pyar Kiya,2002,"Drama, Musical, Romance",Dharmesh Darshan,Nothing from IMDB,"Akshay Kumar, Karisma Kapoor, Abhishek Bachchan, Kader Khan, Himani Shivpuri, Shakti Kapoor, Navneet Nishan, Mohnish Behl, Supriya Karnik, Sophiya Haque","Shiv (Abhishek Bachchan) and Pooja (Karisma Kapoor) are happily married to each other but sometimes can get into the most petty arguments coming from the way they approach life. Shiv takes each day as it comes whilst Pooja's imagination sometimes gets the best of her. Pooja falls in love with Shiv so much that she gives up her high rising career for him and settles as a housewife. Their in-difference gets worse and Pooja is soon convinced that Shiv has been unfaithful. Pooja asks for a divorce and leaves him. She carries on with life and meets Raj (Akshay Kumar). Raj has everything anyone could ask for: money, fame but not love something he has craved for some time. He falls for Pooja and she also begins to like him. They get engaged and as the wedding approaches, Shiv re-enters Pooja's life. Old feelings and emotions come rushing back and she finds herself torn between two men. Who does she choose...?",['174'],India,Hindi,,3.6,308347
Haasil,2003,"Crime, Drama, Romance",Tigmanshu Dhulia,Nothing from IMDB,"Jimmy Shergill, Hrishitaa Bhatt, Irrfan Khan, Ashutosh Rana, Tinnu Anand, Murad Ali, Sundieep Arya, Varun Badola, Deepak Kumar Bandhu, Rajiv Gupta","When college student Aniruddha meets pretty co-ed Niharika, they quickly become romantically involved. Unfortunately, their relationship can't escape the politics involved in sex and gang life. When Aniruddha meets Ranvijay, a big man on campus prone to toting a gun, he believes he's merely helping his fellow student escape from a rival gang. It's not long into their friendship, however, that Aniruddha realizes Ranvijay is just using him as a means to get to Niharika.",['160'],India,"Hindi, Awadhi",,7.6,362696
Haatim Tai,1990,"Drama, Fantasy, Romance",Babubhai Mistry,Nothing from IMDB,"Jeetendra, Sangeeta Bijlani, Sonu Walia, Satish Shah, Amrish Puri, Alok Nath, Rahul Singh, Vijayendra Ghatge, Goga Kapoor, Huma Khan","Hatim Tai is the legendary chief of a small district. He is Known for his generosity, wisdom and courage. Hatim learns that one of the local girls in his town has a curse put on her - whomever marries her, the husband will die. In order to break this curse, Hatim agrees to take part in 7 quests. All 7 quest are dangerous but have a moral. If he completes all 7 then he will also release the fairy who has turned into a stone. Hatim and his friend (Satish Shah) embark on a fun but dangerous quest to break the curse once and for all.",['125'],India,Hindi,,5.8,242509
Hacked,2020,Thriller,Vikram Bhatt,Nothing from IMDB,"Hina Khan, Rohan Shah, Komal Chhabria, Mohit Malhotra, Tanvi Thakkar, Sid Makkar, Govind Bhana, Ram Naresh Diwakar, Sheetal Dabholkar, Vyas Hemang","Vivek is a hacker who troubles girls by hacking their phones and laptop computers. Because of his hacking, Sameera even loses her job. Sameera and Rohan decide to teach Vivek a lesson but Sameera ends up murdering Vivek. However, Vivek's hacking action saves Sameera from the clutches of law. How this happens is shown in the climax.",['118'],India,Hindi,,4.3,11027850
Hadh Kar Di Aapne,2000,"Comedy, Romance",Manoj Agrawal,Nothing from IMDB,"Govinda, Rani Mukerji, Johny Lever, Paresh Rawal, Satish Kaushik, Tinnu Anand, Avtar Gill, Viju Khote, Bharat Kapoor, Navneet Nishan","Anjali Khanna had always suspected her husband, Sanjay, of cheating on her, and flirting with other women. In order to keep an eye on him and his activities, she asks her friend, who is also named Anjali Khanna (Rani Mukherji) to go abroad under her name, which she does so. When Sanjay finds out that Anjali to go abroad, he hires Raj Malhotra to follow Anjali and make sure she is not having an affair, Raj does so with hilarious results.",['134'],India,Hindi,,5.3,244528
Haider,2014,"Action, Crime, Drama, Thriller",Vishal Bhardwaj,Nothing from IMDB,"Tabu, Shahid Kapoor, Shraddha Kapoor, Kay Kay Menon, Narendra Jha, Kulbhushan Kharbanda, Lalit Parimoo, Ashish Vidyarthi, Aamir Bashir, Sumit Kaul","In Vishal Bhardwaj's adaptation of William Shakespeare's 'Hamlet', young fellow Haider returns home to Kashmir on receiving news of his father's disappearance. Not only does he learn that security forces have detained his father for harboring militants, but also that his mother is in a relationship with his very own uncle. Intense drama follows between mother and son as both struggle to come to terms with the news of his father's death. Soon Haider learns that his uncle is responsible for the gruesome murder; what follows is his journey to avenge his father's death.",['160'],India,Hindi,,8.0,3390572
Halahal,2020,"Crime, Drama, Mystery, Thriller",Randeep Jha,Nothing from IMDB,"Barun Sobti, Purnendu Bhattacharya, Sachin Khedekar, Manu Rishi Chadha, Sanya Bansal, Vijay Kumar Dogra, Anuradha Mukherjee, Chetan Sharma, Enab Khizra, Chandramogli Madem","The murder of a medical college girl morphed into a suicide takes Dr. Shiv Sharma (father of the girl) on a journey to dig the truth out of his daughter's murder, with the help of a corrupt police officer, Yusuf. He realises that it is not a normal murder case but instead, there is a scam going on behind all this where students are being killed to hide the truth from the world. Eventually, Dr. Shiv finds out that his daughter was also one of the conspirators of the scam. Will he expose the scam to the world along with his daughter? Or will he hide the facts from the world? Will it be a life changing case for Yusuf to make money from Dr. Shiv in return for his help?",['97'],India,Hindi,,7.0,9875128
Half fry,2009,Comedy,Sanjay Punjabi,Nothing from IMDB,Safi Quadri,,['145'],India,Hindi,,,14575344
Half Girlfriend,2017,"Drama, Romance",Mohit Suri,Nothing from IMDB,"Vikrant Massey, Shraddha Kapoor, Arjun Kapoor, Paula McGlynn, Rhea Chakraborty, Dalip Sondhi, Seema Biswas, Ella Ayberk, Shriidhar Dubey, Adam Davenport","Once upon a time, there was a Bihari boy called Madhav. He fell in love with a girl from Delhi called Riya. Madhav didn't speak English well. Riya did. Madhav wanted a relationship. Riya didn't. Riya just wanted friendship. Madhav didn't. Riya suggested a compromise. She agreed to be his half girlfriend.",['135'],India,Hindi,,4.6,5474042
Hamaara Sansaar,1978,Drama,T. Prakash Rao,Nothing from IMDB,"Parikshit Sahni, Nutan, Mithun Chakraborty, Sarika Thakur, Jalal Agha, Nasir Hussain, Aruna Irani, Paidi Jairaj, Shashikala Jawalkar, Alankar Joshi","Pratap Sharma and Geeta live happily together with their children. Son Arun and daughter Asha. Pratap has a younger brother, Prem. Who also graduated with honors from the university and occasionally visits his older brother in the city. Prem lives in a village with his mother (Pratap's stepmother). A sister and her husband also moved in with them, who left her mother-in-law's house because she was forced to work. But Prem is against it, and he sends them back with her husband. Prem's mother is also traveling with them. But instead of going to the house of their daughter's husband, they decide to go to the city to Pratap and stay with him, under whatever pretext.",['128'],India,Hindi,,7.3,254371
Hamari Adhuri Kahani,2015,"Drama, Romance",Mohit Suri,Nothing from IMDB,"Emraan Hashmi, Vidya Balan, Rajkummar Rao, Sara Khan, Suhasini Mulay, Narendra Jha, Madhurima Tuli, Amala Akkineni, Mukesh Agrohari, Bhavesh Balchandani","Hamari Adhuri Kahani (English: Our Incomplete Story) is a 2015 Indian romantic drama directed by Mohit Suri and produced by Mahesh Bhatt under the banner Vishesh Films and Fox Star Studios. The film stars Emraan Hashmi, Vidya Balan, and Rajkummar Rao. It is based on the love story of Bhatt's parents, Nanabhai Bhatt, Shirin Mohammad Ali and his stepmother.",['129'],India,Hindi,,6.7,3483612
