Title,Year,Genres,Directors,Writers,Cast,Plot,Runtime,Country,Language,Awards,Rating,MovieCode
Gargi,2022,"Drama, Thriller",Gautham Ramachandran,Nothing from IMDB,"Sai Pallavi, Kaali Venkat, R.S. Shivaji, Kavithalaya Krishnan, Saravanan, Sudha S., Prathap, P. Rajalakshmi, Livingston, Aishwarya Lekshmi",,['140'],India,Tamil,,8.1,21261388
2004 Jammys: The Theatre at Madison Square Garden,2004,Music,Nothing from IMDB,Nothing from IMDB,"The Assembly of Dust, Dickey Betts, Edie Brickell, Oteil Burbridge, Solomon Burke, The Disco Biscuits, Dr. John, Perry Farrell, Warren Haynes, Toots Hibbert",,,United States,English,,8.8,459614
Symphony in August,2009,Animation,Akio Nishizawa,Nothing from IMDB,"Misato Fukuen, Keiko Takahashi, Takahiro Mizushima, Wataru Takagi, Kazuya Takahashi, Gaku Yamamoto, Hiroyuki Yoshino",,['120'],Japan,Japanese,,6.1,1492701
Gautamiputra Satakarni,2017,"Action, History",Radha Krishna Jagarlamudi,Nothing from IMDB,"Nandamuri Balakrishna, Hema Malini, Shriya Saran, Kabir Bedi, Tanikella Bharani, David Blazejko, Snehith Chowdary, Milind Gunaji, David Manucharov, Harsha Krishna Murthy",,['131'],India,Telugu,,6.3,5832544
Geetha Govindam,2018,"Comedy, Drama, Romance",Parasuram,Parasuram,"Vijay Deverakonda, Rashmika Mandanna, Subbaraju, Mouryaani, Rahul Ramakrishna, Vennela Kishore, Nagababu, Annapoorna, Giri Babu, Kalyani Natarajan","Vijay Govind, a young college lecturer who dreams of marriage falls for Geetha, a level-headed woman who's wary of strangers and isn't easy to convince. While things seem to go smoothly, Vijay makes a terrible mistake which not only derails any hope for his love story, but also potential repercussions with his family.",['142'],India,Telugu,,7.7,8590896
Gehraiyaan,2022,"Drama, Romance",Shakun Batra,Nothing from IMDB,"Deepika Padukone, Ananya Panday, Naseeruddin Shah, Siddhant Chaturvedi, Kanupriya Gupta, Rajat Kapoor, Shehzad Shaikh, Shataf Figar, Sunil Borkar, Pavleen Gujral",,['148'],India,Hindi,,5.8,10733228
Gehraiyaan,2022,"Drama, Romance",Shakun Batra,Nothing from IMDB,"Deepika Padukone, Ananya Panday, Naseeruddin Shah, Siddhant Chaturvedi, Kanupriya Gupta, Rajat Kapoor, Shehzad Shaikh, Shataf Figar, Sunil Borkar, Pavleen Gujral",,['148'],India,Hindi,,5.8,10733228
Gehri Chaal,1973,"Action, Crime, Thriller",C.V. Sridhar,Nothing from IMDB,"Jeetendra, Hema Malini, Amitabh Bachchan, Prem Chopra, Bindu Desai, Chandrashekhar Vaidya, Paidi Jairaj, Prem Kumar, Suraj, Anand","Dharamchand is the chairman of Olympic bank which has its audit due, his daughter Hema finds him dead in bedroom and calls her brother Ratan.Ratan finds a suicide note besides him which mentions that he had taken 20 Lakhs from his band and was unable to pay hence he committed suicide Ratan hides it from everyone including Hema to protect name of his family.Ratan is then approached by a man called Shekar who works for an unknown identity and tells him that he has to assist them in the bank robbery before the audit or else his secret will be out.Ratan decides to be part of the crime in order to protect his family name just when he thinks that his troubles are over Hema sees the robbers and identifies one of the women as Shobha.But Ratan asks Hema to keep it a secret soon Ratan has a visitor Sagar his old friend he as well as Hema feels that Sagar is not the one whom he claims to be.While Ratan believes he could expose his family secret.",['147'],India,Hindi,,5.4,70097
Ghar Ek Mandir,1984,Drama,K. Bapaiah,Nothing from IMDB,"Shashi Kapoor, Moushumi Chatterjee, Mithun Chakraborty, Ranjeeta Kaur, Raj Kiran, Prem Chopra, Aruna Irani, Suresh Oberoi, Kader Khan, Shoma Anand","A joint family consisting of three brothers Prem (Shashi Kapoor), Vijay (Raj Kiran) and Ravi (Mithun Chakraborty) are leading a happy and prosperous life. They consider their house temple of Love. However, destiny has its own plans for them when Prem gets killed. Seth Dharampal (Kader Khan) also wants to cheat them. Would Ravi alone be able to save his home? Would Seth Dharampal succeed in his evil intentions?",['156'],India,Hindi,,5.5,154531
Ghatak: Lethal,1996,"Action, Drama",Rajkumar Santoshi,Nothing from IMDB,"Sunny Deol, Meenakshi Sheshadri, Danny Denzongpa, Amrish Puri, Mukesh Rishi, Anjan Srivastav, Tinnu Anand, K.K. Raina, Viju Khote, Harish Patel","Unable to witness the injustice and brutality inflict on the residents by a tyrannical gangster, Katya, in a small Indian village in India; Kashinath alias Kashi decides to single-handily take a stand to fight for his and the villagers rights. What follows is a series of violence and unlawful activities which not only endanger the life of those very villagers but also that of Kashi's love ones.",['158'],India,Hindi,,7.5,116407
