Title,Year,Genres,Directors,Writers,Cast,Plot,Runtime,Country,Language,Awards,Rating,MovieCode
"On the Other Hand, Death",2008,"Crime, Drama, Mystery",Ron Oliver,"Gillian Horvath, Ron McGee","Chad Allen, Sebastian Spence, Margot Kidder, Gabrielle Rose, Nelson Wong, Daryl Shuttleworth, Damon Runyan, Lori Triolo, William MacDonald, Barclay Hope","A mysterious client of private eye Don Strachey pays him cash to tail a woman who turns out to be an undercover officer; an older lesbian couple are victims of threats and vandalism; an old flame of his lover Tim shows up to support the older couple; neighbors are angry at the couple for refusing to sell out to a developer; and, parents are angry at one of the couple, Dorothy, for being a good guidance counselor to gay teens. Her partner, Edith, wants to move away; Dorothy is adamant about staying. When someone dies in a fire in their barn, the stakes get higher. Don, who does not believe in coincidence, gives the police enough information to stay on their good side as he pursues the truth.",['86'],"Canada, United States",English,,6.4,1238298
One Missed Call,2008,"Horror, Mystery",Eric Valette,Nothing from IMDB,"Shannyn Sossamon, Edward Burns, Ana Claudia Talancón, Ray Wise, Azura Skye, Johnny Lewis, Jason Beghe, Margaret Cho, Meagan Good, Rhoda Griffis","After the death of their friend Shelley, Leann Cole receives a voice mail from the future of the date and time when she would die. On the scheduled day, Leann sees weird things and in the precise informed hour, Leann is attacked by a supernatural force on a footbridge over a train station while talking to her friend Beth Raymond. Beth meets Leann's boyfriend Brian, who also received a call, and witnesses his death on the street. When her roommate Taylor Anthony receives a call, Beth befriends Det. Jack Andrews, who tells her that his sister was the first victim of the phone call. They decide to investigate the connections of Jack's sister and find the name of Marie Layton, who apparently abused of her daughters. Jack and Beth run against time trying to save Beth from her fate.",['87'],"United States, Japan, Germany, United Kingdom",English,,4.0,479968
Open Road,2013,"Action, Drama, Thriller",Marcio Garcia,Julia Camara,"Camilla Belle, Andy Garcia, Colin Egglesfield, Juliette Lewis, Christiane Torloni, Carol Castro, John Savage, Kristi Clainos, Emily Nelson, Craig Gellis","The Brazilian painter Angie left her mother Glória and her sister Sônia to seek out her father, who left her family when she was a child, in the United States of America. Angie wanders and camps in a tent and works as waitress in diners to raise some money. She befriends the homeless Chuck that protects her while she is camping. When she decides to move to another place, she stops at the roadside to sleep. She is awaken by the highway police officer David and she finds that her engine has an expensive problem. David offers a job to Angie with his cousin Jill and to lodges her in his trailer. Soon they have a love affair but Angie does not want a commitment with David. She leaves him but soon she makes discoveries that will change her feelings.",['85'],"Brazil, United States","English, Portuguese",,5.3,1922679
Oru Muthassi Gadha,2016,"Comedy, Drama, Family",Jude Anthany Joseph,Jude Anthany Joseph,"Vineeth Sreenivasan, Aparna Balamurali, Suraj Venjaramoodu, Sreenivasan, Jude Anthany Joseph, Vijayaraghavan, Rajeev Pillai, Lenaa, Renji Panicker, Lal Jose",,['144'],India,Malayalam,,6.3,5458448
Out of the Furnace,2013,"Action, Crime, Drama, Thriller",Scott Cooper,"Brad Ingelsby, Scott Cooper","Woody Harrelson, Dendrie Taylor, Carl Ciarfalio, Nancy Mosser, Christian Bale, Casey Affleck, Zoe Saldana, Sam Shepard, Bingo O'Malley, Tom Bower","Russell and his younger brother Rodney live in the economically depressed Rust Belt and have always dreamed of escaping and finding better lives. But when a cruel twist of fate lands Russell in prison, Rodney becomes involved with one of the most violent and ruthless crime rings in the Northeast - a mistake that will cost him everything. Once released, Russell must choose between his own freedom or risking it all to seek justice for his brother.",['116'],"United Kingdom, United States",English,,6.7,1206543
Outlaw King,2018,"Action, Biography, Drama, History, War",David Mackenzie,Nothing from IMDB,"Chris Pine, Stephen Dillane, Rebecca Robin, Billy Howle, Paul Blair, Sam Spruell, Jonny Phillips, Ben Clifford, Jamie Maclachlan, Duncan Lacroix","After being declared ""Outlaw"" by the occupying English Empire, Robert the Bruce (Chris Pine) raises an army of Scottish fighters in rebellion. Twists and turns all across the Scottish countryside lead this film on an epic, ""true to historical events"", journey that captures heroism at its core!",['121'],"United Kingdom, United States","English, French, Scottish Gaelic, Latin",,6.9,6679794
Outlaws and Angels,2016,"Action, Thriller, Western",JT Mollner,Nothing from IMDB,"Chad Michael Murray, Frances Fisher, Teri Polo, Luke Wilson, Francesca Eastwood, Ben Browder, Madisen Beaty, Steven Michael Quezada, Luce Rains, Cheyenne Phillips","After a bloody bank robbery in New Mexico, Henry's gang heads to the borders for a safe split of the loot, while a competent bounty hunter, Josiah, is after them. Soon, the bandits will find the perfect hideout to spend the night, unfortunately, however, there lives the family of pastor George Tildon, a religious man who lives by the word of God. Inevitably, this is going to be one very long night, and as the tension keeps boiling over, no secret will remain hidden under the light of the morning sun.",['120'],United States,English,,5.4,3491962
Outlaw,2007,"Action, Crime, Drama, Thriller",Nick Love,Nick Love,"Sean Bean, Danny Dyer, Rupert Friend, Sean Harris, Lennie James, Bob Hoskins, Sally Bretton, Joe Jackson, Igor Breakenback, James Farbell",,['103'],United Kingdom,English,,5.7,758771
What Have I Done to Deserve This?,1984,"Comedy, Drama",Pedro Almodóvar,Pedro Almodóvar,"Carmen Maura, Luis Hostalot, Ryo Hiruma, Ángel de Andrés López, Gonzalo Suárez, Verónica Forqué, Juan Martínez, Chus Lampreave, Kiti Mánver, Sonia Hohmann","In Madrid, the housewife Gloria lives in a tiny apartment with her husband, the taxi driver and forger Antonio; her lunatic mother-in-law, who is addicted in bottled water and cupcakes; and two teenage sons, one of them a drug dealer and the other gay. Gloria works as cleaning lady to raise some money for her dysfunctional family and is addicted in pills; her best friend is her neighbor, the call-girl Cristal. Antonio has a secret passion on a decadent German singer for whom he had worked as driver in Germany. A writer tries to convince Antonio to forge letters from Hitler and travels to Germany to meet the singer to invite her to participate in the scheme. Meanwhile Gloria delivers her gay son to a pervert dentist. Her mother-in-law finds a lizard while walking with her grandson on the street and they call it Dinero (Money) and bring it home. When Gloria has an argument with Antonio, she hits him on the head with a piece of wood, killing him. Now the police detectives investigate the murder case.",['101'],Spain,"Spanish, German, English, French",,7.1,88461
Oz the Great and Powerful,2013,"Adventure, Family, Fantasy",Sam Raimi,Nothing from IMDB,"James Franco, Mila Kunis, Rachel Weisz, Michelle Williams, Zach Braff, Bill Cobbs, Joey King, Tony Cox, Stephen R. Hart, Abigail Spencer","Oscar Diggs (James Franco), a small-time circus magician with dubious ethics, is hurled away from dusty Kansas to the vibrant Land of Oz. At first he thinks he's hit the jackpot-fame and fortune are his for the taking. That all changes, however, when he meets three witches, Theodora (Mila Kunis), Evanora (Rachel Weisz), and Glinda (Michelle Williams), who are not convinced he is the great wizard everyone's been expecting. Reluctantly drawn into the epic problems facing the Land of Oz and its inhabitants, Oscar must find out who is good and who is evil before it is too late. Putting his magical arts to use through illusion, ingenuity-and even a bit of wizardry-Oscar transforms himself not only into the great and powerful Wizard of Oz but into a better man as well.",['130'],United States,English,,6.3,1623205
Parker,2013,"Action, Crime, Thriller",Taylor Hackford,Nothing from IMDB,"Jason Statham, Jennifer Lopez, Michael Chiklis, Wendell Pierce, Clifton Collins Jr., Bobby Cannavale, Patti LuPone, Carlos Carrasco, Micah Hauptman, Emma Booth","Parker is a thief who has an unusual code. He doesn't steal from the poor and hurt innocent people. He is asked to join four other guys on a job. They pull it off flawlessly. They tell Parker that what they got can help them set up another job which will net them much more. But Parker doesn't want to join them and asks for his share. But they need it all so they try to kill him. They dispose of his body but someone finds him--he is still alive--and takes him to the hospital. After recovering he sets out to get back at the ones who tried to kill him, another one of his codes. Despite being told that they are working for a known mobster which he was not aware of, he still wants to go after them. He learns where they are and poses as a wealthy Texan looking to buy a house. So he hires a real estate agent, Leslie Rogers to show him around. He is actually trying to find out where they're holed up. And when he finds it, he sets out on his plan to get them. But when they learn he is alive, they contact the mobster to take care of him. So the mobster sends a killer to take care of him. And Leslie also finds herself intrigued with him so she follows him.",['118'],United States,English,,6.2,1904996
Passengers,2016,"Drama, Romance, Sci-Fi, Thriller",Morten Tyldum,Jon Spaihts,"Jennifer Lawrence, Chris Pratt, Michael Sheen, Laurence Fishburne, Andy Garcia, Vince Foster, Kara Flowers, Conor Brophy, Julee Cerda, Aurora Perrineau","The spaceship, Starship Avalon, in its 120-year voyage to a distant colony planet known as the ""Homestead Colony"" and transporting 5,258 people has a malfunction in one of its sleep chambers. As a result one hibernation pod opens prematurely and the one person that awakes, Jim Preston (Chris Pratt) is stranded on the spaceship, still 90 years from his destination.",['116'],"United States, Australia","English, Spanish, Japanese, French",,7.0,1355644
Pele: Birth of a Legend,2016,"Biography, Drama, Sport","Jeff Zimbalist, Michael Zimbalist","Jeff Zimbalist, Michael Zimbalist","Kevin de Paula, Leonardo Lima Carvalho, Seu Jorge, Mariana Nunes, Milton Gonçalves, Seth Michaels, Vincent D'Onofrio, André Mattos, Phil Miler, Rafael Henriques",,['107'],United States,"English, Portuguese, Swedish",,7.1,995868
Pete's Dragon,2016,"Action, Adventure, Comedy, Drama, Family, Fantasy",David Lowery,Nothing from IMDB,"Bryce Dallas Howard, Robert Redford, Oakes Fegley, Oona Laurence, Wes Bentley, Karl Urban, Isiah Whitlock Jr., Marcus Henderson, Aaron Jackson, Phil Grieve","A young boy, Pete, is found in a forest where he's been living for six year after an accident took his parents' lives. A ranger, Grace, takes him in and asks him how he survived all by himself. He says he had a friend named Elliott and draws a picture of a dragon, saying it's Elliott. Grace takes the picture to her father who claims that years ago he encountered a dragon in the forest. Grace takes Pete back to the forest and he shows her his home and Elliott. A man sees Elliott, and when he tells about his experience and isn't believed, he sets out to capture the dragon to prove it.",['102'],"United States, United Kingdom, New Zealand, India",English,,6.7,2788732
Pitch Perfect,2012,"Comedy, Music, Romance",Jason Moore,Nothing from IMDB,"Anna Kendrick, Skylar Astin, Ben Platt, Brittany Snow, Anna Camp, Rebel Wilson, Alexis Knapp, Ester Dean, Hana Mae Lee, Kelley Jakle","The Barden Bellas are a collegiate, all-girls a cappella singing group thriving on female pop songs and their perfect looks. After a disastrous failing at last year's finals, they are forced to regroup. Among the new recruits is freshman Beca, an independent, aspiring DJ with no interest in the college life. But after she meets Jesse, from the rival all-male a cappella group, Beca has a new outlook and takes it upon herself to help the Bellas find their new look and sound and get back into the competition.",['112'],United States,"English, Ukrainian",,7.1,1981677
Point Break,1991,"Action, Crime, Thriller",Kathryn Bigelow,Nothing from IMDB,"Patrick Swayze, Keanu Reeves, Gary Busey, Lori Petty, John C. McGinley, James Le Gros, John Philbin, Bojesse Christopher, Julian Reyes, Daniel Beer","In Los Angeles, California, a gang of bank robbers call themselves The Ex-Presidents. commit their crimes while wearing masks of ex-Presidents Reagan, Carter, Nixon, and Johnson. The F.B.I. believes that the members of the gang could be surfers, and send young Agent Johnny Utah undercover at the beach to mix with the surfers and gather information. Utah meets surfer Bodhi, and gets drawn into the lifestyle of his new friend.",['122'],"Japan, United States",English,,7.3,102685
Power Rangers,2017,"Action, Adventure, Fantasy, Sci-Fi",Dean Israelite,Nothing from IMDB,"Dacre Montgomery, Naomi Scott, RJ Cyler, Ludi Lin, Becky G, Elizabeth Banks, Bryan Cranston, Bill Hader, Matt Shively, Cody Kearsley","High school outcasts stumble upon an old alien ship, where they acquire superpowers and are dubbed the Power Rangers. Learning that an old enemy of the previous generation has returned to exact vengeance, the group must harness their powers and use them to work together and save the world.",['124'],"United States, Hong Kong, Japan, Canada, New Zealand","English, Mandarin",,5.9,3717490
Primal,2010,"Adventure, Horror, Sci-Fi, Thriller",Josh Reed,Nothing from IMDB,"Zoë Gameau, Krew Boylan, Lindsay Farris, Rebekah Foord, Damien Freeleagus, Wil Traval, Mark Saunders, Walangari Karntawarra Jakamarra, Stephen Shanahan, Ch'aska Cuba de Reed",Anja and five friends join anthropology student Dace on a journey to study a remote ancient rock painting. Their excitement vanishes when Mel becomes delirious after skinny-dipping in the waterhole. Feverish bleeding and confused she physically and mentally regresses to a vicious predatory state. Mel has gone primal. Mel's lover and friends realize they are the prey as she savagely hunts them down. Before they can escape one of them starts to regress posing a hideous choice: kill their friends or be killed by them. Their only hope of survival is through a cave where Anja learns too late the meaning of the ancient rock art they came to study.,['80'],Australia,English,,4.8,1438534
Quantum of Solace,2008,"Action, Adventure, Mystery, Thriller",Marc Forster,"Paul Haggis, Neal Purvis, Robert Wade","Daniel Craig, Olga Kurylenko, Mathieu Amalric, Judi Dench, Giancarlo Giannini, Gemma Arterton, Jeffrey Wright, David Harbour, Jesper Christensen, Anatole Taubman","Is there solace in revenge? James Bond and M sniff a shadowy international network of power and corruption reaping billions. As Bond pursues the agents of an assassination attempt on M, all roads lead to Dominic Greene, a world-renowned developer of green technology. Greene, a nasty piece of work, is intent on securing a barren area of Bolivia in exchange for helping a strongman stage a coup there. The C.I.A. looks the other way, and only Bond, with help from a retired spy and a mysterious beauty, stands in Greene's way. M wonders if she can trust Bond, or if vengeance possesses him. Can anyone drawn to Bond live to tell the tale?",['106'],"United Kingdom, United States","English, Spanish, Italian, French, Swiss German, German",,6.6,830515
Quarantine,2008,"Horror, Sci-Fi, Thriller",John Erick Dowdle,Nothing from IMDB,"Jennifer Carpenter, Steve Harris, Jay Hernandez, Johnathon Schaech, Columbus Short, Andrew Fiscella, Rade Serbedzija, Greg Germann, Bernard White, Dania Ramirez","A television reporter and her cameraman are assigned to spend the night shift with a Los Angeles fire crew. After a routine 911 call takes them to a small apartment building, they find police officers already on the scene in response to blood curdling screams coming from one of the apartments. They soon learn that a woman living in the building has been infected by something unknown. After a few of the residents are viciously attacked, they try to leave with the news crew, only to find the building has quarantined. All communication in and it is stopped; the only evidence of what took place is the news crew's videotape.",['89'],"United States, Spain",English,,5.9,1082868
D R I P.,2019,Short,Reese Hester,Reese Hester,Reese Hester,,['6'],United States,English,,,10594864
Raising Helen,2004,"Comedy, Drama, Romance",Garry Marshall,Nothing from IMDB,"Kate Hudson, John Corbett, Joan Cusack, Hayden Panettiere, Spencer Breslin, Abigail Breslin, Helen Mirren, Sakina Jaffrey, Kevin Kilner, Felicity Huffman","Helen Harris (Kate Hudson) is living the life she's always dreamed of: her career at a top modelling agency is on the rise; she spends her days at fashion shows and her nights at the city's hottest clubs. But her carefree lifestyle comes to a screeching halt when one phone call changes everything. Helen soon finds herself responsible for her sister's children: fifteen-year-old Audrey (Hayden Panettiere), ten-year-old Henry (Spencer Breslin), and five-year-old Sarah (Abigail Breslin). No one doubts that Helen is the coolest aunt in New York City, but what does this glamor girl know about raising kids? The fun begins as Helen goes through the transformation from super-hip to super-mom, but she quickly finds that dancing at 3a.m. doesn't mix with getting kids to school on time, advice that Helen's older sister, Jenny Portman (Joan Cusack), is only too quick to dish out. Along the way, Helen finds support in the most unusual place, with Dan Parker (John Corbett), the handsome young pastor and principal of the kids' new school, and realizes the choice she has to make is between the life she's always loved and the new loves of her life.",['119'],United States,English,,6.0,350028
Rambo,2008,"Action, Adventure, Thriller",Sylvester Stallone,Nothing from IMDB,"Sylvester Stallone, Julie Benz, Matthew Marsden, Graham McTavish, Reynaldo Gallegos, Jake La Botz, Tim Kang, Maung Maung Khin, Paul Schulze, Cameron Pearson","Vietnam veteran John Rambo has survived many harrowing ordeals in his lifetime and has since withdrawn into a simple and secluded existence in Thailand, where he spends his time capturing snakes for local entertainers, and chauffeuring locals in his old PT boat. Even though he is looking to avoid trouble, trouble has a way of finding him: a group of Christian human rights missionaries, led by Michael Burnett and Sarah Miller, approach Rambo with the desire to rent his boat to travel up the river to Burma. For over fifty years, Burma has been a war zone. The Karen people of the region, who consist of peasants and farmers, have endured brutally oppressive rule from the murderous Burmese military and have been struggling for survival every single day. After some inner contemplation, Rambo accepts the offer and takes Michael, Sarah, and the rest of the missionaries up the river. When the missionaries finally arrive at the Karen village, they find themselves part of a raid by the sadistic Major Pa Tee Tint and a slew of Burmese army men. A portion of the villagers and missionaries are tortured and viciously murdered, while Tint and his men hold the remainder captive. Concerned by their disappearance, the minister in charge of the mission gathers a group of mercenaries and pleas Rambo transport them with his boat, since he knows their last exact location. But Rambo can't stay behind: he joins the team where he belongs, to liberate the survivors from the clutches of Major Tint in what may be one of his deadliest missions ever",['92'],"United States, Germany","English, Burmese, Thai",,7.0,462499
Rampage,2018,"Action, Adventure, Sci-Fi",Brad Peyton,Nothing from IMDB,"Dwayne Johnson, Naomie Harris, Malin Akerman, Jeffrey Dean Morgan, Jake Lacy, Joe Manganiello, Marley Shelton, P.J. Byrne, Demetrius Grosse, Jack Quaid","Athena-1, a space station owned by gene manipulation company Energyne, is destroyed after a laboratory rat mutates and wreaks havoc. Dr. Kerry Atkins, the lone surviving crew member, is ordered by CEO Claire Wyden to retrieve research canisters containing a pathogen. Atkins is able to flee in the escape pod when the station implodes, but due to damage from the rat it disintegrates upon re-entry, killing her. The falling pieces leave a trail of debris across the United States, including the Everglades in Florida, where a canister is consumed by an American crocodile, and a forest in Wyoming, where a gray wolf is exposed to the pathogen. Primatologist Davis Okoye, a former US Army Special Forces soldier and member of an anti-poaching unit, works at the San Diego Wildlife Sanctuary. He has befriended a rare albino western lowland gorilla named George, having saved him from poachers, and communicates with George using sign language and hand gestures. At night, one of the canisters crash-lands in George's habitat, and George is exposed to the pathogen..",['107'],United States,"English, American Sign Language",,6.1,2231461
Reasonable Doubt,2014,"Crime, Drama, Mystery, Thriller",Peter Howitt,Peter A. Dowling,"Dominic Cooper, Samuel L. Jackson, Gloria Reuben, Ryan Robbins, Erin Karpluk, Dylan Taylor, Karl Thordarson, Dean Harder, Carson Nattrass, John B. Lowe","Up-and-coming District Attorney, Mitch Brockton is involved in a fatal hit-and-run, but Clinton Davis, is found with the body and charged with murder. Believing that Davis is innocent, Brockton is compelled to throw the trial. Soon after, Brocton's perfect life begins to unravel as he realizes that the man he set free is hiding a secret that will destroy him.",['91'],"Canada, Germany, United States",English,,5.7,2304953
REC 2 (2009) Kill Count,2020,"Comedy, Horror",Nothing from IMDB,James A. Janisse,James A. Janisse,,['29'],Nothing from IMDB,Nothing from IMDB,,8.3,12848468
Red Sparrow,2018,"Action, Drama, Thriller",Francis Lawrence,Nothing from IMDB,"Jennifer Lawrence, Joel Edgerton, Matthias Schoenaerts, Charlotte Rampling, Mary-Louise Parker, Ciarán Hinds, Joely Richardson, Bill Camp, Jeremy Irons, Thekla Reuten","A young Russian intelligence officer is assigned to seduce a first-tour CIA agent who handles the CIA's most sensitive penetration of Russian intelligence. The two young officers collide in a charged atmosphere of trade-craft, deception, and inevitably forbidden passion that threatens not just their lives but the lives of others as well.",['140'],United States,"English, Russian, Hungarian",,6.6,2873282
Red Tails,2012,"Action, Drama, History, War",Anthony Hemingway,Nothing from IMDB,"Terrence Howard, Cuba Gooding Jr., Nate Parker, David Oyelowo, Tristan Mack Wilds, Ne-Yo, Elijah Kelley, Marcus T. Paulk, Leslie Odom Jr., Michael B. Jordan","The 332nd Fighter Group, an all-black World War II unit made up of the best escort pilots and known as the Red Tails, fights racism at home while fighting the Germans abroad in this action-packed drama based on the true story of the Tuskegee Airmen. The movie also looks a little bit at the men as individuals. We get to know some of their strengths, weaknesses, and dreams. One doesn't follow directions, and is highly aggressive fighter. One is captured by the Germans. One drinks whiskey. A couple die due to combat wounds. One is badly wounded and sent home. The pilots finally get a more responsible assignment, do well, and then are given more responsible assignments. The end of the picture shows the unit getting recognition for a job well done.",['125'],United States,"English, Italian, German",,5.9,485985
Redirected,2014,"Action, Comedy, Crime, Thriller",Emilis Velyvis,Nothing from IMDB,"Vinnie Jones, Scot Williams, Gil Darnell, Oliver Jackson, Antony Strachan, Andrius Ziurauskas, Vytautas Sapranauskas, Artur Smolyaninov, Vita Siauciunaite, Monika Vaiciulyte","Four friends - John, Ben, Tim and Michael - turned first-time robbers, get stranded in Eastern Europe through a series of misadventures and have to find their way back home. To do so, they'll have to overcome hit men, whores, corrupt cops, smugglers and more, all while rediscovering each other as friends",['99'],"United Kingdom, Lithuania","English, Russian, Lithuanian, Polish",,6.4,2275946
Reign of Fire,2002,"Action, Adventure, Fantasy, Thriller",Rob Bowman,Nothing from IMDB,"Christian Bale, Matthew McConaughey, Izabella Scorupco, Gerard Butler, Scott Moutter, David Kennedy, Alexander Siddig, Ned Dennehy, Rory Keenan, Terence Maynard","In present-day London, 12-year-old Quinn Abercromby witnesses the awakening of a hibernating dragon from a centuries-long slumber, the result of a construction dig supervised by his mother and an incident for which Quinn feels partially responsible. 20 years later, the adult Quinn (Christian Bale) is the fire chief of a refortified castle community, responsible for dousing the blazes lit by the dragon's prodigious number of flame-spewing offspring, airborne juggernauts that have wreaked havoc across the globe, torching civilization and turning humans into an endangered species. Hope arrives in the form of Denton ""Dragon Slayer"" Van Zan (Matthew McConaughey), an American known to be the only man to ever kill one of the dragons, and Alex (Izabella Scorupco), a scientist/pilot who's a member of Van Zan's army, a zealous fighting force that includes a secret weapon: the Archangels, paratroopers using themselves as bait to attract and then dispatch the deadly beasts.",['101'],United States,English,,6.2,253556
