Title,Year,Genres,Directors,Writers,Cast,Plot,Runtime,Country,Language,Awards,Rating,MovieCode
Tum Se Achcha Kaun Hai,2002,"Drama, Musical, Romance",Deepak Anand,Nothing from IMDB,"Nakul Kapoor, Aarti Chhabria, Kim Sharma, Dalip Tahil, Raghubir Yadav, Navni Parihar, Viju Khote, Rati Agnihotri, Ali Asgar, Adi Irani","Working as a Guide and bus driver in Jaisalmer, Arjun had always dreamed of being a famous singer. When he meets beautiful tourist, Naina Dixit, he impresser her with his singing, she encourages him to come to Bombay and try his luck there, and leaves her address with him. Shortly thereafter, Arjun bids farewell to his brother, his Bhabi, and nephew and sets forth to Bombay. Upon arrival he does meet with Naina's friend, Monto, who takes him to several places to try his luck, but no one even bothers to even listen to him, leave alone hear him sing. He lives with Naina, her sisters, Anu and Tuktuk, and their college professor mom, who empathize with him. Then Naina hits upon an idea to have a open song and dance show in a public park. The show does take place, and a wealthy young woman, Bobby Gujral, does notice Arjun and invites him to sing for a firm run by her dad's partner, Sunil Mahadevan. When Sunil refuses to get involved, Bobby talks to her dad and opens her very own recording company featuring Arjun as the main artist. Soon Arjun becomes famous overnight, but has not forgotten Naina and her family. This does not auger well with Bobby, who is very possessive and wants Arjun all to himself - and she makes up her mind that she will never permit anyone to come close to Arjun - for she has a gun, and knows how to use it.",['150'],India,Hindi,,4.8,318956
Udaan,2010,Drama,Vikramaditya Motwane,Nothing from IMDB,"Rajat Barmecha, Ronit Roy, Manjot Singh, Ram Kapoor, Raja Hudda, Varun Khettry, Shashi Sharma, Khushkeran Singh Sandhu, Jayanta Das, Akantuk Sharma","After being abandoned for eight straight years in boarding school, Rohan returns to the small industrial town of Jamshedpur and finds himself closeted with an authoritarian father and a younger half brother who he didn't even know existed. Forced to work in his father's steel factory and study engineering against his wishes, he strives to forge his own life out of his given circumstances and pursue his dream of being a writer.",['134'],India,Hindi,,8.1,1639426
Udta Punjab,2016,"Action, Crime, Drama",Abhishek Chaubey,Nothing from IMDB,"Shahid Kapoor, Alia Bhatt, Kareena Kapoor, Diljit Dosanjh, Satish Kaushik, Manav Vij, Vansh Bhardwaj, Suhail Nayyar, Prabhjyot Singh, Rajesh Kumar Sharma","What on earth can a rock star, a migrant laborer, a doctor and a cop possibly have in common? Simple, Punjab! 4 lives, 1 connection - 'Udta Punjab' takes you on a trip like never before. Shahid Kapoor, Kareena Kapoor, Alia Bhatt and Diljit Dosanjh play characters from different walks of life, fighting the menace of drugs in their own way. The film journeys into the artificial highs and the real lows that they face while treading the paths fraught with mortal dangers. But above all, Udta Punjab is about the famed Punjabi spirit, that despite being fully down, has the audacity of looking you in the eye and saying - Drugs di maa di!",['148'],India,Hindi,,7.7,4434004
Umrao Jaan,1981,"Drama, Musical, Romance",Muzaffar Ali,Nothing from IMDB,"Rekha, Farooq Shaikh, Naseeruddin Shah, Raj Babbar, Shaukat Azmi, Ishtiaque Khan Ghilzai, Prema Narayan, Akbar Rashid, Gajanan Jagirdar, Dina Pathak","In Faizabad, British India, Dilawar is sentenced to several years in prison after Amiran's Daroga dad testifies against him. After his discharge around 1840, he extracts his vengeance by abducting Amiran and selling to a brothel madam. It is here Amiran will be re-named Umrao Jaan. Years later, Umrao has grown up and is an accomplished poetess as well as dancer extraordinary. She has many patrons, chief amongst them are Nawab Sultan and his father. The young Nawab is smitten by Umrao's beauty and her poems, but is finally forced to marry a girl of his mother's choice, leaving behind a heart-broken and devastated Umrao, who seeks solace in the arms of Faiz Ali and finally elopes with him, only to find out that he is a wanted bandit, and is shot down and killed by guards. Umrao re-locates to Kanpur where she establishes herself as a Poet and dancer, but is hunted down by brothel-keepers, Gohar Mirza and Husseini and brought back, where she is told that she must marry Gohar. Watch what Umrao does to escape from being married against her will, and her attempts to try and find her way back to her parents.",['145'],India,Urdu,,7.7,83248
Ungli,2014,"Crime, Drama, Thriller",Renzil D'Silva,Nothing from IMDB,"Sanjay Dutt, Emraan Hashmi, Kangana Ranaut, Randeep Hooda, Neha Dhupia, Angad Bedi, Kader Khan, Arunoday Singh, Reema Lagoo, Raza Murad","Four friends: Kalim (Angad Bedi), Gautam (Neil Bhoopalam), Maya (Kangana Ranaut), and Abhay (Randeep Hooda), form a gang called the ""Ungli"" gang which fights against corruption prevailing in society. Their job is to target corrupt people and punish them in a unique manner. Due to increased popularity and their high-profile targets they are sought by Mumbai police department. Their case is the responsibility of ACP Ashok Kale (Sanjay Dutt) and inspector Nikhil Abhyankar (Emraan Hashmi). Nikhil disguises himself as a college student and joins the ungli gang with hidden motive of arresting them. But soon, his heart changes after learning the story of why the ""Ungli"" gang was formed. Meanwhile, Kale is compelled to seek help from the gang when Nikhil helps him expose the gang's greatest target, B.R. Dayal (Mahesh Manjrekar) and his son Anshuman. Kale instigates a sting operation against the Mumbai police and is successful in preventing his transfer. Kale thanks the ""Ungli"" gang and he assures them that the city won't need an ""Ungli"" gang as long as the administrations are running properly in accordance to public demands.",['114'],India,Hindi,,5.8,2392447
Uri: The Surgical Strike,2019,"Action, Drama, History, War",Aditya Dhar,Aditya Dhar,"Vicky Kaushal, Paresh Rawal, Mohit Raina, Yami Gautam, Kirti Kulhari, Rajit Kapoor, Ivan Rodrigues, Manasi Parekh, Swaroop Sampat, Riva Arora","Divided over five chapters, the film chronicles the events of the surgical strike conducted by the Indian military against suspected militants in Pakistan occupied Kashmir. It tells the story of the 11 tumultuous events over which the operation was carried out. Indian army special forces carry out a covert operation to avenge the killing of fellow army men at their base by a terrorist group.",['138'],India,Hindi,,8.2,8291224
V,2020,"Action, Crime, Thriller",Mohana Krishna Indraganti,Nothing from IMDB,"Nani, Sudheer Babu Posani, Nivetha Thomas, Aditi Rao Hydari, Tanikella Bharani, Chakrapani Ananda, Aadarsh Balakrishna, Ramana Bhargava, Krishna Manjusha C, Raja Chembolu","DCP Aditya, a celebrated cop, faces his most unsettling case yet involving a mysterious serial killer who has been brutally killing his targets and leaving behind notes challenging Aditya to nab him. Teaming with Apoorva, an aspiring crime novelist, and the police force, Aditya finds himself walking on thin ice upon discovering the killer has another challenge for him: to prevent four more murders from happening or give up his medals and resign. What he is yet to find out is the killer's past and his desperation to carry out the killing spree without fail.",['140'],India,Telugu,,6.8,11385128
Vaada,2005,"Action, Crime, Drama, Mystery, Romance, Thriller",Satish Kaushik,Rumi Jaffery,"Arjun Rampal, Zayed Khan, Ameesha Patel, Alok Nath, Rakesh Bedi, Veerendra Saxena, Rajesh Vivek, Sarfaraz Khan, Shashi Kiran, Achyut Potdar","Rahul and Puja are married and totally devoted to each other. One day they meet with a terrible accident and Rahul loses his eyesight. On a business trip abroad Rahul meets a friend Karan. Impressed by his dynamism and business acumen, Rahul asks him to join his business. They return to India and Puja is stunned to see her husband with her friend Karan. Rahul's love for Puja is blind and unquestioning. Karan's love for Puja is obsessive and uncontrollable. Puja is trapped between a blind husband and a sighted lover.",['122'],India,Hindi,,6.0,442855
Vaastav: The Reality,1999,"Action, Crime, Drama, Thriller",Mahesh Manjrekar,Nothing from IMDB,"Sanjay Dutt, Namrata Shirodkar, Reema Lagoo, Shivaji Satam, Sanjay Narvekar, Deepak Tijori, Mohnish Behl, Paresh Rawal, Ekta Sohini, Mohan Joshi","SPOILER: Raghunath Namdev Shivalkar (Sanjay Dutt) and his best friend Dedh Footiya (Sanjay Narvekar) struggle to find work in Mumbai. They decide to run a pav bhaji stall.But fate steps in when Raghu accidentally kills a customer who turns out to be the brother of a notorious gangster, Fracture Pandya and end up in the Mumbai underworld. Vitthal Kaanya (Ashish Vidyarthi), a rival gang lord, offers Raghunath and Dedh Footiya protection and later hires them both as hitmen. Raghunath becomes a respected hit man, with Dedh Footiya as his accomplice. With Raghunath in his gang Vitthal Kaanya hits a peak in the Mumbai underworld. He is protected by a politician who uses Raghunath for his needs. While BabbanRao (Home Minister) relies on Raghunath, there are some others who despise Raghunath, and are just waiting in the sidelines to see when Raghunath makes an error. Raghunath does so, and hence becomes an embarrassment for BabbanRao. Soon Raghunath is on the run, both from the police, and BabbanRao's men. Raghunath knows now that he must protect his wife, parents, and family, as they too are in danger. Then Raghunath comes to know that the police have been ordered to kill him in an ""encounter"", and Raghunath now realizes that there is no escape from this harsh reality. Unable to save himself from police, Raghu comes back to his home and asks his mother to shot him down for a graceful end of life. His mother does the same and his wife doesn't stop her from doing this.",['145'],India,Hindi,,8.0,220832
Valimai,2022,"Action, Crime, Thriller",H. Vinoth,H. Vinoth,"Ajith Kumar, Huma Qureshi, Kartikeya Gummakonda, Gurbani, Sumithra, Yogi Babu, Selvaah, G.M. Sundar, Achyuth Kumar, Raj Ayyappa",,['178'],India,Tamil,,6.1,10806040
Vedalam,2015,"Action, Drama",Siva,Nothing from IMDB,"Ajith Kumar, Shruti Haasan, Lakshmi Menon, Soori, Thambi Ramaiah, Ashwin Kakumanu, Kabir Duhan Singh, Rahul Dev, Aniket Chouhan, Vidyullekha Raman","Ganesh, a taxi driver and his sister try to settle down in Kolkata where she has enrolled for a course to hone her artistic skills. Unknown to his sister, Ganesh's hidden past and that of his sister comes to light when he goes up against an international human trafficking syndicate. The syndicate discovers that its not just a mere co incidence.",['148'],India,Tamil,,6.3,5178278
Veer,2010,"Action, Adventure, Drama, Romance, War",Anil Sharma,Nothing from IMDB,"Salman Khan, Jackie Shroff, Mithun Chakraborty, Neena Gupta, Raj Premi, Sohail Khan, Ashok Samarth, Rajesh Vivek, Alyona Khmara, Mo Idriss","In early twentieth-century British India, the Pindari leader Prithvi Singh narrates his story to a reporter from the London Times - a story of betrayal and deceit at the hands of the British and Madhavgarh's Raja Gyanendra Singh, which led to the massacre of 4500 Pindaris.",['169'],India,"Hindi, Urdu",,4.6,1185412
Vicky Donor,2012,"Comedy, Romance",Shoojit Sircar,Nothing from IMDB,"Ayushmann Khurrana, Yami Gautam, Annu Kapoor, Dolly Ahluwalia, John Abraham, Backagaindancer, Tarun Bali, Siddharth Bhardwaj, Krishna Singh Bisht, Jayanta Das","Dr. Baldev Chaddha (Anu Kapoor), a well qualified fertility expert, runs a fertility clinic and a sperm bank in Dariyaganj, New Delhi, that guarantees a high quality and specialized sperm for the purpose. Unfortunately he has more failed cases to his credit than successes. A healthy, high performing donor is the need of the hour. Vicky Arora (Ayushmann Khurrana), a young, good-looking, Punjabi boy from Lajpat Nagar, is the only son and of no financial support to Dolly, a widow, who runs a small beauty parlor from home. As luck would have it, a small brawl in the colony brings Dr Chaddha and Vicky, face to face, where Chaddha, concludes that Vicky could be THAT donor he has been looking for. From here on, Chaddha's days and nights are spent in convincing Vicky to become a donor till he finally gives in. Vicky finds his love interest in Ashima Roy (Yami Gautam), a pretty Bengali girl, who works in a Bank. But soon there hunky dory world comes crashing down because of Vicky's past as a donor. With a brief emotional roller coaster ride, Vicky Donor is a light-hearted take on the subject of sperm donation.",['126'],India,Hindi,,7.8,2317337
Vidhaata,1982,"Action, Drama",Subhash Ghai,Nothing from IMDB,"Tom Alter, Harbans Darshan M. Arora, Birbal, Krishan Dhawan, Sanjay Dutt, Jagdeep, Shammi Kapoor, Viju Khote, Padmini Kolhapure, Dilip Kumar","When a Police inspector is killed by a band of thugs, his grieving father Samsher Singh seeks justice. Pratap Singh has left behind a pregnant widow, who dies in chidbirth, leaving Samsher to bring up the child Kunal. The transformation of Samsher Singh (a locomotive engine driver) into Sobhraj, multi millionaire and owner of a vast network of business. Kunal is brought up by Abu Baba, a servant of Sobhraj to be honest, upright, and very independent minded. Durga, the daughter of a former employee of Sobhraj, who is serving time and Kunal fall in love. This not acceptable to his grandfather, though Abu Baba approves of the relationship. Disaster strikes when an attempt is made to separate the lovers. The life of Samsher Singh alias Sobhraj begins to unravel from here. How Kunal's ethical upbringing by his foster-father, and his financial and business circumstances of his grandfather meet in a titanic conscience clash and how he resolves matters is at the nexus of the plot. Business rivalry, revenge and friendship form part of the story.",['168'],India,Hindi,,6.9,84866
Virasat,1997,"Action, Drama, Musical, Romance",Priyadarshan,Nothing from IMDB,"Anil Kapoor, Tabu, Pooja Batra, Milind Gunaji, Govind Namdeo, Amrish Puri, Satyendra Kapoor, Dilip Dhawan, Tiku Talsania, Neeraj Vora","After completing his studies in London, England, Shakti Thakur returns home to India in a small town where his family resides. Accompanying him is his leggy girlfriend, Anita, who he is in love with and wants to marry, much to the disapproval of his family. After a few days, Shakti starts to feel that nothing much has changed in this part of India and longs to return, as he is unable to bear the animosity between the townspeople, in general, and in particular between his Zamindar dad, Raja Thakur, and rival Zamindar Birju, none other than Raja's crippled brother. When Anita leaves the town to meet her parents elsewhere in India, Shakti too wants to follow her, but his plans change suddenly when his father passes away, and the region is ravaged by unprecedented natural calamities. Following the funeral he decides to stay on to look after the family estate and business temporarily, and that is when he meets local town belle, Gehna, who has given her heart to him years ago, hopes to marry him, with approval from his very own family. Anita returns to find that nothing is the same anymore, and that her role may be reduced to that of a mistress, she must now make a choice to either return back home, or fight and win back Shakti's love.",['165'],India,Hindi,,7.4,120456
Virgin Bhanupriya,2020,"Comedy, Drama",Ajay Lohan,Ajay Lohan,"Urvashi Rautela, Gautam Gulati, Rajiv Gupta, Archana Puran Singh, Niki Walia, Brijendra Kala, Rumana Molla, Natasha Suri, Sumit Gulati, Chaitannya Kanhai",,['111'],India,Hindi,,2.5,11964084
Vishwanath,1978,"Action, Mystery, Thriller",Subhash Ghai,Nothing from IMDB,"Shatrughan Sinha, Reena Roy, Pran Sikand, Premnath Malhotra, Sulochana Latkar, Rita Bhaduri, Parikshit Sahni, Madan Puri, Sudhir, Ranjeet Bedi","An honest lawyer, Vishwanath is implicated and imprisoned at the behest of powerful underworld don, GNK and his associates. After his release from prison, Vishwanath decides to seek vengeance, but finds out that it is virtually impossible to do this through due process of law. So he decides to change his identity, hire a gang of crooks and assassins, to carry out his vendetta. Not realizing that in doing this he is alienating himself from the love of his life, Soni; and making himself a wanted man by the police, leaving his crippled sister, Munni and mom, Shanti to fend for themselves, and at the mercy of GNK and his associates.",['128'],India,Hindi,,6.2,215338
Vivah,2006,"Drama, Musical, Romance",Sooraj R. Barjatya,Nothing from IMDB,"Shahid Kapoor, Amrita Rao, Anupam Kher, Alok Nath, Seema Biswas, Samir Soni, Lata Sabharwal, Manoj Joshi, Amrita Prakash, Dinesh Lamba","After the passing away of his wife, wealthy Delhi-based businessman, Harishchandra, took it upon himself to bring up two sons, Sunil and Prem. When they grew up he got Sunil married to Bhavna, and let Prem complete his education, even let him study abroad. Soon Sunil and Bhavna gave birth to a son, Rahul. When Bhagat told him that he had found a suitable match for Prem in Poonam, the niece of Krishnakant, a fruit merchant from Madhupur, Uttar Pradesh, the family traveled there, met with Krishnakant, his wife, Rama, and daughter, Rajni, and instantly approved of Poonam. Prem and Poonam also approved of each other, the Astrologer was consulted and a marriage was scheduled to take place in six months time. Shortly thereafter the engagement took place. The two families met again in Som Sarovar, Nainital, to let everyone get acquainted, and when Prem got his first contract from Japan, Krishnakant took his family to Delhi to celebrate. With the deadline for the marriage drawing close, both families start their respective preparations - not knowing that fate may have other plans in store for this young couple.",['160'],India,Hindi,,6.6,494290
Waiting on Roxie,2016,"Short, Fantasy",Chad Peter,Chad Peter,"Lucy Hale, Elizabeth Sandy, Tyler Lough, John T. O'Brien",,['4'],United States,English,,7.4,5755092
Wajah Tum Ho,2016,"Drama, Mystery, Romance, Thriller",Vishal Pandya,Nothing from IMDB,"Sharman Joshi, Sana Khan, Gurmeet Choudhary, Rajneesh Duggal, Himanshu Malhotra, Prarthana Behere, Sherlyn Chopra, Zareen Khan, Yash Ahlawat, Resham Arora","A TV channel owned by Rahul Oberoi is hacked and the murder of police officer Ramesh Sarnaik is broadcast live. Rahul is interrogated by inspector Kabir Deshmukh of Mumbai police and defended by his lawyer Sia whose boyfriend Ranveer is the prosecution lawyer. During the investigation, police find Karan Parekh, Rahul's old business partner, to be the suspect but before they could get hold of him Karan's murder is also telecast live on the same channel. Kabir now has to find a link which joins Rahul, Karan and Sarnaik which is leading to the murders.",['136'],India,Hindi,,4.4,5638474
Wajood,1998,"Action, Crime, Drama, Thriller",N. Chandra,Nothing from IMDB,"Nana Patekar, Madhuri Dixit, Mukul Dev, Ramya Krishnan, Johny Lever, Hemu Adhikari, Maya Alagh, Paresh Bramhbhatt, N. Chandra, Chandrakant Gokhale","This story revolves around Malhar Gopaldas Agnihotri, a out-of-work actor, poor, and dependent on his father, who is heading for retirement. Malhar knows that he can act, very well indeed, all he needs is some encouragement, and some money. He gets neither. His father is abusive, and even gets physical with him openly in front of all the neighbours, and even the neighborhood. Malhar loves a young lady named Apoorva Choudhury, but his affections are mis-applied, as Apoorva only regards him as a friend, and she loves Nihal Joshi, a Police Inspector. Frustrated at the lack of love and encouragement, Malhar takes recourse in an exercise, an exersise that will put him in direct confrontation with the law, as it starts with murder.",['180'],India,Hindi,,7.0,287111
Wanted,2009,"Action, Crime, Thriller",Prabhu Deva,Nothing from IMDB,"Salman Khan, Ayesha Takia, Prakash Raj, Vinod Khanna, Govind Namdeo, Mahesh Manjrekar, Inder Kumar, Mahek Chahal, Manoj Pahwa, Asseem Merchant","Mumbai-based middle-classed Jhanvi, who lives with her widowed mother and younger brother, has three suitors. The first is much older and considerably overweight - Sonu Gates. The second is Police Inspector Talpade, who is already married to Nandini, but lusts after Jhanvi so much so that he creates circumstances that will force her to marry him. The third is a male named Radhey - who often comes to her rescue - but breaks her heart when she finds out who is really is - a cold-blooded killer who works for a gangster named Ghanibhai. The later is a ruthless gangster who challenges Police Commissioner Ashraf Taufeeq Khan with impunity, and even abducts his daughter to ensure his personal safety.",['147'],India,Hindi,,6.6,1084972
Waqt,1965,"Drama, Romance",Yash Chopra,Nothing from IMDB,"Sunil Dutt, Sadhana Shivdasani, Raaj Kumar, Shashi Kapoor, Sharmila Tagore, Balraj Sahni, Rehman Khan, Motilal, Manmohan Krishna, Jeevan Dhar","Lala Kedarnath is in the process of celebrating the grand opening of his business with his wife Laxmi and three sons when an earthquake devastates the region, separating his family from him. Decades later, this family assembles in a courtroom where Kedarnath is a witness for the prosecution; one son, Ravi, is the defense lawyer; another, Vijay Kumar, is another witness for the prosecution, who has been bribed to lie and implicate the accused; and the eldest, the accused, Raja, is the one charged with murder, a charge that might result in the death sentence.",['178'],India,Hindi,,7.6,59893
Waqt Hamara Hai,1993,"Action, Comedy, Romance, Thriller",Bharat Rangachary,Rumi Jaffery,"Akshay Kumar, Suniel Shetty, Ayesha Jhulka, Mamta Kulkarni, Rami Reddy, Aruna Irani, Anupam Kher, Tiku Talsania, Mahesh Anand, Viju Khote","Two friends Vikas Kumar Sabkuchwala and Sunil Choudhary decides to arrange the fake kidnapping of the two girls Ayesha and Mamta; they are in love with; so as to convince the girls father that they can make good son-in-law as well as meet with his demands at the same time. Only to learn that there plans goes hay-wild when the girls are kidnapped by international terrorist, Colonel Chikara - which changes their lives forever.",['148'],India,Hindi,,5.9,290331
Waqt Ki Awaz,1988,"Action, Crime, Drama, Romance",K. Bapaiah,Nothing from IMDB,"Vikas Anand, Govardhan Asrani, Ranjeet Bedi, Mithun Chakraborty, Moushumi Chatterjee, Jack Gaud, Gulshan Grover, Aruna Irani, Puneet Issar, Shakti Kapoor","Wealthy Lata I. Prasad refuses to obey her widower father's instructions to get married to equally wealthy Rajan, the second son of Sikanker Lal Thakkar, her dad's business partner. She runs away from home, and shortly thereafter her father locates her living with a truck-driver, Vishwa Pratap, and his pretty sister, Lakshmi. She refuses to return home, and insists on marrying Vishwa. She will soon regret her decision when she finds out that Vishwa has been arrested for killing a male named Billa, and may either spend his life behind bars or be hanged.",['156'],India,Hindi,,5.3,96415
War,2019,"Action, Adventure, Thriller",Siddharth Anand,Nothing from IMDB,"Hrithik Roshan, Tiger Shroff, Vaani Kapoor, Ashutosh Rana, Anupriya Goenka, Yash Raaj Singh, Mashhoor Amrohi, Sanjeev Vatsa, Dipannita Sharma, Soni Razdan","An elite shadow unit of R&AW led by agent Kabir (Hrithik Roshan) focusses on maximum risk missions. Khalid (Tiger Shroff), a soldier with a murky past, struggles to get into Kabir's team and finally manages to convince him of his dedication and loyalty. Now, when Kabir mysteriously goes rogue, Khalid is assigned the task of hunting down his mentor. Can he track him? A deadly war begins.",['151'],India,"Hindi, Tamil, Telugu",,6.5,7430722
War,2019,"Action, Adventure, Thriller",Siddharth Anand,Nothing from IMDB,"Hrithik Roshan, Tiger Shroff, Vaani Kapoor, Ashutosh Rana, Anupriya Goenka, Yash Raaj Singh, Mashhoor Amrohi, Sanjeev Vatsa, Dipannita Sharma, Soni Razdan","An elite shadow unit of R&AW led by agent Kabir (Hrithik Roshan) focusses on maximum risk missions. Khalid (Tiger Shroff), a soldier with a murky past, struggles to get into Kabir's team and finally manages to convince him of his dedication and loyalty. Now, when Kabir mysteriously goes rogue, Khalid is assigned the task of hunting down his mentor. Can he track him? A deadly war begins.",['151'],India,"Hindi, Tamil, Telugu",,6.5,7430722
Warning,2013,"Adventure, Thriller","Gurmmeet Singh, Vishal Chaturvedi",Nothing from IMDB,"Santosh Barmola, Jitin Gulati, Sumit Suri, Suzana Rodrigues, Baby Alita, Manjari Fadnnis, Madhurima Tuli, Varun Sharma, Jeremy Rudd, Varun Sharma",,['109'],India,"Hindi, English",,4.7,3138602
Wazir,2016,"Action, Crime, Drama, Mystery, Thriller",Bejoy Nambiar,Nothing from IMDB,"Amitabh Bachchan, Farhan Akhtar, Aditi Rao Hydari, Manav Kaul, Neil Nitin Mukesh, John Abraham, Anjum Sharma, Prakash Belawadi, Murli Sharma, Nasir Khan","'Wazir' is a tale of two unlikely friends, a wheelchair-bound chess grandmaster and a brave ATS officer. Brought together by grief and a strange twist of fate, the two men decide to help each other win the biggest games of their lives. But there's a mysterious, dangerous opponent lurking in the shadows, who is all set to checkmate them.",['103'],India,Hindi,,7.1,315642
