Title,Year,Genres,Directors,Writers,Cast,Plot,Runtime,Country,Language,Awards,Rating,MovieCode
Date and Switch,2014,"Comedy, Drama, Romance",Chris Nelson,Alan Yang,"Quinn Lord, Nick Offerman, Gary Cole, Megan Mullally, Darien Provost, Jennifer Clement, Nicholas Braun, Hunter Cope, Dustin Ybarra, Sarah Hyland",High school seniors Michael and Matty make a pact to help each other lose their virginity before their high school prom. Their plan hits a snag when Matty tells his best friend that he's gay. Michael's supportive but awkward attempts to help Matty fit in put a strain on their decade-long friendship. Their friendship is further tested when Michael falls for Matty's former girlfriend and Matty falls for a guy whom Michael wouldn't approve of. Prom looms and Michael and Matty have to repair their friendship and then figure out their love lives.,['91'],United States,"English, Spanish",,5.7,1878942
Dawn of the Planet of the Apes,2014,"Action, Adventure, Drama, Sci-Fi, Thriller",Matt Reeves,Nothing from IMDB,"Andy Serkis, Jason Clarke, Gary Oldman, Keri Russell, Toby Kebbell, Kodi Smit-McPhee, Kirk Acevedo, Nick Thurston, Terry Notary, Karin Konoval","A growing nation of genetically evolved apes led by Caesar is threatened by a band of human survivors of the devastating virus unleashed a decade earlier. They reach a fragile peace, but it proves short-lived, as both sides are brought to the brink of a war that will determine who will emerge as Earth's dominant species.",['130'],"United States, United Kingdom, Canada","English, American Sign Language",,7.6,2103281
Days of Thunder,1990,"Action, Drama, Sport",Tony Scott,Nothing from IMDB,"Tom Cruise, Robert Duvall, Nicole Kidman, Randy Quaid, Cary Elwes, Michael Rooker, Fred Thompson, John C. Reilly, J.C. Quinn, Don Simpson","Cole Trickle enters the high-pressure world of Nascar racing. He's a hot driver with a hot temper, and this attitude gets him into trouble not only with other drivers, but members of his own team as well.",['107'],United States,"English, French",,6.1,99371
Dead Man Down,2013,"Action, Adventure, Crime, Drama, Mystery, Thriller",Niels Arden Oplev,J.H. Wyman,"Colin Farrell, Noomi Rapace, Terrence Howard, Dominic Cooper, Isabelle Huppert, Luis Da Silva Jr., Stu Bennett, Franky G, Declan Mulvey, John Cenatiempo","Victor, a rising gangland player, has infiltrated the crime empire run by ruthless kingpin Alphonse, with the single purpose of making Alphonse pay for destroying his once happy life. As he meticulously orchestrates his vengeance from his high-rise home, Victor watches and is watched by Beatrice, a mysterious young woman who lives in the apartment across from his. On the surface a fragile woman-child, Beatrice seethes with a rage of her own. When she uncovers Victor's dark secrets, she threatens to expose him unless he helps her carry out her own campaign of retribution. Each fixated on avenging the past, they devise a violent and cathartic plan that could change their worlds forever. Beatrice is kidnapped by Alphonse towards the end, Its a race against time for Victor to save her.",['118'],United States,"English, French, Albanian, Spanish, Hungarian",,6.4,2101341
Dead Man Running,2009,"Action, Crime, Drama, Thriller",Alex De Rakoff,Nothing from IMDB,"Clint Koroan, Fredi 'Kruga' Nwaka, 50 Cent, Ashley Walters, Tamer Hassan, Danny Dyer, Brenda Blethyn, Monet Mazur, Phil Davis, Jeremy Zimmermann","A loan shark gives ex-con Nick a period of 24 hours in order to pay back the money he owes. Up against it, Nick involves his best mate on a multi-part mission in order to raise the cash before it's too late for them both.",['92'],United Kingdom,English,,5.9,1311699
Dear John,2010,"Drama, Romance, War",Lasse Hallström,Nothing from IMDB,"Channing Tatum, Amanda Seyfried, Richard Jenkins, Henry Thomas, D.J. Cotrona, Cullen Moss, Gavin McCulley, Jose Lucena Jr., Keith D. Robinson, Scott Porter","South Carolina US Army Special operations soldier John is on summer leave from his German base, visiting his widowed father. Being gallant on the pier, he befriends college student Savannah, a college student, and her buddies, a terminal father and his angelic son. John falls in love with Savannah, who diagnoses his beloved, gentle but weird father as mildly autistic. He plans not to sign up again, but 9/11 changes that, and she won't wait idly while their friends desperately need help.",['108'],United States,English,,6.3,989757
Death at a Funeral,2010,"Comedy, Drama",Neil LaBute,Dean Craig,"Keith David, Loretta Devine, Peter Dinklage, Ron Glass, Danny Glover, Regina Hall, Kevin Hart, Martin Lawrence, James Marsden, Tracy Morgan","Aaron's father's funeral is today at the family home, and everything goes wrong: the funeral home delivers the wrong body; a cousin gives her fiancé a Valium from her brother's apartment, not knowing that her brother is dealing drugs--it's LSD and the fiancé arrives at the funeral wildly stoned; Aaron's younger brother Ryan, a successful writer, flies in from New York broke but arrogant; one uncle is angry over his daughter's choice of boyfriend and the other is cranky and coarse. Add an ovulating wife, a jealous ex-boyfriend, and a short stranger who wants a word with Aaron--what could he want? Would another death solve Aaron's problems? And what about the eulogy?",['92'],United States,English,,5.7,1321509
Death Note,2017,"Crime, Drama, Fantasy, Horror, Mystery, Thriller",Adam Wingard,Nothing from IMDB,"Nat Wolff, LaKeith Stanfield, Margaret Qualley, Shea Whigham, Willem Dafoe, Jason Liles, Paul Nakauchi, Jack Ettlinger, Matthew Kevin Anderson, Chris Britton","Light Turner, a bright student, stumbles across a mystical notebook that has the power to kill any person whose name he writes in it. Light decides to launch a secret crusade to rid the streets of criminals. Soon, the student-turned-vigilante finds himself pursued by a famous detective known only by the alias L.",['101'],United States,"English, Japanese, Spanish",,4.6,1241317
"Incomplete: A Story of Love, Desire and Deception",2012,"Drama, Romance","Charles Farmer, Abe Vilchez-Moran",Charles Farmer,"Jaye Taylor, Michael 'Mike Pain' Davidson, Sanura Harris, Donald Porter Jr., Ace Grimes, Bryant 'B.I.Z.' White, Tashana Trotter, Nichole N. Benn, Khadine Ellison, Julius C. Legara","INCOMPLETE is a captivating story of one woman's desire to make her family complete through love desire and deception. INCOMPLETE is a story of trust, of betrayal, and the fine line that divides the two when secrets are hidden between husband and wife, and perception is shared with a stranger.A high energy Romantic Drama with an Emotional Roller Coaster of Ride!",['88'],United States,English,,6.3,2461218
"Definitely, Maybe",2008,"Comedy, Drama, Romance",Adam Brooks,Adam Brooks,"Ryan Reynolds, An Nguyen, Matthew Mason, Rick Derby, Sakina Jaffrey, Bob Wiltfong, Ryder Chasin, Fiona Lane, Dana Eskelson, Blake Benitez","Romantic comedy: Will Hayes, a 30-something Manhattan dad is in the midst of a divorce when his 10 year old daughter, Maya, starts to question him about his life before marriage. Maya wants to know absolutely everything about how her parents met and fell in love. Will's story begins in 1992, as a young, starry-eyed aspiring politician who moves to New York from Wisconsin in order to work on the Clinton campaign. For Maya, Will relives his past as a idealistic young man learning the ins and outs of big city politics, and recounts the history of his romantic relationships with three very different women. On the campaign, Will's best buddy is Russell McCormack. They not only have similar political aspirations, they share the same type of girl problems, too. Will hopelessly attempts a ""PG"" version of his story for his daughter ad changes the names so Maya has to guess who he finally married. Is her mother Will's college sweetheart, the dependable girl next-door Emily? Is she his longtime best friend and confidante, the apolitical April? Or is she the free-spirited but ambitious journalist? As Maya puts together the pieces of her dad's romantic puzzle, she begins to understand that love is not so simple or easy. And as Will tells her his tale, Maya helps him to understand that it's definitely never too late to go back...and maybe even possible to find a happy ending.",['112'],"United Kingdom, France, Germany, United States",English,,7.1,832266
Deliver Us from Evil,2014,"Crime, Fantasy, Horror, Mystery, Thriller",Scott Derrickson,Nothing from IMDB,"Eric Bana, Edgar Ramírez, Olivia Munn, Chris Coy, Dorian Missick, Sean Harris, Joel McHale, Mike Houston, Lulu Wilson, Olivia Horton","New York police officer Ralph Sarchie (Eric Bana), struggling with his own personal issues, begins investigating a series of disturbing and inexplicable crimes. He joins forces with an unconventional priest (Edgar Ramirez), schooled in the rituals of exorcism, to combat the frightening and demonic possessions that are terrorizing their city. Based upon the book, which details Sarchie's bone-chilling real-life cases.",['118'],United States,"English, Spanish, Latin, Italian",,6.2,2377322
Demon Hunter,2016,"Action, Horror",Zoe Kavanagh,Nothing from IMDB,"Niamh Hogan, Alan Talbot, Sarah Tapes Jenkinson, Kevin O'Malley, Nic Furlong, Michael Parle, Aisli Moran, Saorla Wright, Lauren Emma Bartlett, Stephanie Alken","A young girl tormented by the tragedies of her past is brought in for questioning by the police over the death of a man, who she claims to be a demon. Detective Beckett realizes this is the same girl he made a broken promise to seven years ago that he'd find the monster that raped and murdered her 12 year old sister. The girl warns of a powerful man named Falstaff who will stop at nothing to claim her soul, Falstaff abducts Detective Beckett's daughter and now this young girl is his only hope and ally in rescuing his daughter from this demonic cult and proving to him that Taryn Barker is the Demon Hunter.",['85'],"United States, Ireland",English,,3.6,2375585
The Descent: Part 2,2009,"Adventure, Horror, Thriller",Jon Harris,Nothing from IMDB,"Michael J. Reynolds, Shauna Macdonald, Jessika Williams, Douglas Hodge, Josh Dallas, Anna Skellern, Gavan O'Herlihy, Krysten Cummings, Doug Ballard, Josh Cole","Distraught, confused, and half-wild with fear, Sarah Carter emerges alone from the Appalachian cave system where she encountered unspeakable terrors. Unable to plausibly explain to the authorities what happened - or why she's covered in her friends' blood - Sarah is forced back to the subterranean depths to help locate her five missing companions. As the rescue party drives deeper into uncharted caverns, nightmarish visions of the recent past begin to haunt Sarah and she starts to realize the full horror and futility of the mission. Subjected to the suspicion and mistrust of the group and confronted once more by the inbred, feral and savagely ruthless Crawlers, Sarah must draw on all her inner reserves of strength and courage in a desperate final struggle for deliverance and redemption.",['94'],"United Kingdom, France","French, English",,5.7,1073105
Devil,2010,"Horror, Mystery, Thriller",John Erick Dowdle,Nothing from IMDB,"Chris Messina, Logan Marshall-Green, Jenny O'Hara, Bojana Novakovic, Bokeem Woodbine, Geoffrey Arend, Jacob Vargas, Matt Craven, Joshua Peace, Caroline Dhavernas","In Philadelphia, Detective Bowden is still grieving for his wife and son, killed in a hit-and-run five years ago. When someone jumps from a skyscraper onto a truck, Bowden is sent to investigate. Meanwhile, five strangers are trapped in an elevator in the building where the jumper committed suicide. The communication radio in the elevator is broken but the guards, Lustig and Ramirez, observe the individuals via CCTV as events unfold. Tensions run high among those trapped, so Lustig calls the police and Detective Bowden assumes the case. Without being able to contact the individuals, he tries to work out who they are, but he can only account for four of them. Time is running out for the occupants of the elevator, as Bowden realizes he has to get them out quickly.",['80'],United States,"English, Spanish, Ukrainian",,6.3,1314655
The Dictator,2012,Comedy,Larry Charles,"Sacha Baron Cohen, Alec Berg, David Mandel, Jeff Schaffer","Sacha Baron Cohen, Sayed Badreya, Rocky Citron, Liam Campora, Aasif Mandvi, Rizwan Manji, Rick Chambers, Elsayed Mohamed, Adeel Akhtar, Horatio Sanz","The Republic of Wadiya is ruled by an eccentric and oppressive leader named Hafez Aladeen. Aladeen is summoned to New York to a UN assembly to address concerns about his country's nuclear weapons program, but the trip goes awry.",['83'],United States,"English, Hebrew, Arabic",,6.4,1645170
Dirty Dancing,1987,"Drama, Music, Romance",Emile Ardolino,Eleanor Bergstein,"Jennifer Grey, Patrick Swayze, Jerry Orbach, Cynthia Rhodes, Jack Weston, Jane Brucker, Kelly Bishop, Lonny Price, Max Cantor, Charles 'Honi' Coles","In 1963, Frances ""Baby"" Houseman, a sweet daddy's girl, goes with her family to a resort in upstate New York's Catskill Mountains. Baby has grown up in privileged surroundings and all expect her to go on to college, join the Peace Corps and save the world before marrying a doctor, just like her father. Unexpectedly, Baby becomes infatuated with the camp's dance instructor, Johnny Castle, a man whose background is vastly different from her own. Baby lies to her father to get money to pay for an illegal abortion for Johnny's dance partner. She then fills in as Johnny's dance partner and it is as he is teaching her the dance routine that they fall in love. It all comes apart when Johnny's friend falls seriously ill after her abortion and Baby gets her father, who saves the girl's life. He then learns what Baby has been up to, who with and worse, that he funded the illegal abortion. He bans his daughter from any further association with ""those people"". In the first deliberately willful action of her life, Baby later sneaks out to see Johnny, ostensibly to apologize for her father's rudeness, and ends up consummating her relationship with Johnny. A jealous fellow vacationer sees Baby sneaking out of Johnny's bungalow the next morning, and in an act of retribution, tells management that he is responsible for a theft the evening before, knowing he would not furnish his real whereabouts.",['100'],United States,English,,7.0,92890
Who Saw Him Die?,1968,Drama,Jan Troell,Nothing from IMDB,"Per Oscarsson, Ann-Marie Gyllenspetz, Kerstin Tidelius, Bengt Ekerot, Harriet Forssell, Per Sjöstrand, Georg Oddner, Catti Edfeldt, Bo Malmqvist",Sören Mårtensson is a middle school teacher. Schoolwork is a torment for him and at night he has nightmares. He is aware that every lesson is a power struggle where he is doomed to lose because he does not believe in authoritarian principles in teaching.,['110'],Sweden,"Swedish, English",,6.8,63384
Divergent,2014,"Action, Adventure, Mystery, Sci-Fi",Neil Burger,Nothing from IMDB,"Shailene Woodley, Theo James, Ashley Judd, Jai Courtney, Ray Stevenson, Zoë Kravitz, Miles Teller, Tony Goldwyn, Ansel Elgort, Maggie Q","Set in a futuristic dystopia where society is divided into five factions that each represent a different virtue, teenagers have to decide if they want to stay in their faction or switch to another - for the rest of their lives. Tris Prior makes a choice that surprises everyone. Then Tris and her fellow faction-members have to live through a highly competitive initiation process to live out the choice they have made. They must undergo extreme physical and intense psychological tests, that transform them all. But Tris has a secret that she is Divergent, which means she doesn't fit into any one group. If anyone knew, it would mean a certain death. As she discovers a growing conflict that threatens to unravel her seemingly peaceful society, this secret might help her save the people she loves... or it might destroy her.",['139'],United States,"English, Spanish",,6.6,1840309
Django Unchained,2012,"Drama, Western",Quentin Tarantino,Quentin Tarantino,"Jamie Foxx, Christoph Waltz, Leonardo DiCaprio, Kerry Washington, Samuel L. Jackson, Walton Goggins, Dennis Christopher, James Remar, David Steen, Dana Gourrier","In 1858, a bounty-hunter named King Schultz seeks out a slave named Django and buys him because he needs him to find some men he is looking for. After finding them, Django wants to find his wife, Broomhilda, who along with him were sold separately by his former owner for trying to escape. Schultz offers to help him if he chooses to stay with him and be his partner. Eventually they learn that she was sold to a plantation in Mississippi. Knowing they can't just go in and say they want her, they come up with a plan so that the owner will welcome them into his home and they can find a way.",['165'],United States,"English, German, French, Italian",,8.5,1853728
Django Unchained,2012,"Drama, Western",Quentin Tarantino,Quentin Tarantino,"Jamie Foxx, Christoph Waltz, Leonardo DiCaprio, Kerry Washington, Samuel L. Jackson, Walton Goggins, Dennis Christopher, James Remar, David Steen, Dana Gourrier","In 1858, a bounty-hunter named King Schultz seeks out a slave named Django and buys him because he needs him to find some men he is looking for. After finding them, Django wants to find his wife, Broomhilda, who along with him were sold separately by his former owner for trying to escape. Schultz offers to help him if he chooses to stay with him and be his partner. Eventually they learn that she was sold to a plantation in Mississippi. Knowing they can't just go in and say they want her, they come up with a plan so that the owner will welcome them into his home and they can find a way.",['165'],United States,"English, German, French, Italian",,8.5,1853728
Djinn,2013,"Horror, Thriller",Tobe Hooper,David Tully,"Razane Jammal, Khalid Laith, Aiysha Hart, Abdullah Al-Jenaibi, Carol Abboud, May Calamawy, Militzia Radmilovic, Kristina Coker, Ahd, Paul Luebke",,['82'],United Arab Emirates,"Arabic, English",,4.4,1770672
Doctor Strange,2016,"Action, Adventure, Fantasy, Sci-Fi",Scott Derrickson,Nothing from IMDB,"Benedict Cumberbatch, Chiwetel Ejiofor, Rachel McAdams, Benedict Wong, Mads Mikkelsen, Tilda Swinton, Michael Stuhlbarg, Benjamin Bratt, Scott Adkins, Zara Phythian","Marvel's ""Doctor Strange"" follows the story of the talented neurosurgeon Doctor Stephen Strange who, after a tragic car accident, must put ego aside and learn the secrets of a hidden world of mysticism and alternate dimensions. Based in New York City's Greenwich Village, Doctor Strange must act as an intermediary between the real world and what lies beyond, utilising a vast array of metaphysical abilities and artifacts to protect the Marvel Cinematic Universe.",['115'],United States,English,,7.5,1211837
Dogma,1999,"Adventure, Comedy, Drama, Fantasy",Kevin Smith,Kevin Smith,"Bud Cort, Barret Hackney, Jared Pfennigwerth, Kitao Sakurai, George Carlin, Brian O'Halloran, Betty Aberlin, Matt Damon, Ben Affleck, Dan Etheridge",Two fallen angels who were ejected from paradise find themselves banned in Wisconsin. They are now headed for New Jersey where they find a loophole that can get them back into heaven. The only catch is that it will destroy humanity. A group bands together to stop them.,['130'],United States,"English, Spanish",,7.3,120655
Dolphin Tale 2,2014,"Drama, Family",Charles Martin Smith,Nothing from IMDB,"Harry Connick Jr., Ashley Judd, Nathan Gamble, Kris Kristofferson, Cozi Zuehlsdorff, Morgan Freeman, Austin Stowell, Betzaida Landín, Juliana Harkavy, Austin Highsmith Garces","It has been several years since young Sawyer Nelson and the dedicated team at the Clearwater Marine Hospital, headed by Dr. Clay Haskett, rescued Winter. With the help of Dr. Cameron McCarthy, who developed a unique prosthetic tail for the injured dolphin, they were able to save her life. Yet their fight is not over. Winter's surrogate mother, the very elderly dolphin Panama, has passed away, leaving Winter without the only poolmate she has ever known. However, the loss of Panama may have even greater repercussions for Winter, who, according to USDA regulations, cannot be housed alone, as dolphins' social behavior requires them to be paired with other dolphins. Time is running out to find a companion for her before the team at Clearwater loses their beloved Winter to another aquarium.",['107'],United States,English,,6.4,2978462
Don't Breathe,2016,"Crime, Horror, Thriller",Fede Alvarez,"Fede Alvarez, Rodo Sayagues","Stephen Lang, Jane Levy, Dylan Minnette, Daniel Zovatto, Emma Bercovici, Franciska Töröcsik, Christian Zagia, Katia Bokor, Sergej Onopko, Olivia Gillies","Rocky, a young woman wanting to start a better life for her and her sister, agrees to take part in the robbery of a house owned by a wealthy blind man with her boyfriend Money and their friend Alex. But when the blind man turns out to be a more ruthless adversary than he seems, the group must find a way to escape his home before they become his latest victims.",['88'],"United States, Hungary",English,,7.1,4160708
Comic Con 2012 Live,2012,Talk-Show,Nothing from IMDB,Nothing from IMDB,"John Barrowman, Candace Bailey, Kumail Nanjiani, Matt Mira, Jessica Chobot, Sara Jean Underwood, Don Cheadle, Blair Butler, Joe Quesada, Kevin Bacon",,,United States,English,,6.9,2270788
Doomsday,2008,"Action, Sci-Fi, Thriller",Neil Marshall,Neil Marshall,"Caryn Peterson, Adeola Ariyo, Emma Cleasby, Christine Tomlinson, Vernon Willemse, Paul Hyett, Daniel Read, Karl Thaning, Stephen Hughes, Jason Cope","A lethal virus spreads throughout Scotland, infecting millions and killing hundreds of thousands. To contain the threat, acting authorities brutally quarantine the country as it succumbs to fear and chaos. The quarantine is successful. Three decades later, the Reaper virus violently resurfaces in London. An elite group of specialists, including Eden Sinclair, is urgently dispatched into Scotland to retrieve a cure by any means necessary. Shut off from the rest of the world, the unit must battle through a landscape that has become a waking nightmare.",['113'],"United Kingdom, United States, South Africa, Germany",English,,5.9,483607
In the Shadow of the Moon,2019,"Action, Crime, Mystery, Sci-Fi, Thriller",Jim Mickle,"Gregory Weidman, Geoffrey Tock","Boyd Holbrook, Cleopatra Coleman, Bokeem Woodbine, Michael C. Hall, Rudi Dharmalingam, Al Maini, Quincy Kirkwood, Sarah Dugdale, Rachel Keller, Ryan Allen","In 1988, Philadelphia police officer Thomas Lockhart (Boyd Holbrook), hungry to become a detective, begins tracking a serial killer who mysteriously resurfaces every nine years. But when the killer's crimes begin to defy all scientific explanation, Locke's obsession with finding the truth threatens to destroy his career, his family, and possibly his sanity.",['115'],"United States, Canada",English,,6.2,8110640
Incendies,2010,"Drama, Mystery, War",Denis Villeneuve,Nothing from IMDB,"Mustafa Kamel, Hussein Sami, Rémy Girard, Mélissa Désormeaux-Poulin, Maxim Gaudette, Dominique Briand, Lubna Azabal, Frédéric Paquet, Hamed Najem, Ahmad Massad","A mother's last wishes send twins Jeanne and Simon on a journey to the Middle East in search of their tangled roots. Adapted from Wajdi Mouawad's acclaimed play, Incendies tells the powerful and moving tale of two young adults' voyage to the core of deep-rooted hatred, never-ending wars and enduring love.",['131'],"Canada, France","French, Arabic, English",,8.3,1255953
Inception,2010,"Action, Adventure, Sci-Fi, Thriller",Christopher Nolan,Christopher Nolan,"Leonardo DiCaprio, Joseph Gordon-Levitt, Elliot Page, Tom Hardy, Ken Watanabe, Dileep Rao, Cillian Murphy, Tom Berenger, Marion Cotillard, Pete Postlethwaite","Dom Cobb is a skilled thief, the absolute best in the dangerous art of extraction, stealing valuable secrets from deep within the subconscious during the dream state, when the mind is at its most vulnerable. Cobb's rare ability has made him a coveted player in this treacherous new world of corporate espionage, but it has also made him an international fugitive and cost him everything he has ever loved. Now Cobb is being offered a chance at redemption. One last job could give him his life back but only if he can accomplish the impossible, inception. Instead of the perfect heist, Cobb and his team of specialists have to pull off the reverse: their task is not to steal an idea, but to plant one. If they succeed, it could be the perfect crime. But no amount of careful planning or expertise can prepare the team for the dangerous enemy that seems to predict their every move. An enemy that only Cobb could have seen coming.",['148'],"United States, United Kingdom","English, Japanese, French",,8.8,1375666
Inconceivable,2017,"Drama, Thriller",Jonathan Baker,Chloe King,"Gina Gershon, Nicky Whelan, Nicolas Cage, Sienna Soho Baker, Harlow Bottarini, Natalie Eva Marie, Faye Dunaway, Jonathan Baker, James Van Patten, Ele Bardha","A mysterious young woman, Katie (Nicky Whelan), and her daughter move to a new town to escape her past and quickly befriends Angela Morgan (Gina Gershon), a mother of one who longs for a bigger family. As their lives become intricately entwined, Angela and her husband, Brian, (Nicolas Cage), invite Katie to live in their guest-house to serve as their nanny. Over time, the blossoming friendship between the two women spirals into a dangerous obsession as Katie becomes overly attached to the Morgans' daughter. Enduring lies and manipulations, Angela and Brian realize that sweet Katie is actually trying to destroy their family from within.",['105'],"United Kingdom, United States",English,,5.2,3481634
