Title,Year,Genres,Directors,Writers,Cast,Plot,Runtime,Country,Language,Awards,Rating,MovieCode
Dhoom 3,2013,"Action, Crime, Drama, Thriller",Vijay Krishna Acharya,Nothing from IMDB,"Aamir Khan, Abhishek Bachchan, Katrina Kaif, Uday Chopra, Jackie Shroff, Tabrett Bethell, Andrew Bicknell, Siddharth Nigam, Charles Rasmussen, Gavin Marshall","The favourite Indian action franchise is back. This time Jai Dixit (Abhishek Bachchan) and Ali (Uday Chopra) return to match their wits with the enigmatic clown thief, Sahir (Aamir Khan), who has the city of Chicago in his thrall. In this battle of revenge and dignity, the lines blur and the conventional definition of good and bad don't apply. Watch a spectacle that will thrill you and move you.",['172'],"India, United States","Hindi, English",,5.4,1833673
Dhruva,2016,"Action, Crime, Thriller",Surender Reddy,Nothing from IMDB,"Ram Charan, Arvind Swami, Rakul Preet Singh, Navdeep, Krishna Murali Posani, Sayaji Shinde, Abhinaya, Nassar, Farah Karimaee, Ali Reza","Dhruva is an upcoming Action Thriller film directed by Surender Reddy and produced by Allu Aravind under his banner Geetha Arts. It features Ram Charan, Rakul Preet Singh and Aravind Swamy. It is an official remake of the Tamil film Thani Oruvan (2015). The film will feature music by Hiphop Tamizha, who composed for the Tamil original. and cinematography is handled by P. S. Vinod. The film was launched on 18 February 2016 and principal photography commenced on 22 February 2016. The film, initially set for release on 7 October, is scheduled for a worldwide release on 2 December 2016.",['165'],India,Telugu,,7.7,6027478
Dhuruvangal Pathinaaru,2016,"Crime, Drama, Mystery, Thriller",Karthick Naren,Karthick Naren,"Rahman, Prakash Raghavan, Sharathkumar, Santhosh Krishna, Praveen, Bala Hasan, Vinod Varma, Ashwin Kumar, Kunal Kaushik, Anjana Jayaprakash","Deepak is an retired police officer. He meets an young man who is interested in joining IPS. The young guy asks about the case of a mystry killer in which deepak lost his leg and his career. Thus he explains about the unsolved mystry case. But in the end the case is solved by the young man, and deepak meets his ultimate end.",['105'],India,Tamil,,8.2,6380520
Dil Diya Dard Liya,1966,"Drama, Musical, Romance","Abdul Rashid Kardar, Dilip Kumar",Nothing from IMDB,"Dilip Kumar, Waheeda Rehman, Pran Sikand, Rehman Khan, Shyama, Sajjan, Rani, Johnny Walker, S. Nazir, D.K. Sapru","A kind-hearted, widowed landlord, Thakur, lives a wealthy lifestyle with his son, Ramesh; daughter, Roopa; and an adopted child, Shankar. Ramesh hates Shankar and often abuses him. Years pass by, Thakur has passed away, and all three children have grown up. While Ramesh visits a stunningly attractive Courtesan, Tara, drinks alcohol, and continues to abuse and mercilessly beat Shankar, who bears this in silence as he and Roopa are in love with each other. When Ramesh finds out that Roopa wants to wed Shankar, he has him severely beaten and thrown off a cliff. He then arranges Roopa's marriage with another wealthy man, Satish, while he continues to romance Tara and even signs over his entire estate and home to her name. Then a few years later, Shankar returns - this time as the wealthy Raja of Belapur - and he all set to compromise with Ramesh and propose to Roopa. He finds out that nothing has changed, Ramesh, though rendered penniless by Tara, still hates him; and Satish is wooing Roopa, is engaged to her and a marriage date has been fixed. Shankar's love is now replaced by vengeance and hate, and all he can think of is destroying the lives of Ramesh, Roopa, Satish and his sister, Mala, and he has several plans which he intends to put to use one by one.",['169'],India,Hindi,,6.2,60310
Dil Hai Tumhara,2002,"Drama, Romance",Kundan Shah,Nothing from IMDB,"Rekha, Preity G Zinta, Arjun Rampal, Mahima Chaudhry, Jimmy Shergill, Alok Nath, Dilip Joshi, Vivek Shauq, Anjan Srivastav, Govind Namdeo",Some twenty years ago Sarita promised to raise her husband's love child (Shalu) together with their own daughter (Nimmi). The girls grow up as the best of friends but Sarita has never been able to forgive Shalu her background. It doesn't make it better when she sees Shalu getting close to the man Nimmi is also in love with.,['210'],India,Hindi,,5.5,328998
Dil Juunglee,2018,"Comedy, Romance",Aleya Sen,Nothing from IMDB,"Taapsee Pannu, Saqib Saleem, Nidhi Singh, Srishti Shrivastava, Ayesha Kaduskar, Abhilash Thapliyal, Santosh Barmola, Krishan Tandon, Tina Harris, Deepak Arora",,['124'],India,Hindi,,3.7,6071752
Kalavani,2010,Comedy,A. Sarkunam,A. Sarkunam,"Vimal, Oviya, Thirumurugan, Ilavarasu, Saranya Ponvannan, 'Ganja' Karuppu, Soori, Sujatha Sivakumar, Thavasi","Vimalraj (the grubby Meenakshi Sundaram from Pasanga) is the ill-behaved son of the gullible Saranya and her husband Ilavarasu. Vimalraj's financial needs are met by his susceptible mother, whom he either hoodwinks or intimidates to fulfill his frequent needs to gamble or hang out with his friends. He pushes the boat out and spends his time whiling away, aided by his friends. In the course of the time, he also spots a girl and falls in love with her - much to the despair of her brother who nurses a rivalry against him. What happens next forms the climax.",['144'],India,Tamil,,7.1,1815775
Dil Maange More!!!,2004,"Musical, Romance",Anant Mahadevan,Nothing from IMDB,"Shahid Kapoor, Ayesha Takia, Tulip Joshi, Soha Ali Khan, Gulshan Grover, Zarina Wahab, Kanwaljeet Singh, A.K. Hangal, Hiten Paintal, Smita Jaykar","Nikhil is a simple young man . He loves his hometown Samarpur , football matches , and the college his grandfather passed down to him as a legacy . Therefore when his girlfriend Neha tells him that if the wants to marry her he should leave Samarpur , Nikhil is dumbfounded . Neha secures admission in one of the prestigious air hostess training institutes in Mumbai . Nikhil travels all the way from Samarpur to Mumbai to bring Neha back , but Neha refuses to go back as she wants to build her career . Nikhil stays in Mumbai , hoping that one day Neha will understand his love for her and return with him . During his stay , two more girls come in his life - Sara , who works in the same music store with him ; and Shagun , Nikhil's hot-tempered neighbour . Will Nikhil be able to find his true love among these three girls?",['123'],India,Hindi,,5.2,328729
Dil Ne Phir Yaad Kiya,2001,"Drama, Musical, Romance, Thriller",Rajat Rawail,Rajat Rawail,"Govinda, Tabu, Faraaz Khan, Pooja Batra, Vinay Anand, Sadashiv Amrapurkar, Kiran Kumar, Dinesh Hingoo, Ali Khan, Guddi Maruti","Rahul Khanna (Vinay Anand) and Sonia Chopra (Pooja Batra) are in love, they seek the blessings of their elders, Mahendra Pratap Khanna (Kiran Kumar), Mr. Chopra (Sadashiv Amrapurkar) and Mrs. Chopra (Kunika), and get married. During their honeymoon, Sonia, who is very ambitious, tells Rahul that he should start his own business, away from his father, and stand on his own feet. Rahul does so, and starts a modelling agency. His immediate rival is Sanjeev Verma (Faraaz Khan), who is very successful. In order to compete with him, Rahul must sign up leading model, Roshni Batra. In order to do so, he meets with Roshni. Roshni, who has lost her lover, Prem (Govinda), accepts Rahul as Prem who has been returned to her, and agrees to work with his agency. Then Roshni starts behaving like Rahul is really Prem, and she will not let anyone come between her and her lost love.",,India,Hindi,,3.4,273535
Dil Vil Pyaar Vyaar,2014,Family,Manjeet Maan,Dheeraj Rattan,"Raj Singh Jhinjar, Neeru Bajwa, Omkar Bhakri, Juhi Chawla, Jassie Gill, Gurdas Maan, Khushdeed Maan, Rammnik, Shruti Sodhi, Rajiv Thakur",,['145'],India,Punjabi,,6.7,3723864
Gafla,2006,Drama,Sameer Hanchate,Nothing from IMDB,"Somesh Agarwal, Anshul Chobey, Nishikant Dixit, Vikram Gokhale, Brijendra Kala, Aditya Lakhia, Shruti Panwar, Purva Parag, Vinod Sharawat, Shakti Singh","'Gafla' begins as a story about an ordinary young man, Subodh, in ordinary circumstances. Subodh starts out as like any middle-class guy, with limited opportunities to survive and get ahead. 'gafla' follows Subodh's journey into the stock markets and beyond through the eyes of different people in his personal and professional life.",['127'],India,Hindi,,7.4,0896934
Happy Phirr Bhag Jayegi,2018,Comedy,Mudassar Aziz,Mudassar Aziz,"Sonakshi Sinha, Diana Penty, Jimmy Shergill, Ali Fazal, Piyush Mishra, Jassie Gill, Denzil Smith, Jason Tham, Bijou Thaangjam, Jeeveshu Ahluwalia","When Professor Harpreet Kaur lands in Shanghai, the last thing she would have on her mind is getting kidnapped. A crazy comedy of errors unrolls as the 'Happy' gang - Bagga, Guddu, Happy and Usmaan Miyaan - navigate through China while Harpreet, aka Happy is caught in the crosshairs.",['136'],India,Hindi,,4.5,7881542
Haré Rama Haré Krishna,1971,"Drama, Musical",Dev Anand,Dev Anand,"Zeenat Aman, Dev Anand, Mumtaz Askari, Baby Guddi, Satyajeet Puri, Prem Chopra, Rajendranath Malhotra, Mehmood Jr., Sudhir, Kishore Sahu","In the background of the rise of the International Hare Krishna movement in the 1970s, is a Montreal-based family of the Jaiswals, consisting of mom, dad, son, Prashant, and daughter, Jasbir. Due to irreconciable differences between Mr and Mrs Jaiswal, they separate, leaving Jasbir with dad, and Prashant with his mom. Eventually Prashant and his mom travel to India, leaving father and daughter behind in Montreal. Mr. Jaiswal re-marries, and brings his new wife to live in his home. Years later, Prashant has grown up to be a pilot. He has received a letter from his dad that Jasbir, who had rebelled and left home, is now located in Kathmandu, Nepal, with a group of hippies. Prashant undertakes to find his sister and hopefully get her back to the family. When Prashant lands in Kathmandu he does not find Jasbir, but instead finds Janice, who is indeed his sister with a new name. Janice has no recollection of her childhood, and is always in the company of fellow-hippies. Prashant now needs to bring Jasbir back, but for that he will have to travel deep into the drug induced dark world of Janice.",['149'],India,Hindi,,7.1,67183
Haseen Dillruba,2021,"Crime, Drama, Mystery, Romance, Thriller",Vinil Mathew,Nothing from IMDB,"Taapsee Pannu, Vikrant Massey, Harshvardhan Rane, Aditya Srivastav, Yamini Das, Dayashankar Pandey, Ashish Verma, Anamika, Gulista, Atul Tiwari","Rishabh Saxena (Rishu) is killed in an explosion in his house the cops investigating find that it is indeed a murder and the prime suspect is his wife Rani Kashyap.Rishu was a simple looking guy having a stable job and eager to get married,he is introduced to Rani a high spirited girl who wants to live a rocking life.Rani and Rishu's relationship is like strangers while she also has a dominating mother in law, her life suddenly changes when Rishu's cousin Neil enters their house.Neil is the kind of guy Rani wanted to get married they both start an affair and Rani decides to leave Rishu but before anything could happen Neil ditches her.Rani and Rishu realize their relationship was like strangers and Rani feels that Rishu had to pay for her wrong doings and decides to be with him but his evil side comes up when he finds her and Neil's relationship.",['135'],India,Hindi,,6.9,11027830
Haseena,2018,Comedy,Vicky Ranawat,Rishi Aazad,"Garima Agarwal, Mohit Arora, Majinder Singh Kareer, Mousumi Mallick, Inayat Sharma, Arpit Soni, Ankur Verma",,['135'],India,Hindi,,4.2,7335176
Haseena,2017,"Biography, Crime, Drama, Thriller",Apoorva Lakhia,Nothing from IMDB,"Shraddha Kapoor, Ankur Bhatia, Siddhant Kapoor, Priyanka Setia, Rajesh Tailang, Rakesh Biduwa, Navdeep Tomar, Tauqeer Alam Khan, Vikram Chadha, Dadhey Pandey","In 2007 arrest warrant has been issued against Haseena Parkar following which she is missing. She surrenders herself to the court on the day of the hearing. Haseena is accused of extortion money from builder and looking after the illegal business of her brother settled in Dubai, several allegations are made against which Haseena denies being part of. As no witness turns up against Haseena she is granted bail by the judge.",['135'],India,Nothing from IMDB,,6.2,6512784
Hate Story,2012,"Drama, Thriller",Vivek Agnihotri,Nothing from IMDB,"Nikhil Dwivedi, Gulshan Devaiah, Paoli Dam, Mohan Kapur, Joy Sengupta, Saurabh Dubey, Iravati Harshe, Bhairavi Goswami, Mukesh Tyagi, Firdaus Mevawala",,['140'],India,Hindi,,5.3,2309987
Hate Story 2,2014,"Drama, Thriller",Vishal Pandya,Nothing from IMDB,"Jay Bhanushali, Surveen Chawla, Sushant Singh, Siddharth Kher, Neha Kaul, Shashank Shende, Pavitra Sarkar, Bikramjeet Kanwarpal, Yashahlawat, Vijay Singh",,['130'],India,Hindi,,4.4,3619772
Hate Story 3,2015,"Drama, Thriller",Vishal Pandya,Nothing from IMDB,"Sharman Joshi, Karan Singh Grover, Zareen Khan, Daisy Shah, Priyanshu Chatterjee, Prithvi Zutshi, Sanjay Gandhi, Puja Gupta, Yash Ahlawat, Dhiren Ahuja","The couple, Aditya and Siya Singh who control the family business after the sad demise of Aditya's elder brother Vikram. Suddenly, an unknown businessman named Saurav Singhania enters their lives. Saurav, who shows interest in Aditya's company, makes them an unbelievable offer; a deal of spending a night with Siya in return of giving Aditya's company a very big profit. Aditya angrily rejects the offer. What follows is Aditya and Siya's struggle to to Saurav's real intentions. The erotic revenge thriller takes the audience through relationships, love, hatred and vengeance.this movie is very Romance",['126'],India,Hindi,,4.6,4865436
Hate Story IV,2018,"Crime, Drama, Thriller",Vishal Pandya,Nothing from IMDB,"Jack Armstrong, Ayvianna Snow, Urvashi Rautela, Manoj Anand, Vivan Bhatena, Tia Bajpai, Ihana Dhillon, Karan Wahi, Gulshan Grover, Lee Nicholas Harris",London based Aryan and Rajveer are son of business tycoon Vikram Khurana.Aryan is handling the family business and is looking out for a new female face for his campaign.He is in love with Rishma whose also looking after his business.Rajveer is a womanizer and professional photographer who approaches Taasha to be the model of their campaign.Taasha soon becomes a star and both brothers fall in love with her.Which leads Aryan to murder Rishma after she finds about his relationship with Taasha.After Aaryan and Taasha dispose Rishma's body it is reveled that Taasha is not who she claims and has come to revenge against Khurana's.,['131'],India,Hindi,,3.4,5325684
Haunt,2019,"Horror, Thriller","Scott Beck, Bryan Woods","Scott Beck, Bryan Woods","Katie Stevens, Will Brittain, Lauryn Alisa McClain, Andrew Lewis Caldwell, Shazi Raja, Schuyler Helford, Phillip Johnson Richardson, Chaney Morrow, Justin Marxen, Terri Partyka",,['92'],United States,English,,6.3,6535880
Haunted - 3D,2011,"Action, Fantasy, Horror",Vikram Bhatt,Nothing from IMDB,"Mimoh Chakraborty, Tia Bajpai, Achint Kaur, Mohan Kapur, Sanjay Sharma, Prachee Shah, Arif Zakaria, Firdaus Mevawala, Sanjeev Sharma, Pradeep Sharma","Delhi-based Rehan is instructed by his Realtor father to travel to Koti, near Shimla, and make preparations to sell Billimoria-owned 'Glen Manor' to the Mittal family for Rs.200 Crores. Upon arrival, he disregards warnings from local residents that the mansion is haunted by 'Shaitan'. Shortly thereafter he hears screams and inexplicable movement within the mansion. He then finds out that there are two entities that have persisted in this mansion for 80 years. Rehan will soon find himself transported back to August 17, 1936, where he hopes to change the past.",['143'],India,"Hindi, English",,6.3,1887763
Hawa,2003,"Drama, Horror, Thriller",Guddu Dhanoa,Nothing from IMDB,"Tabu, Shahbaaz Khan, Mukesh Tiwari, Imran Khan, Grusha Kapoor, Vishwajeet Pradhan, Amit Behl, Avtar Gill, Hansika Motwani, Baby Bhavika","Sanjana lives in a big city along with her husband and two daughters. But things are not quite rosy as the couple faces a disastrous situation in there life which leads to divorce. Sanjana along with her brother, Vicky, her two daughters and a dog relocates to a lonely house in a forest. While residing there Sanjana begins to see some odd situations taking place especially when her house is struck by lightening, her dog attacked her and she and her daughters is mysteriously raped. This is too much to take for Sanjana and she decides to contact a sage who is specialized in black magic he worked a spell and Sanjana was able to gather information that several hundred years ago elders in a tribe thought the best punishment of wrong-doers was death - by pushing them down a deep ravine to fall and die and that the sum-total of the wretched souls have combined into one giant unseen and unfelt entity and this leads to a tense finale to Hawa.",['129'],India,Hindi,,3.3,369516
Hazaaron Khwaishein Aisi,2003,Drama,Sudhir Mishra,"Sudhir Mishra, Shivkumar Subramaniam, Ruchi Narain","Kay Kay Menon, Shiney Ahuja, Chitrangda Singh, Ram Kapoor, Saurabh Shukla, Yashpal Sharma, Jasbir Malik, Sohrab Ardeshir, Aditya Bhattacharya, Arif Zakaria","Geeta Rao has two admirers - one is Siddharth Tyabji and the other is Vikram Malhotra circa 1969 West Bengal that is witnessing it's struggle against the ruling Congress party, joining forces with left-wing Marxist and Communist parties. While Siddharth is directly involved in this struggle, Geeta and Vikram are romantically involved. When Vikram does not make any move toward marriage, despite of being introduced to Geeta's Madras-based family, she decides to give up on him, and he starts his romance with another young woman. While students continue to voice their disapproval of Prime Minister Indira Gandhi, the Allahabad High Court gives a judgment indicting her for several offenses under the Representation of People Act. Mrs. Gandhi then uses her powers to clamp Emergency, taking away all powers of the judiciary, giving police virtually unlimited powers to the Police to detain anyone under the National Security Act, imprisoning leaders of all political parties, empowering her son, Sanjay Gandhi, to indiscriminately carry out Human Rights abuses in order to fulfill her ""Family Planning"" mandate, and her 20-point program. Vikram's father is one such person who is arrested and held in a cell. Siddharth also is on the run; Vikram, who was never a part of this struggle, himself becomes entangled in it.",['120'],"India, France","Hindi, English",,7.9,411469
Helmet,2021,"Comedy, Drama",Satram Ramani,Nothing from IMDB,"Aparshakti Khurana, Abhishek Banerjee, Ashish Verma, Pranutan Bahl, Puneet Singh, Sharib Hashmi, Deepankar Jain, Anurita Jha, Jameel Khan, Tauqeer Khan","Lucky is a singer in a band which performs at weddings. But he wants to open his own band someday. He's in love with Rupali, whose father is a wealthy man and wants to get her married off to another guy. Lucky needs to prove to Rupali's dad that he is capable of marrying her. Desperate to make some quick money, Lucky and his friends rob an e-commerce company truck. But to their surprise, the looted boxes contain condoms instead of electronic gadgets. What will Lucky do? Will they be able to sell the condoms in a town that shies away from it?",['104'],India,Hindi,,6.5,11460818
Hera Pheri,2000,"Action, Comedy, Crime, Drama",Priyadarshan,Nothing from IMDB,"Akshay Kumar, Suniel Shetty, Paresh Rawal, Tabu, Om Puri, Gulshan Grover, Kulbhushan Kharbanda, Mukesh Khanna, Govardhan Asrani, Razak Khan","Baburao is a landlord in India, who is very near-sighted, and always in financial trouble. He has a tenant named Raja, who has not paid his rent for several months. He also has anther tenant named Shyam, who has come to the city to look for a job in his late father's place, but is unable to find employment. The three men quarrel amongst themselves frequently. Then one day, the three men get a phone call from a kidnapper named Kabira, and decide to make use of this phone call to overcome their financial problems - pretend to be the real kidnappers, increase the ransom amount, keep the incremental amount for themselves, and then give the original ransom demanded to Kabira. Will they get away with this idea?",['156'],India,Hindi,,8.2,242519
Hera Pheri,2000,"Action, Comedy, Crime, Drama",Priyadarshan,Nothing from IMDB,"Akshay Kumar, Suniel Shetty, Paresh Rawal, Tabu, Om Puri, Gulshan Grover, Kulbhushan Kharbanda, Mukesh Khanna, Govardhan Asrani, Razak Khan","Baburao is a landlord in India, who is very near-sighted, and always in financial trouble. He has a tenant named Raja, who has not paid his rent for several months. He also has anther tenant named Shyam, who has come to the city to look for a job in his late father's place, but is unable to find employment. The three men quarrel amongst themselves frequently. Then one day, the three men get a phone call from a kidnapper named Kabira, and decide to make use of this phone call to overcome their financial problems - pretend to be the real kidnappers, increase the ransom amount, keep the incremental amount for themselves, and then give the original ransom demanded to Kabira. Will they get away with this idea?",['156'],India,Hindi,,8.2,242519
Red Riding: The Year of Our Lord 1983,2009,"Crime, Drama, History",Anand Tucker,Nothing from IMDB,"David Morrissey, Lisa Howard, Chris Walker, Shaun Dooley, Jim Carter, Warren Clarke, Sean Bean, Sean Harris, Steven Robertson, Tony Mooney","A murky tale. A child goes missing in West Yorkshire, one of several over ten years; the police find a patsy, an acquaintance of Michael, a blood simple man serving a life sentence for another girl's death. Michael's mother asks John Piggott, a burned-out solicitor, to look into her son's conviction; Piggott finds injustices in current and past cases. Maurice Jobson, part of a group of corrupt cops, searches for the missing girl, involves a medium, finds nothing, leans hard on Piggott, and may be tiring of the sham. He's warned off going soft. Is there moral strength anywhere capable of facing down the cabal?",['100'],United Kingdom,English,,7.1,1259573
Heroine,2012,Drama,Madhur Bhandarkar,Nothing from IMDB,"Kareena Kapoor, Arjun Rampal, Randeep Hooda, Shahana Goswami, Pooja Chopra, Divya Dutta, Rashmi Nigam, Pallavi Sharda, Ranvir Shorey, Lillete Dubey","After his incredible run of women-centric films from Chandni Bar, Page 3, Satta and Corporate to the blockbuster Fashion, Madhur Bhandarkar now turns his lens inwards and presents his most ambitious work yet - Heroine. The film is based on the life and times of a superstar heroine from the dream factory we call 'Bollywood'. The film is a daring, shocking, glamorous, scandalous behind the scenes account of the reality behind the world of glitz and glamour that our film stars inhabit. For a country obsessed with films and film stars, Heroine will take audiences on a voyeuristic journey to see what really goes on behind the closed doors of make up rooms and vanity vans. It will give them a chance to go beyond the gorgeous smiles and politically correct quotes, to see what really happens in the lives of India's sweethearts. The bitching and the politics, the secrets and the lies, the incredible highs of fame and the lonely depths of failure.",['149'],India,Hindi,,5.0,1949548
Heropanti,2014,"Action, Romance",Sabbir Khan,Nothing from IMDB,"Tiger Shroff, Kriti Sanon, Parthaa Akerkar, Sunil Grover, Sandeepa Dhar, Priyamvada Kant, Lee Westwick, Sugandha Mishra, Karuna Verma, Prakash Raj","Rising from present India in the conflicting era of shining modernity and deep-rooted archaic traditions in the era of big city versus small towns, comes a love story sealed with an impossible fate. The story of the bold Bablu and the bratty Dimpy. Will Bablu and Dimpys love blossom under the terror of a brutal clan and the violent landscape it is set against. Heropanti is the story of today's youth, and the coming of age of its conflicting protagonists.",['146'],India,Hindi,,5.2,3142232
Heyy Babyy,2007,"Comedy, Drama",Sajid Khan,Nothing from IMDB,"Akshay Kumar, Fardeen Khan, Riteish Deshmukh, Vidya Balan, Juanna Sanghvi, Boman Irani, Ricky Sandhu, Shah Rukh Khan, Anupam Kher, Anupam Sharma","Arush Mehra lives a fairly wealthy lifestyle in Sydney, Australia along with two room-mates, Tanmay Joglekar, and Ali Hyder. He works for a food chain, while Tanmay entertains children as 'Eddy Teddy', and Ali takes care of their apartment. All three are womanizers and usually end up sleeping with around 30 different women every year. Arush travels to Delhi to attend Arjun's wedding, and this is where he meets with Isha Sahni, who also resides in Australia, he impresses and wins her over, both get intimate, and shortly thereafter Isha catches him sleeping with Devika, and both split up. Arush returns to Sydney and forgets about this incident. Then one day they find a baby right outside their door with a note to take care of her. The trio suspect each other of being the father, then attempt to get rid of the child, but change their mind, look after her, name her Angel, adore her, and start a frantic and hilarious search for her mother. A few months later Isha shows up, takes Angel in her possession and returns home. The trio now mend their ways, and Arush attempts in vain to win back Isha, and ends up challenging her to marry someone else in 7 days. With Isha's attractive looks and wealthy background it will not be long before she finds someone to wed her, and by the look of things Arush may end up never seeing Angel ever again.",['144'],India,Hindi,,6.0,806088
